openalex_id,doi,title,year,publication_date,type,cited_by_count,relevance_score,authors,source,dataset_mentioned,ml_match_count,matched_ml_terms,regime_selected,regime_match_count,matched_regime_terms,abstract
https://openalex.org/W2332661299,https://doi.org/10.3389/fmicb.2016.00329,Infection with and Carriage of Mycoplasma pneumoniae in Children,2016,2016-03-23,review,166,11.643496,"Patrick M. Meyer Sauteur, Wendy W. J. Unger, David Nadal, et al.",Frontiers in Microbiology,False,2,predictive; ann,T,0,,"""Atypical"" pneumonia was described as a distinct and mild form of community-acquired pneumonia (CAP) already before Mycoplasma pneumoniae had been discovered and recognized as its cause. M. pneumoniae is detected in CAP patients most frequently among school-aged children from 5 to 15 years of age, with a decline after adolescence and tapering off in adulthood. Detection rates by polymerase chain reaction (PCR) or serology in children with CAP admitted to the hospital amount 4-39%. Although the infection is generally mild and self-limiting, patients of every age can develop severe or extrapulmonary disease. Recent studies indicate that high rates of healthy children carry M. pneumoniae in the upper respiratory tract and that current diagnostic PCR or serology cannot discriminate between M. pneumoniae infection and carriage. Further, symptoms and radiologic features are not specific for M. pneumoniae infection. Thus, patients may be unnecessarily treated with antimicrobials against M. pneumoniae. Macrolides are the first-line antibiotics for this entity in children younger than 8 years of age. Overall macrolides are extensively used worldwide, and this has led to the emergence of macrolide-resistant M. pneumoniae, which may be associated with severe clinical features and more extrapulmonary complications. This review focuses on the characteristics of M. pneumoniae infections in children, and exemplifies that simple clinical decision rules may help identifying children at high risk for CAP due to M. pneumoniae. This may aid physicians in prescribing appropriate first-line antibiotics, since current diagnostic tests for M. pneumoniae infection are not reliably predictive."
https://openalex.org/W4399458355,https://doi.org/10.1136/gutjnl-2023-331579,Opening the doors of precision medicine: novel tools to assess intestinal barrier in inflammatory bowel disease and colitis-associated neoplasia,2024,2024-06-08,review,80,11.068969,"Marietta Iacucci, Giovanni Santacroce, Snehali Majumder, et al.",Gut,False,2,artificial intelligence; prediction,T,0,,"Mounting evidence underscores the pivotal role of the intestinal barrier and its convoluted network with diet and intestinal microbiome in the pathogenesis of inflammatory bowel disease (IBD) and colitis-associated colorectal cancer (CRC). Moreover, the bidirectional association of the intestinal barrier with the liver and brain, known as the gut-brain axis, plays a crucial role in developing complications, including extraintestinal manifestations of IBD and CRC metastasis. Consequently, barrier healing represents a crucial therapeutic target in these inflammatory-dependent disorders, with barrier assessment predicting disease outcomes, response to therapy and extraintestinal manifestations.New advanced technologies are revolutionising our understanding of the barrier paradigm, enabling the accurate assessment of the intestinal barrier and aiding in unravelling the complexity of the gut-brain axis. Cutting-edge endoscopic imaging techniques, such as ultra-high magnification endocytoscopy and probe-based confocal laser endomicroscopy, are new technologies allowing real-time exploration of the 'cellular' intestinal barrier. Additionally, novel advanced spatial imaging technology platforms, including multispectral imaging, upconversion nanoparticles, digital spatial profiling, optical spectroscopy and mass cytometry, enable a deep and comprehensive assessment of the 'molecular' and 'ultrastructural' barrier. In this promising landscape, artificial intelligence plays a pivotal role in standardising and integrating these novel tools, thereby contributing to barrier assessment and prediction of outcomes.Looking ahead, this integrated and comprehensive approach holds the promise of uncovering new therapeutic targets, breaking the therapeutic ceiling in IBD. Novel molecules, dietary interventions and microbiome modulation strategies aim to restore, reinforce, or modulate the gut-brain axis. These advancements have the potential for transformative and personalised approaches to managing IBD."
https://openalex.org/W2997888691,https://doi.org/10.3389/fpsyt.2019.00877,A Roadmap for Integrating Neuroscience Into Addiction Treatment: A Consensus of the Neuroscience Interest Group of the International Society of Addiction Medicine,2019,2019-12-23,review,97,10.889683,"Antonio Verdejo‐García, Valentina Lorenzetti, Victoria Manning, et al.",Frontiers in Psychiatry,False,2,prediction; algorithm,T,0,,"Although there is general consensus that altered brain structure and function underpins addictive disorders, clinicians working in addiction treatment rarely incorporate neuroscience-informed approaches into their practice. We recently launched the Neuroscience Interest Group within the International Society of Addiction Medicine (ISAM-NIG) to promote initiatives to bridge this gap. This article summarizes the ISAM-NIG key priorities and strategies to achieve implementation of addiction neuroscience knowledge and tools for the assessment and treatment of substance use disorders. We cover two assessment areas: cognitive assessment and neuroimaging, and two interventional areas: cognitive training/remediation and neuromodulation, where we identify key challenges and proposed solutions. We reason that incorporating cognitive assessment into clinical settings requires the identification of constructs that predict meaningful clinical outcomes. Other requirements are the development of measures that are easily-administered, reliable, and ecologically-valid. Translation of neuroimaging techniques requires the development of diagnostic and prognostic biomarkers and testing the cost-effectiveness of these biomarkers in individualized prediction algorithms for relapse prevention and treatment selection. Integration of cognitive assessments with neuroimaging can provide multilevel targets including neural, cognitive, and behavioral outcomes for neuroscience-informed interventions. Application of neuroscience-informed interventions including cognitive training/remediation and neuromodulation requires clear pathways to design treatments based on multilevel targets, additional evidence from randomized trials and subsequent clinical implementation, including evaluation of cost-effectiveness. We propose to address these challenges by promoting international collaboration between researchers and clinicians, developing harmonized protocols and data management systems, and prioritizing multi-site research that focuses on improving clinical outcomes."
https://openalex.org/W2392832565,,Robust adaptive model predictive filtering algorithm and application to integrated navigation,2011,2011-01-01,article,2,10.847842,Jiang Wei-wei,Journal of Chinese Inertial Technology,False,2,predictive; algorithm,T,0,,"In order to improve the navigation positioning accuracy of the strapdown inertial navigation system(SINS)/celestial navigation system(CNS)/synthetic aperture radar(SAR) integrated navigation systems,this paper presents a robust adaptive model predictive filtering algorithm based on the research of model predictive filtering and robust adaptive filtering.First,the algorithm estimates the model error in real-time to correct the system model by model predictive filtering to resist the effects of model errors on solution accuracy of navigation.Then,the algorithm controls the influences of abnormal observation on solution accuracy of navigation by the robust adaptive factor.The proposed algorithm is applied to SINS/CNS/SAR integrated navigation system and compared with the robust adaptive filter.Simulation results demonstrate that the attitude angle error,velocity error and position error obtained by the robust adaptive model predictive filtering are within,and respectively;and the filtering performance is significantly superior to that of the robust adaptive filter.The results show that the proposed filtering method can effectively inhibit the impacts of model errors and abnormal observation on the navigation solution,thus improving the precision of navigation system."
https://openalex.org/W4405785450,https://doi.org/10.1109/iros58592.2024.10801945,Tightly-Coupled Factor Graph Formulation For Radar-Inertial Odometry,2024,2024-10-14,article,5,10.724436,"Jan Michalczyk, Julius Quell, Florian Steidle, et al.",NA,False,2,ann; auc,T,0,,"In this paper, we present a Radar-Inertial Odometry (RIO) method based on the nonlinear optimization of factor graphs in a sliding window fashion. Our method makes use of a light-weight, low-power, inexpensive and commonly available hardware enabling easy deployment on small Unmanned Aerial Vehicles (UAV)s. We keep the state estimation problem bounded by employing partial marginalization of the oldest states, rendering the method real-time capable. We compare the implemented approach to the state-of-the-art multi-state Extended Kalman Filter (EKF)-based method in a one-to-one fashion. That is, we implemented in a single custom C++ RIO framework both estimation back-ends with all other parts shared and thus identical for a fair direct comparison. In the real-world flight experiments, we compare the two methods and show that both perform similarly in terms of accuracy when the linearization point is not far from the true state. Upon wrong initialization, the factor graph approach heavily outperforms the EKF approach. We also acknowledge that the influence of undetected outliers can overwhelm the inherent benefits of the nonlinear optimization approach leading to the insight that the estimator front-end has an important (and often underestimated) role in the overall performance. The open source code and datasets can be found here: https://github.com/aau-cns/aaucns_rio."
https://openalex.org/W2136949294,https://doi.org/10.1109/isscaa.2010.5632218,Research on scheme and algorithm of high-precision fault-tolerant integrated navigation for HALE UAV,2010,2010-06-01,article,2,10.069507,"Haiming Chen, Zhi Xiong, Rong Wang, et al.",NA,False,2,algorithm; ann,T,0,,"To meet the need of high-precision navigation for HALE (high-altitude long-endurance) UAV (unmanned aerial vehicle), multi-sensor fault-tolerant autonomous navigation system was researched. For the shortcoming that the GPS signal is easily interfered by electromagnetic techniques, combining sundry integrated navigation patterns such as the INS/CNS integrated navigation, the INS/SAR (Synthetic Aperture Radar) integrated navigation, and other autonomous navigation system, the fault-tolerant federated filter scheme is proposed in this paper. This scheme can effectively take advantage of multi-sensor information redundancy. When the GPS system failure occurred, the system can effectively detect and isolate the corresponding failure subsystem, and at this time the INS/CNS integrated navigation system plays a leading role in the navigation system to maintain a certain degree of navigation accuracy. By importing the SAR-aided navigation system in the terminal, the system can achieve high-precision navigation positioning. The integrated navigation system can detecte failure in rapid speed, so it has a high application value in practical engineering. The simulation results by covariance analysis show that the proposed navigation scheme is feasible, and this navigation scheme has important theoretical reference value to improve accuracy and reliability of integrated navigation system for the HALE UAV."
https://openalex.org/W4400657382,https://doi.org/10.1038/s41591-024-03094-4,Consumer wearable devices for evaluation of heart rate control using digoxin versus beta-blockers: the RATE-AF randomized trial,2024,2024-07-01,article,37,9.701086,"Simrat Gill, Andrey Barsky, Xin Guan, et al.",Nature Medicine,False,2,neural network; convolutional neural network,T,0,,"Consumer-grade wearable technology has the potential to support clinical research and patient management. Here, we report results from the RATE-AF trial wearables study, which was designed to compare heart rate in older, multimorbid patients with permanent atrial fibrillation and heart failure who were randomized to treatment with either digoxin or beta-blockers. Heart rate (n = 143,379,796) and physical activity (n = 23,704,307) intervals were obtained from 53 participants (mean age 75.6 years (s.d. 8.4), 40% women) using a wrist-worn wearable linked to a smartphone for 20 weeks. Heart rates in participants treated with digoxin versus beta-blockers were not significantly different (regression coefficient 1.22 (95% confidence interval (CI) -2.82 to 5.27; P = 0.55); adjusted 0.66 (95% CI -3.45 to 4.77; P = 0.75)). No difference in heart rate was observed between the two groups of patients after accounting for physical activity (P = 0.74) or patients with high activity levels (≥30,000 steps per week; P = 0.97). Using a convolutional neural network designed to account for missing data, we found that wearable device data could predict New York Heart Association functional class 5 months after baseline assessment similarly to standard clinical measures of electrocardiographic heart rate and 6-minute walk test (F1 score 0.56 (95% CI 0.41 to 0.70) versus 0.55 (95% CI 0.41 to 0.68); P = 0.88 for comparison). The results of this study indicate that digoxin and beta-blockers have equivalent effects on heart rate in atrial fibrillation at rest and on exertion, and suggest that dynamic monitoring of individuals with arrhythmia using wearable technology could be an alternative to in-person assessment. ClinicalTrials.gov identifier: NCT02391337 ."
https://openalex.org/W3005188734,https://doi.org/10.1038/s41467-019-13825-8,A deep learning system accurately classifies primary and metastatic cancers using passenger mutation patterns,2020,2020-02-05,article,234,9.502113,"Wei Jiao, Gurnit Atwal, Paz Polak, et al.",Nature Communications,False,2,deep learning; classifier,T,0,,"In cancer, the primary tumour's organ of origin and histopathology are the strongest determinants of its clinical behaviour, but in 3% of cases a patient presents with a metastatic tumour and no obvious primary. Here, as part of the ICGC/TCGA Pan-Cancer Analysis of Whole Genomes (PCAWG) Consortium, we train a deep learning classifier to predict cancer type based on patterns of somatic passenger mutations detected in whole genome sequencing (WGS) of 2606 tumours representing 24 common cancer types produced by the PCAWG Consortium. Our classifier achieves an accuracy of 91% on held-out tumor samples and 88% and 83% respectively on independent primary and metastatic samples, roughly double the accuracy of trained pathologists when presented with a metastatic tumour without knowledge of the primary. Surprisingly, adding information on driver mutations reduced accuracy. Our results have clinical applicability, underscore how patterns of somatic passenger mutations encode the state of the cell of origin, and can inform future strategies to detect the source of circulating tumour DNA."
https://openalex.org/W2964351230,https://doi.org/10.1155/2019/9894571,From Broca and Wernicke to the Neuromodulation Era: Insights of Brain Language Networks for Neurorehabilitation,2019,2019-07-22,review,75,9.236661,"Grigorios Nasios, Efthimios Dardiotis, Lambros Messinis",Behavioural Neurology,False,2,neural network; neural networks,T,0,,"Communication in humans activates almost every part of the brain. Of course, the use of language predominates, but other cognitive functions such as attention, memory, emotion, and executive processes are also involved. However, in order to explain how our brain ""understands,"" ""speaks,"" and ""writes,"" and in order to rehabilitate aphasic disorders, neuroscience has faced the challenge for years to reveal the responsible neural networks. Broca and Wernicke (and Lichtheim and many others), during the 19th century, when brain research was mainly observational and autopsy driven, offered fundamental knowledge about the brain and language, so the Wernicke-Geschwind model appeared and aphasiology during the 20th century was based on it. This model is still useful for a first approach into the classical categorization of aphasic syndromes, but it is outdated, because it does not adequately describe the neural networks relevant for language, and it offers a modular perspective, focusing mainly on cortical structures. During the last three decades, neuroscience conquered new imaging, recording, and manipulation techniques for brain research, and a new model of the functional neuroanatomy of language was developed, the dual stream model, consisting of two interacting networks (""streams""), one ventral, bilaterally organized, for language comprehension, and one dorsal, left hemisphere dominant, for production. This new model also has its limitations but helps us to understand, among others, why patients with different brain lesions can have similar language impairments. Furthermore, interesting aspects arise from studying language functions in aging brains (and also in young, developing brains) and in cognitively impaired patients and neuromodulation effects on reorganization of brain networks subserving language. In this selective review, we discuss methods for coupling new knowledge regarding the functional reorganization of the brain with sophisticated techniques capable of activating the available supportive networks in order to provide improved neurorehabilitation strategies for people suffering from neurogenic communication disorders."
https://openalex.org/W4233923317,https://doi.org/10.21437/interspeech.2020-32,"The INTERSPEECH 2020 Computational Paralinguistics Challenge: Elderly Emotion, Breathing &amp; Masks",2020,2020-10-25,article,32,9.162877,"Björn W. Schuller, Anton Batliner, Christian Bergler, et al.",NA,False,2,classifier; cnn,T,0,,"The INTERSPEECH 2020 Computational Paralinguistics Challenge addresses three different problems for the first time in a research competition under well-defined conditions: In the Elderly Emotion Sub-Challenge, arousal and valence in the speech of elderly individuals have to be modelled as a 3-class problem; in the Breathing Sub-Challenge, breathing has to be assessed as a regression problem; and in the Mask Sub-Challenge, speech without and with a surgical mask has to be told apart.We describe the Sub-Challenges, baseline feature extraction, and classifiers based on the 'usual' COMPARE and BoAW features as well as deep unsupervised representation learning using the AUDEEP toolkit, and deep feature extraction from pre-trained CNNs using the DEEP SPECTRUM toolkit; in addition, we partially add deep end-to-end sequential modelling, and, for the first time in the challenge, linguistic analysis."
https://openalex.org/W2561197809,https://doi.org/10.1093/brain/aww296,An abnormal periventricular magnetization transfer ratio gradient occurs early in multiple sclerosis,2016,2016-11-01,article,78,9.10322,"J William L Brown, Matteo Pardini, Wallace Brownlee, et al.",Brain,False,2,logistic regression; ann,T,0,,"In established multiple sclerosis, tissue abnormality-as assessed using magnetization transfer ratio-increases close to the lateral ventricles. We aimed to determine whether or not (i) these changes are present from the earliest clinical stages of multiple sclerosis; (ii) they occur independent of white matter lesions; and (iii) they are associated with subsequent conversion to clinically definite multiple sclerosis and disability. Seventy-one subjects had MRI scanning a median of 4.6 months after a clinically isolated optic neuritis (49 females, mean age 33.5 years) and were followed up clinically 2 and 5 years later. Thirty-seven healthy controls (25 females, mean age 34.4 years) were also scanned. In normal-appearing white matter, magnetization transfer ratio gradients were measured 1-5 mm and 6-10 mm from the lateral ventricles. In control subjects, magnetization transfer ratio was highest adjacent to the ventricles and decreased with distance from them; in optic neuritis, normal-appearing white matter magnetization transfer ratio was lowest adjacent to the ventricles, increased over the first 5 mm, and then paralleled control values. The magnetization transfer ratio gradient over 1-5 mm differed significantly between the optic neuritis and control groups [+0.059 percentage units/mm (pu/mm) versus -0.033 pu/mm, P = 0.010], and was significantly steeper in those developing clinically definite multiple sclerosis within 2 years compared to those who did not (0.132 pu/mm versus 0.016 pu/mm, P = 0.020). In multivariate binary logistic regression the magnetization transfer ratio gradient was independently associated with the development of clinically definite multiple sclerosis within 2 years (magnetization transfer ratio gradient odds ratio 61.708, P = 0.023; presence of T<sub>2</sub> lesions odds ratio 8.500, P = 0.071). At 5 years, lesional measures overtook magnetization transfer ratio gradients as significant predictors of conversion to multiple sclerosis. The magnetization transfer ratio gradient was not significantly affected by the presence of brain lesions [T<sub>2</sub> lesions (P = 0.918), periventricular T<sub>2</sub> lesions (P = 0.580) or gadolinium-enhancing T<sub>1</sub> lesions (P = 0.724)]. The magnetization transfer ratio gradient also correlated with Expanded Disability Status Scale score 5 years later (Spearman r = 0.313, P = 0.027). An abnormal periventricular magnetization transfer ratio gradient occurs early in multiple sclerosis, is clinically relevant, and may arise from one or more mechanisms that are at least partly independent of lesion formation."
