openalex_id,doi,title,year,publication_date,type,cited_by_count,relevance_score,authors,source,dataset_mentioned,ml_match_count,matched_ml_terms,regime_selected,regime_match_count,matched_regime_terms,abstract
https://openalex.org/W2063980734,https://doi.org/10.1371/journal.pone.0022947,The Impact of Utilizing Different Optical Coherence Tomography Devices for Clinical Purposes and in Multiple Sclerosis Trials,2011,2011-08-11,article,68,9.540742,"Christina Warner, Stephanie B. Syc‐Mazurek, Aleksandra Stankiewicz, et al.",PLoS ONE,False,1,ann,T,0,,"Optical coherence tomography (OCT) derived retinal measures, particularly peri-papillary retinal nerve fiber layer (RNFL) thickness, have been proposed as outcome measures in remyelinating and neuroprotective trials in multiple sclerosis (MS). With increasing utilization of multiple centers to improve power, elucidation of the impact of different OCT technologies is crucial to the design and interpretation of such studies. In this study, we assessed relation and agreement between RNFL thickness and total macular volume (in MS and healthy controls) derived from three commonly used OCT devices: Stratus time-domain OCT, and Cirrus HD-OCT and Spectralis, two spectral-domain (SD) OCT devices. OCT was performed on both Cirrus HD-OCT and Stratus in 229 participants and on both Cirrus HD-OCT and Spectralis in a separate cohort of 102 participants. Pearson correlation and Bland-Altman analyses were used to assess correlation and agreement between devices. All OCT retinal measures correlated highly between devices. The mean RNFL thickness was 7.4 µm lower on Cirrus HD-OCT than Stratus, indicating overall poor agreement for this measurement between these machines. Further, the limits of agreement (LOA) between Cirrus HD-OCT and Stratus were wide (-4.1 to 18.9 µm), indicating poor agreement at an individual subject level. The mean RNFL thickness was 1.94 µm (LOA: -5.74 to 9.62 µm) higher on Spectralis compared to Cirrus HD-OCT, indicating excellent agreement for this measurement across this cohort. Although these data indicate that these three devices agree poorly at an individual subject level (evidenced by wide LOA in both study cohorts) precluding their co-utilization in everyday practice, the small difference for mean measurements between Cirrus HD-OCT and Spectralis indicate pooled results from these two SD-devices could be used as outcome measures in clinical trials, provided patients are scanned on the same machine throughout the trial, similar to the utilization of multiple different MRI platforms in MS clinical trials."
https://openalex.org/W2081437435,https://doi.org/10.1155/2015/809835,Role of Rebiopsy in Relapsed Non-Small Cell Lung Cancer for Directing Oncology Treatments,2015,2015-01-01,review,53,9.537173,Antti Jekunen,Journal of Oncology,False,1,ann,T,0,,"Background. Currently, few rebiopsies are performed in relapses of advanced non-small cell lung cancer. They are not customary in clinical practice of lung cancer. However, it is not possible to properly target treatments in cases of relapse without knowing the nature of new lesions. Design. This paper comprehensively summarizes the available literature about rebiopsy and broadly discusses the importance of rebiopsy in advanced non-small cell lung cancer. Results. Altogether 560 abstracts were used as material for further analysis. 19 articles were about clinical rebiopsy in lung cancer and were reviewed in detailed manner. Conclusions. This review shows that rebiopsy is feasible in non-small cell lung cancer, and success rates can be high if rebiopsy is accompanied by adequate evaluation before biopsy. Its use may resolve the difficulties in sampling bias and detecting changes in cancer characteristics. In cases where treatment was selected based on tissue characteristics that then change, the treatment selection process must be repeated while considering new characteristics of the tumor. Rebiopsy may be used to predict therapeutic resistance and consequently redirect targeted therapies. Such knowledge may resolve the difficulties in sampling bias and also in selecting preexisting clones or formulating drug-resistant ones. Rebiopsy should be performed more often in non-small cell lung cancer."
https://openalex.org/W2986638216,https://doi.org/10.2217/cns-2019-0014,Clinical activity of the <i>EGFR</i> tyrosine kinase inhibitor osimertinib in <i>EGFR</i> -mutant glioblastoma,2019,2019-11-15,review,52,9.299206,"Igor Makhlin, Ryan Salinas, Daniel Zhang, et al.",CNS Oncology,False,1,gbm,T,0,,"Glioblastoma (GBM) is the most common primary malignant brain tumor in adults and carries a dismal prognosis. The <i>EGFR</i> gene is among the most commonly deranged genes in GBM and thus an important therapeutic target. We report the case of a young female with heavily pretreated <i>EGFR</i>-mutated GBM, for whom we initiated osimertinib, an oral, third-generation tyrosine kinase inhibitor that irreversibly inhibits EGFR and has significant brain penetration. We then review some of the main challenges in targeting EGFR, including lack of central nervous system penetration with most tyrosine kinase inhibitors, molecular heterogeneity of GBM and the need for enhanced specificity for the <i>EGFR</i> mutations relevant in GBM."
https://openalex.org/W2788398649,https://doi.org/10.1146/annurev-immunol-042617-053420,The Immune Response to<i>Mycobacterium tuberculosis</i>in HIV-1-Coinfected Persons,2018,2018-02-28,review,122,9.144431,"Hanif Esmail, Catherine Riou, Elsa Du Bruyn, et al.",Annual Review of Immunology,False,1,ann,T,0,,"Globally, about 36.7 million people were living with HIV infection at the end of 2015. The most frequent infection co-occurring with HIV-1 is Mycobacterium tuberculosis-374,000 deaths per annum are attributable to HIV-tuberculosis, 75% of those occurring in Africa. HIV-1 infection increases the risk of tuberculosis by a factor of up to 26 and alters its clinical presentation, complicates diagnosis and treatment, and worsens outcome. Although HIV-1-induced depletion of CD4<sup>+</sup> T cells underlies all these effects, more widespread immune deficits also contribute to susceptibility and pathogenesis. These defects present a challenge to understand and ameliorate, but also an opportunity to learn and optimize mechanisms that normally protect people against tuberculosis. The most effective means to prevent and ameliorate tuberculosis in HIV-1-infected people is antiretroviral therapy, but this may be complicated by pathological immune deterioration that in turn requires more effective host-directed anti-inflammatory therapies to be derived."
https://openalex.org/W2075209268,https://doi.org/10.2478/raon-2013-0017,The role of Fluorine-18-Fluorodeoxyglucose positron emission tomography in staging and restaging of patients with osteosarcoma,2013,2013-02-22,article,66,9.104499,"Natale Quartuccio, Giorgio Treglia, Marco Salsano, et al.",Radiology and Oncology,False,1,ann,T,0,,Metabolic imaging may provide additional information in the evaluation of OS patients. The combination of FDG-PET or FDG-PET/CT with conventional imaging methods seems to be a valuable tool in the staging and restaging of OS and may have a relevant impact on the treatment planning.
https://openalex.org/W1511885491,https://doi.org/10.1109/ipdps.2015.27,SPLATT: Efficient and Parallel Sparse Tensor-Matrix Multiplication,2015,2015-05-01,article,217,9.099776,"Shaden Smith, Niranjay Ravindran, Nicholas D. Sidiropoulos, et al.",NA,False,1,algorithm,T,0,,"Multi-dimensional arrays, or tensors, are increasingly found in fields such as signal processing and recommender systems. Real-world tensors can be enormous in size and often very sparse. There is a need for efficient, high-performance tools capable of processing the massive sparse tensors of today and the future. This paper introduces SPLATT, a C library with shared-memory parallelism for three-mode tensors. SPLATT contains algorithmic improvements over competing state of the art tools for sparse tensor factorization. SPLATT has a fast, parallel method of multiplying a matricide tensor by a Khatri-Rao product, which is a key kernel in tensor factorization methods. SPLATT uses a novel data structure that exploits the sparsity patterns of tensors. This data structure has a small memory footprint similar to competing methods and allows for the computational improvements featured in our work. We also present a method of finding cache-friendly reordering and utilizing them with a novel form of cache tiling. To our knowledge, this is the first work to investigate reordering and cache tiling in this context. SPLATT averages almost 30x speedup compared to our baseline when using 16 threads and reaches over 80x speedup on NELL-2."
https://openalex.org/W2992284282,https://doi.org/10.1024/0301-1526/a000834,ESVM Guideline on peripheral arterial disease,2019,2019-12-01,article,250,8.971055,"Frank Ulrich, Sigrid Nikol, J. J. F. Belch, et al.",VASA,False,1,svm,T,0,,c It is recommended that recognition be given that patients with PAD have a high risk of vascular events in other vascular beds.
https://openalex.org/W3045482196,https://doi.org/10.1007/s10488-020-01065-8,Improving Mental Health Services: A 50-Year Journey from Randomized Experiments to Artificial Intelligence and Precision Mental Health,2020,2020-07-26,article,183,8.688122,Leonard Bickman,Administration and Policy in Mental Health and Mental Health Services Research,False,1,artificial intelligence,T,0,,
https://openalex.org/W2901644332,https://doi.org/10.1093/ecco-jcc/jjy185,"Cannabis, Cannabinoids, and the Endocannabinoid System—Is there Therapeutic Potential for Inflammatory Bowel Disease?",2018,2018-11-07,review,69,8.619035,"Tim Ambrose, Alison Simmons",Journal of Crohn s and Colitis,False,1,ann,T,0,,"Cannabis sativa and its extracts have been used for centuries, both medicinally and recreationally. There is accumulating evidence that exogenous cannabis and related cannabinoids improve symptoms associated with inflammatory bowel disease [IBD], such as pain, loss of appetite, and diarrhoea. In vivo, exocannabinoids have been demonstrated to improve colitis, mainly in chemical models. Exocannabinoids signal through the endocannabinoid system, an increasingly understood network of endogenous lipid ligands and their receptors, together with a number of synthetic and degradative enzymes and the resulting products. Modulating the endocannabinoid system using pharmacological receptor agonists, genetic knockout models, or inhibition of degradative enzymes have largely shown improvements in colitis in vivo. Despite these promising experimental results, this has not translated into meaningful benefits for human IBD in the few clinical trials which have been conducted to date, the largest study being limited by poor medication tolerance due to the Δ9-tetrahydrocannabinol component. This review article synthesises the current literature surrounding the modulation of the endocannabinoid system and administration of exocannabinoids in experimental and human IBD. Findings of clinical surveys and studies of cannabis use in IBD are summarised. Discrepancies in the literature are highlighted together with identifying novel areas of interest."
https://openalex.org/W4403072897,https://doi.org/10.3390/ijms251910625,Blood–Brain Barrier Disruption in Neuroimmunological Disease,2024,2024-10-02,review,43,8.518884,"Fumitaka Shimizu, Masayuki Nakamori",International Journal of Molecular Sciences,False,1,ann,T,0,,"The blood-brain barrier (BBB) acts as a structural and functional barrier for brain homeostasis. This review highlights the pathological contribution of BBB dysfunction to neuroimmunological diseases, including multiple sclerosis (MS), neuromyelitis optica spectrum disorder (NMOSD), myelin oligodendrocyte glycoprotein antibody-associated disease (MOGAD), autoimmune encephalitis (AE), and paraneoplastic neurological syndrome (PNS). The transmigration of massive lymphocytes across the BBB caused by the activation of cell adhesion molecules is involved in the early phase of MS, and dysfunction of the cortical BBB is associated with the atrophy of gray matter in the late phase of MS. At the onset of NMOSD, increased permeability of the BBB causes the entry of circulating AQP4 autoantibodies into the central nervous system (CNS). Recent reports have shown the importance of glucose-regulated protein (GRP) autoantibodies as BBB-reactive autoantibodies in NMOSD, which induce antibody-mediated BBB dysfunction. BBB breakdown has also been observed in MOGAD, NPSLE, and AE with anti-NMDAR antibodies. Our recent report demonstrated the presence of GRP78 autoantibodies in patients with MOGAD and the molecular mechanism responsible for GRP78 autoantibody-mediated BBB impairment. Disruption of the BBB may explain the symptoms in the brain and cerebellum in the development of PNS, as it induces the entry of pathogenic autoantibodies or lymphocytes into the CNS through autoimmunity against tumors in the periphery. GRP78 autoantibodies were detected in paraneoplastic cerebellar degeneration and Lambert-Eaton myasthenic syndrome, and they were associated with cerebellar ataxia with anti-P/Q type voltage-gated calcium channel antibodies. This review reports that therapies affecting the BBB that are currently available for disease-modifying therapies for neuroimmunological diseases have the potential to prevent BBB damage."
https://openalex.org/W4384933462,https://doi.org/10.3389/fneur.2023.1187095,Data sharing in neurodegenerative disease research: challenges and learnings from the innovative medicines initiative public-private partnership model,2023,2023-07-20,review,14,8.507986,"Angela C. Bradshaw, Nigel Hughes, David Vállez García, et al.",Frontiers in Neurology,False,1,ann,T,0,,"Efficient data sharing is hampered by an array of organizational, ethical, behavioral, and technical challenges, slowing research progress and reducing the utility of data generated by clinical research studies on neurodegenerative diseases. There is a particular need to address differences between public and private sector environments for research and data sharing, which have varying standards, expectations, motivations, and interests. The Neuronet data sharing Working Group was set up to understand the existing barriers to data sharing in public-private partnership projects, and to provide guidance to overcome these barriers, by convening data sharing experts from diverse projects in the IMI neurodegeneration portfolio. In this policy and practice review, we outline the challenges and learnings of the WG, providing the neurodegeneration community with examples of good practices and recommendations on how to overcome obstacles to data sharing. These obstacles span organizational issues linked to the unique structure of cross-sectoral, collaborative research initiatives, to technical issues that affect the storage, structure and annotations of individual datasets. We also identify sociotechnical hurdles, such as academic recognition and reward systems that disincentivise data sharing, and legal challenges linked to heightened perceptions of data privacy risk, compounded by a lack of clear guidance on GDPR compliance mechanisms for public-private research. Focusing on real-world, neuroimaging and digital biomarker data, we highlight particular challenges and learnings for data sharing, such as data management planning, development of ethical codes of conduct, and harmonization of protocols and curation processes. Cross-cutting solutions and enablers include the principles of transparency, standardization and co-design - from open, accessible metadata catalogs that enhance findability of data, to measures that increase visibility and trust in data reuse."
https://openalex.org/W2140834646,https://doi.org/10.1186/1745-6150-2-35,Exosomal transfer of proteins and RNAs at synapses in the nervous system,2007,2007-01-01,review,259,8.504885,Neil R. Smalheiser,Biology Direct,False,1,prediction,T,0,,The model is consistent with the known cellular and molecular features of synaptic neurobiology and makes a number of predictions that can be tested in vitro and in vivo.
https://openalex.org/W4387787105,https://doi.org/10.2196/49331,A Closed-Loop Falls Monitoring and Prevention App for Multiple Sclerosis Clinical Practice: Human-Centered Design of the Multiple Sclerosis Falls InsightTrack,2023,2023-10-19,article,8,8.464774,"Valerie J. Block, Kanishka Koshal, Jaeleene Wijangco, et al.",JMIR Human Factors,False,1,algorithm,T,0,,"To our knowledge, this is the first falls app designed using human-centered design to prioritize behavior change and, while being accessible at home for patients, to deliver actionable data to clinicians at the point of care. MS-FIT streamlines data delivery to clinicians via an electronic health record-embedded window, aligning with the 5 rights approach. Leveraging MS-FIT for data processing and algorithms minimizes clinician load while boosting care quality. Our innovation seamlessly integrates real-world patient-generated data as well as clinical and community-level factors, empowering self-care and addressing the impact of falls in people with MS. Preliminary findings indicate wider relevance, extending to other neurological conditions associated with falls and their consequences."
https://openalex.org/W2095869882,https://doi.org/10.1093/brain/awn180,Up-regulation of slow K+ channels in peripheral motor axons: a transcriptional channelopathy in multiple sclerosis,2008,2008-08-12,article,32,8.463246,"Karl Ng, James Howells, John D. Pollard, et al.",Brain,False,1,ann,T,0,,"Spinal lesions produce plastic changes in motoneuron properties. We have documented the excitability of motor axons in the median nerve of 12 patients with multiple sclerosis and 50 normal subjects, hypothesizing that plastic changes in the properties of spinal motoneurons might be reflected in the properties of peripheral motor axons and be demonstrable in vivo. In the patients, there were changes in physiological measures of axonal excitability attributable to increased slow K(+) channel activity. Other measures were within control limits. These changes could be modelled by an 11% increase in slow K(+) current, with compensatory changes in membrane potential, suggesting increased expression of the responsible channels. The changes cannot be explained solely by changes in membrane potential and are not those expected if peripheral nerve axons were involved in the inflammatory process of multiple sclerosis. They probably represent a transcriptional channelopathy, due to up-regulation of channel expression. The abnormalities do not imply that peripheral nerve function has been significantly compromised, but they do suggest that the properties of the parent motoneurons have changed. This study thus provides evidence for plasticity in motoneuronal properties at a molecular level, the first such evidence for intact human subjects."
https://openalex.org/W2037350170,https://doi.org/10.1186/1744-859x-7-9,Mourning and melancholia revisited: correspondences between principles of Freudian metapsychology and empirical findings in neuropsychiatry,2008,2008-07-24,article,98,8.462378,"Robin Carhart‐Harris, Helen S. Mayberg, Andrea L. Malizia, et al.",Annals of General Psychiatry,False,1,ann,T,0,,"Freud began his career as a neurologist studying the anatomy and physiology of the nervous system, but it was his later work in psychology that would secure his place in history. This paper draws attention to consistencies between physiological processes identified by modern clinical research and psychological processes described by Freud, with a special emphasis on his famous paper on depression entitled 'Mourning and melancholia'. Inspired by neuroimaging findings in depression and deep brain stimulation for treatment resistant depression, some preliminary physiological correlates are proposed for a number of key psychoanalytic processes. Specifically, activation of the subgenual cingulate is discussed in relation to repression and the default mode network is discussed in relation to the ego. If these correlates are found to be reliable, this may have implications for the manner in which psychoanalysis is viewed by the wider psychological and psychiatric communities."
https://openalex.org/W3158885087,https://doi.org/10.1038/s41419-021-03724-6,Single cell transcriptional zonation of human psoriasis skin identifies an alternative immunoregulatory axis conducted by skin resident cells,2021,2021-05-06,article,97,8.422795,"Yuge Gao, Xinyu Yao, Yumeng Zhai, et al.",Cell Death and Disease,False,1,classifier,T,0,,"Psoriasis is the most common skin disease in adults. Current experimental and clinical evidences suggested the infiltrating immune cells could target local skin cells and thus induce psoriatic phenotype. However, recent studies indicated the existence of a potential feedback signaling loop from local resident skin cells to infiltrating immune cells. Here, we deconstructed the full-thickness human skins of both healthy donors and patients with psoriasis vulgaris at single cell transcriptional level, and further built a neural-network classifier to evaluate the evolutional conservation of skin cell types between mouse and human. Last, we systematically evaluated the intrinsic and intercellular molecular alterations of each cell type between healthy and psoriatic skin. Cross-checking with psoriasis susceptibility gene loci, cell-type based differential expression, and ligand-receptor communication revealed that the resident psoriatic skin cells including mesenchymal and epidermis cell types, which specifically harbored the target genes of psoriasis susceptibility loci, intensively evoked the expression of major histocompatibility complex (MHC) genes, upregulated interferon (INF), tumor necrosis factor (TNF) signalling and increased cytokine gene expression for primarily aiming the neighboring dendritic cells in psoriasis. The comprehensive exploration and pathological observation of psoriasis patient biopsies proposed an uncovered immunoregulatory axis from skin local resident cells to immune cells, thus provided a novel insight for psoriasis treatment. In addition, we published a user-friendly website to exhibit the transcriptional change of each cell type between healthy and psoriatic human skin."
https://openalex.org/W3182405170,https://doi.org/10.1007/s00259-021-05379-z,TSPO imaging in animal models of brain diseases,2021,2021-07-10,review,61,8.413553,"Nadja Van Camp, Sonia Lavisse, Pauline Roost, et al.",European Journal of Nuclear Medicine and Molecular Imaging,False,1,ann,T,0,,"Over the last 30 years, the 18-kDa TSPO protein has been considered as the PET imaging biomarker of reference to measure increased neuroinflammation. Generally assumed to image activated microglia, TSPO has also been detected in endothelial cells and activated astrocytes. Here, we provide an exhaustive overview of the recent literature on the TSPO-PET imaging (i) in the search and development of new TSPO tracers and (ii) in the understanding of acute and chronic neuroinflammation in animal models of neurological disorders. Generally, studies testing new TSPO radiotracers against the prototypic [<sup>11</sup>C]-R-PK11195 or more recent competitors use models of acute focal neuroinflammation (e.g. stroke or lipopolysaccharide injection). These studies have led to the development of over 60 new tracers during the last 15 years. These studies highlighted that interpretation of TSPO-PET is easier in acute models of focal lesions, whereas in chronic models with lower or diffuse microglial activation, such as models of Alzheimer's disease or Parkinson's disease, TSPO quantification for detection of neuroinflammation is more challenging, mirroring what is observed in clinic. Moreover, technical limitations of preclinical scanners provide a drawback when studying modest neuroinflammation in small brains (e.g. in mice). Overall, this review underlines the value of TSPO imaging to study the time course or response to treatment of neuroinflammation in acute or chronic models of diseases. As such, TSPO remains the gold standard biomarker reference for neuroinflammation, waiting for new radioligands for other, more specific targets for neuroinflammatory processes and/or immune cells to emerge."
https://openalex.org/W2965746437,https://doi.org/10.1007/s11886-019-1180-2,Cardiac Amyloidosis: Updates in Imaging,2019,2019-08-02,review,61,8.381544,"Liza Chacko, Raffaele Martone, Francesco Cappelli, et al.",Current Cardiology Reports,False,1,algorithm,T,0,,"Advances in imaging have led to earlier identification, improved diagnosis of CA and higher discriminatory power to differentiate CA from other hypertrophic phenocopies. The application of cardiac magnetic resonance imaging (CMR) has led to a deeper understanding of underlying pathophysiological processes in CA, owing largely to its intrinsic tissue characterization properties. The widespread adoption of bone scintigraphy algorithms has reduced the need for cardiac biopsy and improved diagnostic confidence in ATTR CA. As new treatments for CA are rapidly developing, there will be even greater reliance on imaging, as the requirement to diagnose disease earlier, monitor response and amend treatment strategies accordingly intensifies."
