openalex_id,doi,title,year,publication_date,type,cited_by_count,relevance_score,authors,source,dataset_mentioned,ml_match_count,matched_ml_terms,regime_selected,regime_match_count,matched_regime_terms,abstract
https://openalex.org/W2899505261,https://doi.org/10.1029/2018wr023194,Incorporating Antecedent Moisture Conditions and Intraevent Variability of Rainfall on Flood Frequency Analysis in Poorly Gauged Basins,2018,2018-10-29,article,56,6.2147136,"Luís Cea, Ignacio Fraga",Water Resources Research,False,1,prediction,T,1,temporal,"Abstract Rainfall‐runoff models are frequently used for the prediction of flood discharges from extreme rainfall data in poorly gauged basins. However, the conventional methods used to estimate the frequency of flood discharges from precipitation data do not incorporate a realistic representation of the spatial and temporal structure of rainfall at the study site nor of the antecedent soil moisture content. Temporally and spatially idealized rainfall patterns that do not represent properly the intraevent variability of rainfall are in general assumed. In this paper, we propose a methodology for flood frequency analysis based on the hydrological simulation of potentially hazardous real storm events. The aim of the proposed method is to incorporate the impact of the spatial and temporal intraevent variability of rainfall on flood discharge estimates without making strong assumptions about the spatial and temporal patterns of storms. It also includes a calibrated relation between the antecedent rainfall depth and the soil infiltration capacity, in order to consider the combined effect of antecedent soil moisture content and rainfall intensity. The flood frequency estimates obtained with the proposed methodology are compared to those estimated with a conventional method based on the definition of synthetic design hyetographs from local intensity‐duration‐frequency curves. The analysis is presented in two watersheds of 84 and 353 km 2 located in the NW of Spain. Results highlight the role of the antecedent soil moisture in flood frequency analysis and show that the conventional methodology tends to overestimate the flood discharges when compared to the proposed approach."
https://openalex.org/W4224849973,https://doi.org/10.3389/fnagi.2022.870957,Integrating Lipidomics and Transcriptomics Reveals the Crosstalk Between Oxidative Stress and Neuroinflammation in Central Nervous System Demyelination,2022,2022-04-25,article,59,6.1186743,"Zhijie Zhao, Ruizhe Zheng, Xiaojing Wang, et al.",Frontiers in Aging Neuroscience,False,1,ann,T,1,progression,"Multiple sclerosis (MS) is an incurable and progressive neurodegenerative disease that affects more than 2.5 million people worldwide and brings tremendous economic pressures to society. However, the pathophysiology of MS is still not fully elucidated, and there is no effective treatment. Demyelination is thought to be the primary pathophysiological alteration in MS, and our previous study found abnormal lipid metabolism in the demyelinated corpus callosum. Growing evidence indicates that central nervous system (CNS) demyelinating diseases never result from one independent factor, and the simultaneous participation of abnormal lipid metabolism, oxidative stress, and neuroinflammation could potentiate each other in the pathogenesis of MS. Therefore, a single omics analysis cannot provide a full description of any neurodegenerative disease. It has been demonstrated that oxidative stress and neuroinflammation are two reciprocal causative reasons for the progression of MS disease. However, the potential crosstalk between oxidative stress and neuroinflammation remains elusive so far. With an integrated analysis of targeted lipidomics and transcriptomics, our research presents the potential interaction between abnormalities of lipid metabolism, mitochondrial dysfunction, oxidative stress, and neuroinflammation in CNS demyelinating diseases. The findings of this paper may be used to identify possible targets for the therapy of CNS demyelinating diseases."
https://openalex.org/W4400097844,https://doi.org/10.1080/21678421.2024.2371986,Automated speech analytics in ALS: higher sensitivity of digital articulatory precision over the ALSFRS-R,2024,2024-06-26,article,3,5.19412,"Gabriela Stegmann, Chelsea Krantsevich, Julie Liss, et al.",Amyotrophic Lateral Sclerosis and Frontotemporal Degeneration,False,1,algorithm,T,1,progression,"<i>Objective</i>: Although studies have shown that digital measures of speech detected ALS speech impairment and correlated with the ALSFRS-R speech item, no study has yet compared their performance in detecting speech changes. In this study, we compared the performances of the ALSFRS-R speech item and an algorithmic speech measure in detecting clinically important changes in speech. Importantly, the study was part of a FDA submission which received the breakthrough device designation for monitoring ALS; we provide this paper as a roadmap for validating other speech measures for monitoring disease progression. <i>Methods</i>: We obtained ALSFRS-R speech subscores and speech samples from participants with ALS. We computed the minimum detectable change (MDC) of both measures; using clinician-reported listener effort and a perceptual ratings of severity, we calculated the minimal clinically important difference (MCID) of each measure with respect to both sets of clinical ratings. <i>Results</i>: For articulatory precision, the MDC (.85) was lower than both MCID measures (2.74 and 2.28), and for the ALSFRS-R speech item, MDC (.86) was greater than both MCID measures (.82 and .72), indicating that while the articulatory precision measure detected minimal clinically important differences in speech, the ALSFRS-R speech item did not. <i>Conclusion</i>: The results demonstrate that the digital measure of articulatory precision effectively detects clinically important differences in speech ratings, outperforming the ALSFRS-R speech item. Taken together, the results herein suggest that this speech outcome is a clinically meaningful measure of speech change."
https://openalex.org/W7123917342,https://doi.org/10.1111/bmsp.70018,Comparing training window selection methods for prediction in non‐stationary time series,2026,2026-01-13,article,1,5.103015,"Felix Petersen, Jonas M B Haslbeck, Jorge N. Tendeiro, et al.",British Journal of Mathematical and Statistical Psychology,False,1,prediction,T,1,time series,"The widespread adoption of smartphones creates the possibility to passively monitor everyday behaviour via sensors. Sensor data have been linked to moment-to-moment psychological symptoms and mood of individuals and thus could alleviate the burden associated with repeated measurement of symptoms. Additionally, psychological care could be improved by predicting moments of high psychopathology and providing immediate interventions. Current research assumes that the relationship between sensor data and psychological symptoms is constant over time - or changes with a fixed rate: Models are trained on all past data or on a fixed window, without comparing different window sizes with each other. This is problematic as choosing the wrong training window can negatively impact prediction accuracy, especially if the underlying rate of change is varying. As a potential solution we compare different methodologies for choosing the correct window size ranging from frequent practice based on heuristics to super learning approaches. In a simulation study, we vary the rate of change in the underlying relationship form over time. We show that even computing a simple average across different windows can help reduce the prediction error rather than selecting a single best window for both simulated and real world data."
https://openalex.org/W3100078462,https://doi.org/10.1109/tvcg.2021.3050071,Visual Drift Detection for Event Sequence Data of Business Processes,2021,2021-01-09,article,49,5.070697,"Anton Yeshchenko, Claudio Di Ciccio, Jan Mendling, et al.",IEEE Transactions on Visualization and Computer Graphics,False,1,ann,T,1,temporal,"Event sequence data is increasingly available in various application domains, such as business process management, software engineering, or medical pathways. Processes in these domains are typically represented as process diagrams or flow charts. So far, various techniques have been developed for automatically generating such diagrams from event sequence data. An open challenge is the visual analysis of drift phenomena when processes change over time. In this article, we address this research gap. Our contribution is a system for fine-granular process drift detection and corresponding visualizations for event logs of executed business processes. We evaluated our system both on synthetic and real-world data. On synthetic logs, we achieved an average F-score of 0.96 and outperformed all the state-of-the-art methods. On real-world logs, we identified all types of process drifts in a comprehensive manner. Finally, we conducted a user study highlighting that our visualizations are easy to use and useful as perceived by process mining experts. In this way, our work contributes to research on process mining, event sequence analysis, and visualization of temporal data."
https://openalex.org/W3114870859,https://doi.org/10.1101/gr.267575.120,Profiling neural editomes reveals a molecular mechanism to regulate RNA editing during development,2020,2020-12-18,article,60,5.0620275,"Suba Rajendren, Alfa Dhakal, Pranathi Vadlamani, et al.",Genome Research,False,1,ann,T,1,temporal,"Adenosine (A) to inosine (I) RNA editing contributes to transcript diversity and modulates gene expression in a dynamic, cell type-specific manner. During mammalian brain development, editing of specific adenosines increases, whereas the expression of A-to-I editing enzymes remains unchanged, suggesting molecular mechanisms that mediate spatiotemporal regulation of RNA editing exist. Herein, by using a combination of biochemical and genomic approaches, we uncover a molecular mechanism that regulates RNA editing in a neural- and development-specific manner. Comparing editomes during development led to the identification of neural transcripts that were edited only in one life stage. The stage-specific editing is largely regulated by differential gene expression during neural development. Proper expression of nearly one-third of the neurodevelopmentally regulated genes is dependent on <i>adr-2</i>, the sole A-to-I editing enzyme in <i>C. elegans</i> However, we also identified a subset of neural transcripts that are edited and expressed throughout development. Despite a neural-specific down-regulation of <i>adr-2</i> during development, the majority of these sites show increased editing in adult neural cells. Biochemical data suggest that ADR-1, a deaminase-deficient member of the adenosine deaminase acting on RNA (ADAR) family, is competing with ADR-2 for binding to specific transcripts early in development. Our data suggest a model in which during neural development, ADR-2 levels overcome ADR-1 repression, resulting in increased ADR-2 binding and editing of specific transcripts. Together, our findings reveal tissue- and development-specific regulation of RNA editing and identify a molecular mechanism that regulates ADAR substrate recognition and editing efficiency."
https://openalex.org/W2020487351,https://doi.org/10.4081/gh.2014.292,Estimating the global abundance of ground level presence of particulate matter (PM2.5),2014,2014-12-01,article,105,4.8668456,"David J. Lary, Fazlay Faruque, N. K. Malakar, et al.",Geospatial health,False,1,algorithm,T,1,temporal,"With the increasing awareness of the health impacts of particulate matter, there is a growing need to comprehend the spatial and temporal variations of the global abundance of ground level airborne particulate matter with a diameter of 2.5 microns or less (PM2.5). Here we use a suite of remote sensing and meteorological data products together with ground-based observations of particulate matter from 8,329 measurement sites in 55 countries taken 1997-2014 to train a machine-learning algorithm to estimate the daily distributions of PM2.5 from 1997 to the present. In this first paper of a series, we present the methodology and global average results from this period and demonstrate that the new PM2.5 data product can reliably represent global observations of PM2.5 for epidemiological studies."
https://openalex.org/W4386148169,https://doi.org/10.48550/arxiv.2308.11773,Identifying depression-related topics in smartphone-collected free-response speech recordings using an automatic speech recognition system and a deep learning topic model,2023,2023-08-22,preprint,1,4.7199364,"Yuezhou Zhang, Amos Folarin, Judith Dineley, et al.",arXiv (Cornell University),False,1,deep learning,T,1,longitudinal,"Language use has been shown to correlate with depression, but large-scale validation is needed. Traditional methods like clinic studies are expensive. So, natural language processing has been employed on social media to predict depression, but limitations remain-lack of validated labels, biased user samples, and no context. Our study identified 29 topics in 3919 smartphone-collected speech recordings from 265 participants using the Whisper tool and BERTopic model. Six topics with a median PHQ-8 greater than or equal to 10 were regarded as risk topics for depression: No Expectations, Sleep, Mental Therapy, Haircut, Studying, and Coursework. To elucidate the topic emergence and associations with depression, we compared behavioral (from wearables) and linguistic characteristics across identified topics. The correlation between topic shifts and changes in depression severity over time was also investigated, indicating the importance of longitudinally monitoring language use. We also tested the BERTopic model on a similar smaller dataset (356 speech recordings from 57 participants), obtaining some consistent results. In summary, our findings demonstrate specific speech topics may indicate depression severity. The presented data-driven workflow provides a practical approach to collecting and analyzing large-scale speech data from real-world settings for digital health research."
https://openalex.org/W2939352586,https://doi.org/10.1016/j.ast.2019.03.051,Robust aircraft trajectory planning under uncertain convective environments with optimal control and rapidly developing thunderstorms,2019,2019-04-15,article,51,4.514193,"Daniel González-Arribas, Manuel Soler, Manuel Sanjurjo-Rivo, et al.",Aerospace Science and Technology,False,1,ann,T,1,trajectory,
https://openalex.org/W2047324950,https://doi.org/10.1002/cyto.a.21168,Pericytes: A universal adult tissue stem cell?,2011,2011-11-08,letter,29,4.1921268,"Ludovic Zimmerlin, Vera S. Donnenberg, Albert D. Donnenberg",Cytometry Part A,False,1,ann,T,1,progression,"In this issue of Cytometry part A, Montiel-Eulefi et al. describe a neurogenic cell population residing in the vascular wall of rat aortas. Although the authors did not characterize them in situ, these aorta-derived cells were shown to express well-known pericytic markers such as CD90, α-smooth muscle actin, and the platelet derived growth factor receptors α and β (1, 2) after a short period in culture. The authors also report the native expression of the neural stem cell marker nestin (3), which in combination with the chondroitin sulfate proteoglycan NG2 marks both pericytes and neurogenic progenitors (1, 3). They validated the neurogenic potential of cultured aorta-derived pericytes by showing the acquisition of mature neural marker expression and functional neural-like stimulus-response. In this study, the pluripotency associated marker stage-specific embryonic antigen 1 (SSEA-1) was detected on aorta-derived cultured pericytes only after induction of neuronal differentiation, in contrast to SSEA-1 expression by human microvascular pericytes, which has been reported to be constitutive (4). A variety of multilineage stem/progenitor cells have been described in the recent literature, most of them being identified retrospectively following primary culture. These include multipotent adult progenitor cells (5), mesenchymal stem cells (MSC) (6) and adipose-derived stem cells (ASC; Ref.7). Most of these multipotent cell populations have been localized in vivo to a niche in the microvasculature wall, including MSC (8) and ASC (4, 7), although MSC have been also isolated from larger vessels, both arteries (9) and veins (10). At the clonal level, the multilineage potential of MSC (and other comparable stem cell populations) has been demonstrated in vitro for mesenchymal lineages (adipogenic, osteogenic, chondrogenic, and either skeletal or smooth muscle potential; reviewed in Ref.11). Further, trans-differentiation across germ layers has been reported by various groups, including differentiation toward neuronal lineages (reviewed in Ref.11). During embryogenesis, MSC originate in two distinct waves, the first from the neural crest. A second wave appears to derive from the mesoderm (12). The relationship between MSC and pericytes in the adult is not immediately clear. In a variety of tissues, pericytes have been proposed to be the immediate progenitors of MSC (8). Brain microvascular pericytes have been previously shown to differentiate into multiple neuronal lineages (3), consistent with the observation that pericytes residing in the face and forebrain originate, like neurons, from the neural crest (13). In this work, the authors successfully differentiated aorta-derived pericytes toward the neurogenic lineage, suggesting that pericytes originating outside the neural crest can also be induced to differentiate down the neuronal lineage pathway. The constitutive coexpression of nestin and NG2 in tissue pericytes is consistent with neuronal-lineage priming, similar to that observed in mesenchymal lineages (6), and potentially explaining the cross-germ layer plasticity reported in the literature (11). Our own data, relating adipose pericytes, which associate with the microvasculature (7), to the mesenchymal-like supra-adventitial adipose stromal cells (SA-ASC), which surround small vessels in an annular fashion, support the interpretation that pericytes are the progenitors of MSC in the adult. Figure 1A shows a hypothetical differentiation scheme based on multiparameter flow cytometric analysis of the stromal vascular fraction of disaggregated adipose tissue. According to this scheme, CD146+, CD90±, CD34− pericytes differentiate from the inside out, giving rise to MSC-like CD146−, CD90+, CD34+ SA-ASC through a rare CD146+, CD90+, CD34+ transit amplifying cell of high proliferative capacity. The SA-ASC undergo spontaneous adipogenesis after reaching confluence in culture and presumably give rise to mature adipocytes in vivo. In keeping with the findings of Montiel-Eulefi et al. human adipose stromal vascular cells also occasionally give rise to CD146+ cells with neuronal morphology after two weeks in culture in the presence of EGM2 (Fig. 1B). CD 146 is not just a pericyte marker. In the neurobiology literature it is known as gicerin, a ligand for nerve outgrowth factor with an important role in neurite extension and synaptogenesis (14). (A) Differentiation scheme for pericytes, transit amplifying cells and supra-adventitial stem cells in adipose tissue. Flow cytometry was performed on 10 freshly isolated human adipose stromal vascular preparations according to previously published methods. The antibody specificities and fluorochromes used are shown in the top left panel. A three-dimensional histogram (radar plot) was generated with Kaluza software (Beckman Coulter) and was gated on the CD3-/CD31-/CD45-population. The arrow indicates the hypothesized progression from CD34-/CD90±/CD146+ pericytes to CD34+/CD90+/CD146-SA-ASC through a CD146+/CD34+ intermediate (bottom left panel). The proportion of proliferating cells in each subset (mean ± SEM) was determined by DAPI nuclear staining. The asterisk indicates P < 0.05 in the proportion of cells with >2N DNA (compared to all other populations, Student's two-tailed t-test). (B) Growth of a cell with neuronal morphology in a primary culture of human adipose stromal vascular cells. Cells were cultured in the EGM2 medium (Lonza) in a Labtek chamber slide coated with gelatin (0.1%, Sigma). The photomicrograph was taken with a Nikon Eclipse TE 2000-U microscope (×60 objective) equipped with a Spot camera. Taken together, these data may help answer the conundrum posed by adult tissue stem cells: Does each tissue have its own oligopotent stem cell which arises during embryogenesis after lineage specification, or is there a universal pluripotent adult tissue stem cell which has escaped lineage restriction (15)? If the findings of Montiel-Eulefi et al., which even large vessels harbor pericytes capable of cross germ-layer differentiation, prove to be generalizable, then pericytes may represent something approaching the universal adult tissue stem cell, and the adventitia of large and small vessels may be their niche."
https://openalex.org/W2593436234,https://doi.org/10.1038/srep42717,"SwissADME: a free web tool to evaluate pharmacokinetics, drug-likeness and medicinal chemistry friendliness of small molecules",2017,2017-03-03,article,16394,83.70365,"Antoine Daina, Olivier Michielin, Vincent Zoete",Scientific Reports,False,1,predictive,T,0,,"To be effective as a drug, a potent molecule must reach its target in the body in sufficient concentration, and stay there in a bioactive form long enough for the expected biologic events to occur. Drug development involves assessment of absorption, distribution, metabolism and excretion (ADME) increasingly earlier in the discovery process, at a stage when considered compounds are numerous but access to the physical samples is limited. In that context, computer models constitute valid alternatives to experiments. Here, we present the new SwissADME web tool that gives free access to a pool of fast yet robust predictive models for physicochemical properties, pharmacokinetics, drug-likeness and medicinal chemistry friendliness, among which in-house proficient methods such as the BOILED-Egg, iLOGP and Bioavailability Radar. Easy efficient input and interpretation are ensured thanks to a user-friendly interface through the login-free website http://www.swissadme.ch. Specialists, but also nonexpert in cheminformatics or computational chemistry can predict rapidly key parameters for a collection of molecules to support their drug discovery endeavours."
https://openalex.org/W2037378930,https://doi.org/10.4028/www.scientific.net/amm.392.312,"A Reliable Multi-Sensor Navigation System for an Unmanned Aerial Vehicle Realized through Integration of SINS with GPS, CNS and Doppler Radar",2013,2013-09-01,article,1,47.25582,"Muhammad Ushaq, Cheng Fang",Applied Mechanics and Materials,False,1,ann,T,0,,"Contemporary importance of the unmanned aerial vehicle (UAV) both for military and civilian applications has prompted vigorous research related with guidance, navigation and control of these vehicles. The potential civilian uses for small low-cost UAVs are various like reconnaissance, surveillance, rescue and search, remote sensing, traffic monitoring, destruction appraisal of natural disasters, etc. One of the most crucial parts of UAVs missions is accurate navigation of the vehicle, i.e. the real time determination of its position, velocity and attitude. Generally highly accurate Strap down Inertial Navigation Systems (SINS) are too heavy to be flown on UAVs. Moreover highly accurate SINS are also highly expensive. Therefore the low-cost and low weight MEMS based SINS with a compromised precision are the viable option for navigation of UAVs. The errors in position, velocity, and attitude solutions provided by the MEMS based SINS grow unboundedly with the passage of time. To contain these growing errors, integrated navigation is the resolution. Complementary characteristics SINS and external non-inertial navigation aids like Global Positioning System (GPS), Celestial Navigation System (CNS) and Doppler radar make the integrated navigation system an appealing and cost effective solution. The non-inertial sensors providing navigation fixes must have low weight and volume to be suitable for UAV application. In this research work GPS, CNS and Doppler radar are used as external navigation aids for SINS. The navigation solutions of all contributing systems are fused using Federated Kalman Filter (FKF). Three local filters are employed for SINS/GPS, SINS/CNS and SINS/Doppler integration and subsequently information from all three local filters is fused to acquire a global solution. Moreover adaptive and fault tolerant filtering scheme has also been implemented in each local filter to isolate or accommodate any undesirable error or noise. Simulation for the presented architecture has validated the effectiveness of the scheme, by showing a substantial precision improvement in the solutions of position, velocity and attitude."
https://openalex.org/W2912143189,https://doi.org/10.1186/s12888-019-2049-z,Remote assessment of disease and relapse in major depressive disorder (RADAR-MDD): a multi-centre prospective cohort study protocol,2019,2019-02-18,article,171,35.053013,"Faith Matcham, Chiara Barattieri di San Pietro, Viola Bulgari, et al.",BMC Psychiatry,False,1,predictive,T,0,,"This study aims to provide insight into the early predictors of major depressive relapse, measured unobtrusively via RMT. If found to be acceptable to patients and other key stakeholders and able to provide clinically useful information predictive of future deterioration, RMT has potential to change the way in which depression and other long-term conditions are measured and managed."
