dataset,source_csv,row_index,title,doi_or_url,regime,regime_score,relevant,models_detected,families_detected,include_any_use,primary_model,primary_family,include_primary_only,primary_reason
mimic,openalex_mimic_S_ml_top350.csv,262,Development and Validation of an Interpretable 3-day Intensive Care Unit Readmission Prediction Model Using Explainable Boosting Machines,https://doi.org/10.1101/2021.11.01.21265700,S,2,True,Gradient Boosting,Tree-based ensemble,True,Gradient Boosting,Tree-based ensemble,True,ok
mimic,openalex_mimic_S_ml_top350.csv,263,A Machine Learning-Based Algorithm for Early Detection of Sepsis in Hospitalized Patients: Development and Evaluation,https://doi.org/10.1109/ccpis59145.2023.10291447,S,2,True,Gradient Boosting; Ensemble,Ensemble / stacking; Tree-based ensemble,True,,,False,primary_unclear
mimic,openalex_mimic_S_ml_top350.csv,264,Association of Red Blood Cell Distribution Width-Albumin Ratio for Acute Myocardial Infarction Patients with Mortality: A Retrospective Cohort Study,https://doi.org/10.1177/10760296221121286,S,2,True,Kaplan–Meier,Survival models,True,Kaplan–Meier,Survival models,True,ok
mimic,openalex_mimic_S_ml_top350.csv,265,Predicting respiratory decompensation in mechanically ventilated adult ICU patients,https://doi.org/10.3389/fphys.2023.1125991,S,6,True,Autoencoder; DNN; RNN; Random Forest; Decision Tree,Deep learning; Other classical ML; Tree-based ensemble,True,Random Forest,Tree-based ensemble,True,ok
mimic,openalex_mimic_S_ml_top350.csv,266,ACEI/ARB Medication During ICU Stay Decrease All-Cause In-hospital Mortality in Critically Ill Patients With Hypertension: A Retrospective Cohort Study Based on Machine Learning,https://doi.org/10.3389/fcvm.2021.787740,S,4,True,Gradient Boosting; LightGBM; Random Forest; XGBoost; Logistic Regression; Support Vector Machine; k-Nearest Neighbors; Cox Proportional Hazards; Kaplan–Meier; Decision Tree,Kernel / instance-based; Linear / GLM; Other classical ML; Survival models; Tree-based ensemble,True,LightGBM,Tree-based ensemble,True,ok
mimic,openalex_mimic_S_ml_top350.csv,267,An Artificial Neural Networks Model for Early Predicting In‐Hospital Mortality in Acute Pancreatitis in MIMIC‐III,https://doi.org/10.1155/2021/6638919,S,0,False,,,False,,,False,not_included_any
mimic,openalex_mimic_S_ml_top350.csv,268,Early predicting 30-day mortality in sepsis in MIMIC-III by an artificial neural networks model,https://doi.org/10.1186/s40001-022-00925-3,S,5,True,DNN; LASSO; Logistic Regression; Cox Proportional Hazards,Deep learning; Linear / GLM; Survival models,True,,,False,primary_unclear
mimic,openalex_mimic_S_ml_top350.csv,269,Atrial Fibrillation Detection in ICU Patients: A Pilot Study on MIMIC III Data,https://doi.org/10.1109/embc.2019.8856496,S,0,True,Support Vector Machine,Kernel / instance-based,True,Support Vector Machine,Kernel / instance-based,True,ok
mimic,openalex_mimic_S_ml_top350.csv,270,Machine Learning Approach to Predict Positive Screening of Methicillin-Resistant Staphylococcus aureus During Mechanical Ventilation Using Synthetic Dataset From MIMIC-IV Database,https://doi.org/10.3389/fmed.2021.694520,S,4,True,XGBoost,Tree-based ensemble,True,XGBoost,Tree-based ensemble,True,ok
mimic,openalex_mimic_S_ml_top350.csv,271,Evaluating the Fairness of the MIMIC-IV Dataset and a Baseline Algorithm: Application to the ICU Length of Stay Prediction,https://doi.org/10.48550/arxiv.2401.00902,S,1,True,XGBoost,Tree-based ensemble,True,XGBoost,Tree-based ensemble,True,ok
mimic,openalex_mimic_S_ml_top350.csv,272,Aspirin intervention before ICU admission reduced the mortality in critically ill patients with acute kidney injury: results from the MIMIC-IV,https://doi.org/10.3389/fphar.2023.1292745,S,6,True,Logistic Regression; Cox Proportional Hazards; Kaplan–Meier,Linear / GLM; Survival models,True,,,False,primary_unclear
mimic,openalex_mimic_S_ml_top350.csv,273,A Deep Learning-Driven Disease Classification Method Using MIMIC-III Database and Natural Language Processing,https://doi.org/10.1109/icdsca59871.2023.10392478,S,0,True,DNN,Deep learning,True,,,False,primary_unclear
mimic,openalex_mimic_S_ml_top350.csv,274,Enhanced machine learning predictive modeling for delirium in elderly ICU patients with COPD and respiratory failure: A retrospective study based on MIMIC-IV,https://doi.org/10.1371/journal.pone.0319297,S,6,True,Gradient Boosting; Random Forest; XGBoost; LASSO; Logistic Regression; k-Nearest Neighbors,Kernel / instance-based; Linear / GLM; Tree-based ensemble,True,XGBoost,Tree-based ensemble,True,ok
mimic,openalex_mimic_S_ml_top350.csv,275,Machine learning prediction and interpretability analysis of high-risk chest pain: a study from the MIMIC-IV database,https://doi.org/10.3389/fphys.2025.1594277,S,11,True,CNN; DNN; LSTM; MLP; RNN; Transformer; AdaBoost; CatBoost; Gradient Boosting; LightGBM; Random Forest; XGBoost; Logistic Regression; Ridge Regression; Support Vector Machine; Ensemble; Decision Tree,Deep learning; Ensemble / stacking; Kernel / instance-based; Linear / GLM; Other classical ML; Tree-based ensemble,True,XGBoost,Tree-based ensemble,True,ok
mimic,openalex_mimic_S_ml_top350.csv,276,Predictive machine learning strategies and clinical diagnosis for prognosis in healthcare: Insights from MIMIC-III Dataset,https://doi.org/10.33545/27076571.2022.v3.i1a.170,S,0,True,k-Nearest Neighbors,Kernel / instance-based,True,,,False,primary_unclear
mimic,openalex_mimic_S_ml_top350.csv,277,Using CNN and HHT to Predict Blood Pressure Level Based on Photoplethysmography and Its Derivatives,https://doi.org/10.3390/bios11040120,S,0,True,CNN; Transformer,Deep learning,True,CNN,Deep learning,True,ok
mimic,openalex_mimic_S_ml_top350.csv,278,Limitations of Transformers on Clinical Text Classification,https://doi.org/10.1109/jbhi.2021.3062322,S,0,True,CNN; Transformer,Deep learning,True,Transformer,Deep learning,True,ok
mimic,openalex_mimic_S_ml_top350.csv,279,Multimodal Deep Learning for Integrating Chest Radiographs and Clinical Parameters: A Case for Transformers,https://doi.org/10.1148/radiol.230806,S,0,False,DNN; Transformer,Deep learning,False,,,False,not_included_any
mimic,openalex_mimic_S_ml_top350.csv,280,Early Prediction of Acute Kidney Injury in Critical Care Setting Using Clinical Notes,https://doi.org/10.48550/arxiv.1811.02757,S,0,False,DNN,Deep learning,False,,,False,not_included_any
mimic,openalex_mimic_S_ml_top350.csv,281,Outcome Prediction in Critically-Ill Patients with Venous Thromboembolism and/or Cancer Using Machine Learning Algorithms: External Validation and Comparison with Scoring Systems,https://doi.org/10.3390/ijms23137132,S,0,False,,,False,,,False,not_included_any
mimic,openalex_mimic_S_ml_top350.csv,282,Mortality Prediction of Various Cancer Patients via Relevant Feature Analysis and Machine Learning,https://doi.org/10.1007/s42979-023-01720-5,S,6,True,CNN; DNN; LSTM; MLP; Random Forest; Logistic Regression; Support Vector Machine; k-Nearest Neighbors; Naive Bayes; Ensemble; Decision Tree; Federated Learning,Deep learning; Ensemble / stacking; Kernel / instance-based; Linear / GLM; Other classical ML; Probabilistic / statistical; Tree-based ensemble,True,,,False,primary_unclear
mimic,openalex_mimic_S_ml_top350.csv,283,Sentiment Analysis for Necessary Preview of 30-Day Mortality in Sepsis Patients and the Control Strategies,https://doi.org/10.1155/2021/1713363,S,1,True,Cox Proportional Hazards,Survival models,True,,,False,primary_unclear
mimic,openalex_mimic_S_ml_top350.csv,284,Early Prediction of Acute Kidney Injury in Critical Care Setting Using Clinical Notes,https://doi.org/10.1109/bibm.2018.8621574,S,0,False,DNN,Deep learning,False,,,False,not_included_any
mimic,openalex_mimic_S_ml_top350.csv,285,Predicting the Onset of Sepsis Using Vital Signs Data: A Machine Learning Approach,https://doi.org/10.1177/10547738231183207,S,0,True,Logistic Regression,Linear / GLM,True,Logistic Regression,Linear / GLM,True,ok
mimic,openalex_mimic_S_ml_top350.csv,286,Leveraging interpretable machine learning in intensive care,https://doi.org/10.1007/s10479-024-06226-8,S,5,True,DNN; Transformer; Gradient Boosting; Random Forest; XGBoost; Elastic Net; LASSO; Linear Regression; Logistic Regression; k-Nearest Neighbors; Ensemble; Decision Tree,Deep learning; Ensemble / stacking; Kernel / instance-based; Linear / GLM; Other classical ML; Tree-based ensemble,True,Logistic Regression,Linear / GLM,True,ok
mimic,openalex_mimic_S_ml_top350.csv,287,The effect of inflammatory markers on mortality in patients with acute myocardial infarction,https://doi.org/10.1038/s41598-025-98408-y,S,6,True,Logistic Regression; Cox Proportional Hazards; Kaplan–Meier,Linear / GLM; Survival models,True,Cox Proportional Hazards,Survival models,True,ok
mimic,openalex_mimic_S_ml_top350.csv,288,Potential value of red blood cell distribution width in predicting in-hospital mortality in intensive care US population with acute pancreatitis: a propensity score matching analysis,https://doi.org/10.1038/s41598-023-40192-8,S,6,True,Logistic Regression; Kaplan–Meier,Linear / GLM; Survival models,True,Logistic Regression,Linear / GLM,True,ok
mimic,openalex_mimic_S_ml_top350.csv,289,C-reactive protein-to-albumin ratio as a biomarker in patients with sepsis: a novel LASSO-COX based prognostic nomogram,https://doi.org/10.1038/s41598-023-42601-4,S,6,True,LASSO; Logistic Regression; Cox Proportional Hazards; Kaplan–Meier,Linear / GLM; Survival models,True,LASSO,Linear / GLM,True,ok
mimic,openalex_mimic_S_ml_top350.csv,290,The association between anion gap and in-hospital mortality of post-cardiac arrest patients: a retrospective study,https://doi.org/10.1038/s41598-022-11081-3,S,5,True,Cox Proportional Hazards; Kaplan–Meier,Survival models,True,Kaplan–Meier,Survival models,True,ok
mimic,openalex_mimic_S_ml_top350.csv,291,Machine Learning-Based Pressure Ulcer Prediction in Modular Critical Care Data,https://doi.org/10.3390/diagnostics12040850,S,0,False,Random Forest,Tree-based ensemble,False,,,False,not_included_any
mimic,openalex_mimic_S_ml_top350.csv,292,Predicting medical events and ICU requirements using a multimodal multiobjective transformer network,https://doi.org/10.1177/15353702221126559,S,0,False,Transformer,Deep learning,False,,,False,not_included_any
mimic,openalex_mimic_S_ml_top350.csv,293,Predicting Successful Weaning from Mechanical Ventilation by Reduction in Positive End-expiratory Pressure Level Using Machine Learning,https://doi.org/10.1371/journal.pdig.0000478,S,6,True,CNN; AdaBoost; CatBoost; Gradient Boosting; LightGBM; Random Forest; XGBoost; Logistic Regression; Ensemble,Deep learning; Ensemble / stacking; Linear / GLM; Tree-based ensemble,True,XGBoost,Tree-based ensemble,True,ok
mimic,openalex_mimic_S_ml_top350.csv,294,Acute Kidney Injury Prediction with Gradient Boosting Decision Trees enriched with Temporal Features,https://doi.org/10.1109/ichi54592.2022.00135,S,1,True,Gradient Boosting; Decision Tree,Other classical ML; Tree-based ensemble,True,,,False,primary_unclear
mimic,openalex_mimic_S_ml_top350.csv,295,A new method for identifying the acute respiratory distress syndrome disease based on noninvasive physiological parameters,https://doi.org/10.1371/journal.pone.0226962,S,2,True,AdaBoost; Random Forest; XGBoost; Linear Regression; Logistic Regression; Support Vector Machine; k-Nearest Neighbors,Kernel / instance-based; Linear / GLM; Tree-based ensemble,True,Linear Regression,Linear / GLM,True,ok
mimic,openalex_mimic_S_ml_top350.csv,296,Estimating Systolic Blood Pressure Using Convolutional Neural Networks,https://doi.org/10.3233/978-1-61499-975-1-143,S,0,False,CNN; DNN,Deep learning,False,,,False,not_included_any
mimic,openalex_mimic_S_ml_top350.csv,297,Sepsis Prediction and Vital Signs Ranking in Intensive Care Unit Patients,https://doi.org/10.48550/arxiv.1812.06686,S,0,True,Ensemble,Ensemble / stacking,True,Ensemble,Ensemble / stacking,True,ok
mimic,openalex_mimic_S_ml_top350.csv,298,A Novel Convolutional Neural Network Deep Learning Implementation for Cuffless Heart Rate and Blood Pressure Estimation,https://doi.org/10.3390/app132212403,S,0,True,CNN; DNN; Linear Regression,Deep learning; Linear / GLM,True,Linear Regression,Linear / GLM,True,ok
mimic,openalex_mimic_S_ml_top350.csv,299,Feature Explanations in Recurrent Neural Networks for Predicting Risk of Mortality in Intensive Care Patients,https://doi.org/10.3390/jpm11090934,S,0,False,RNN,Deep learning,False,,,False,not_included_any
mimic,openalex_mimic_S_ml_top350.csv,300,EXAMINATION OF SUMMARIZED MEDICAL RECORDS FOR ICD CODE CLASSIFICATION VIA BERT,https://doi.org/10.35784/acs-2024-16,S,1,True,CNN; DNN; Transformer; Support Vector Machine,Deep learning; Kernel / instance-based,True,,,False,primary_unclear
mimic,openalex_mimic_S_ml_top350.csv,301,Machine learning models for predicting severe acute kidney injury in patients with sepsis-induced myocardial injury,https://doi.org/10.1038/s41598-025-04579-z,S,5,True,MLP; Gradient Boosting; Random Forest; XGBoost; LASSO; Support Vector Machine; k-Nearest Neighbors; Ensemble; Decision Tree,Deep learning; Ensemble / stacking; Kernel / instance-based; Linear / GLM; Other classical ML; Tree-based ensemble,True,Random Forest,Tree-based ensemble,True,ok
mimic,openalex_mimic_S_ml_top350.csv,302,Multitask Balanced and Recalibrated Network for Medical Code Prediction,https://doi.org/10.1145/3563041,S,0,True,DNN,Deep learning,True,,,False,primary_unclear
mimic,openalex_mimic_S_ml_top350.csv,303,Cloud based real-time multivariate multi-step prediction of systolic blood pressure and heart rate using temporal convolutional network and Apache Spark,https://doi.org/10.1186/s40537-025-01207-5,S,2,True,Autoencoder; CNN; DNN; GRU; LSTM; MLP; RNN; TCN; Transformer; AdaBoost; Random Forest; XGBoost; Linear Regression; Support Vector Machine; k-Nearest Neighbors; Joint Model; ARIMA; Naive Bayes; Ensemble; Decision Tree; Federated Learning,Deep learning; Ensemble / stacking; Kernel / instance-based; Linear / GLM; Other classical ML; Probabilistic / statistical; Survival models; Tree-based ensemble,True,LSTM,Deep learning,True,ok
mimic,openalex_mimic_S_ml_top350.csv,304,Design of an Intelligent Nursing Information Management System for Critically Ill Patients in Neurosurgery,https://doi.org/10.1155/2022/2848255,S,0,False,,,False,,,False,not_included_any
mimic,openalex_mimic_S_ml_top350.csv,305,"One-Class Machine-Learning Model to Screen for Dysglycemia Using Single Lead ECG in ICU, toward Noninvasive Blood Glucose Monitoring",https://doi.org/10.20944/preprints202208.0098.v1,S,0,True,Support Vector Machine,Kernel / instance-based,True,Support Vector Machine,Kernel / instance-based,True,ok
mimic,openalex_mimic_S_ml_top350.csv,306,Multimodal Data Matters: Language Model Pre-Training Over Structured and Unstructured Electronic Health Records,https://doi.org/10.1109/jbhi.2022.3217810,S,3,True,Transformer,Deep learning,True,Transformer,Deep learning,True,ok
mimic,openalex_mimic_S_ml_top350.csv,307,DeepNote-GNN,https://doi.org/10.1145/3459930.3469547,S,3,True,DNN; Graph neural network; Transformer,Deep learning,True,Graph neural network,Deep learning,True,ok
mimic,openalex_mimic_S_ml_top350.csv,308,Pneumonia Outcome Prediction Using Structured And Unstructured Data From EHR,https://doi.org/10.1109/bibm49941.2020.9312987,S,2,True,Ensemble,Ensemble / stacking,True,Ensemble,Ensemble / stacking,True,ok
mimic,openalex_mimic_S_ml_top350.csv,309,Analysis of the Impact of Medical Features and Risk Prediction of Acute Kidney Injury for Critical Patients Using Temporal Electronic Health Record Data With Attention-Based Neural Network,https://doi.org/10.3389/fmed.2021.658665,S,8,True,CNN; DNN; LSTM; RNN; TCN; Transformer; Gradient Boosting; Random Forest; Logistic Regression,Deep learning; Linear / GLM; Tree-based ensemble,True,Random Forest,Tree-based ensemble,True,ok
mimic,openalex_mimic_S_ml_top350.csv,310,"Unstructured clinical notes within the 24 hours since admission predict short, mid &amp; long-term mortality in adult ICU patients",https://doi.org/10.1371/journal.pone.0262182,S,8,True,CNN; DNN; LSTM; RNN; Transformer; Gradient Boosting; LightGBM; Random Forest; XGBoost; Logistic Regression; Support Vector Machine; k-Nearest Neighbors; Ensemble; Decision Tree,Deep learning; Ensemble / stacking; Kernel / instance-based; Linear / GLM; Other classical ML; Tree-based ensemble,True,,,False,primary_unclear
mimic,openalex_mimic_S_ml_top350.csv,311,Identifying stroke-related quantified evidence from electronic health records in real-world studies,https://doi.org/10.1016/j.artmed.2023.102552,S,1,True,Transformer; Random Forest,Deep learning; Tree-based ensemble,True,Random Forest,Tree-based ensemble,True,ok
mimic,openalex_mimic_S_ml_top350.csv,312,A comprehensive EHR timeseries pre-training benchmark,https://doi.org/10.1145/3450439.3451877,S,2,True,,,False,,,False,not_included_any
mimic,openalex_mimic_S_ml_top350.csv,313,Real-time Mortality Prediction Using MIMIC-IV ICU Data Via Boosted Nonparametric Hazards,https://doi.org/10.1109/bhi50953.2021.9508537,S,3,True,,,False,,,False,not_included_any
mimic,openalex_mimic_S_ml_top350.csv,314,Multitask learning and benchmarking with clinical time series data,https://doi.org/10.1038/s41597-019-0103-9,S,6,True,DNN; LSTM; RNN; TCN; Transformer; Linear Regression; Logistic Regression; Ensemble,Deep learning; Ensemble / stacking; Linear / GLM,True,LSTM,Deep learning,True,ok
mimic,openalex_mimic_S_ml_top350.csv,315,Association between red blood cell distribution width-platelet ratio (RPR) and mortality in patients with heart failure from the MIMIC IV database: A retrospective cohort study,https://doi.org/10.1016/j.heliyon.2024.e35796,S,2,True,Cox Proportional Hazards,Survival models,True,,,False,primary_unclear
mimic,openalex_mimic_S_ml_top350.csv,316,Visualization of nigrosome 1 and its loss in PD: Pathoanatomical correlation and in vivo 7T MRI,https://doi.org/10.1212/wnl.0000000000000398,S,2,True,,,False,,,False,not_included_any
mimic,openalex_mimic_S_ml_top350.csv,317,Association between total bilirubin-to-glucose ratio and long- and short-term prognosis in liver cirrhosis: A study based on the MIMIC-IV database,https://doi.org/10.1097/md.0000000000045996,S,2,True,Cox Proportional Hazards; Kaplan–Meier,Survival models,True,,,False,primary_unclear
mimic,openalex_mimic_S_ml_top350.csv,318,Benchmarking emergency department prediction models with machine learning and public electronic health records,https://doi.org/10.1038/s41597-022-01782-9,S,6,True,DNN; LSTM; MLP; Gradient Boosting; Random Forest; Logistic Regression,Deep learning; Linear / GLM; Tree-based ensemble,True,,,False,primary_unclear
mimic,openalex_mimic_S_ml_top350.csv,319,Development and verification of a nomogram for predicting short-term mortality in elderly ischemic stroke populations,https://doi.org/10.1038/s41598-023-39781-4,S,8,True,Random Forest; LASSO; Logistic Regression,Linear / GLM; Tree-based ensemble,True,,,False,primary_unclear
mimic,openalex_mimic_S_ml_top350.csv,320,Evaluating Progress on Machine Learning for Longitudinal Electronic Healthcare Data,https://doi.org/10.48550/arxiv.2010.01149,S,1,True,Logistic Regression,Linear / GLM,True,Logistic Regression,Linear / GLM,True,ok
mimic,openalex_mimic_S_ml_top350.csv,321,Privacy-Preserving Predictive Modeling: Harmonization of Contextual Embeddings From Different Sources,https://doi.org/10.2196/medinform.9455,S,8,True,CNN; DNN; RNN; Logistic Regression; Support Vector Machine; Cox Proportional Hazards,Deep learning; Kernel / instance-based; Linear / GLM; Survival models,True,,,False,primary_unclear
mimic,openalex_mimic_S_ml_top350.csv,322,Multimodal Machine Learning for Automated ICD Coding,https://doi.org/10.48550/arxiv.1810.13348,S,1,True,CNN; Ensemble,Deep learning; Ensemble / stacking,True,CNN,Deep learning,True,ok
mimic,openalex_mimic_S_ml_top350.csv,323,HarmoSATE: Harmonized embedding-based self-attentive encoder to improve accuracy of privacy-preserving federated predictive analysis,https://doi.org/10.1016/j.ins.2024.120265,S,2,True,,,False,,,False,not_included_any
mimic,openalex_mimic_S_ml_top350.csv,324,Order-free Medicine Combination Prediction with Graph Convolutional Reinforcement Learning,https://doi.org/10.1145/3357384.3357965,S,2,True,CNN; Graph neural network; Reinforcement Learning,Deep learning; Other classical ML,True,Reinforcement Learning,Other classical ML,True,ok
mimic,openalex_mimic_S_ml_top350.csv,325,RETRACTED ARTICLE: Knowledge graph driven medicine recommendation system using graph neural networks on longitudinal medical records,https://doi.org/10.1038/s41598-024-75784-5,S,9,True,CNN; DNN; GRU; Graph neural network; MLP; RNN; Transformer; Logistic Regression,Deep learning; Linear / GLM,True,,,False,primary_unclear
mimic,openalex_mimic_S_ml_top350.csv,326,CHiLL: Zero-shot Custom Interpretable Feature Extraction from Clinical Notes with Large Language Models,https://doi.org/10.18653/v1/2023.findings-emnlp.568,S,3,True,,,False,,,False,not_included_any
mimic,openalex_mimic_S_ml_top350.csv,327,The establishment and optimization of a long-term prognosis assessment model for patients in sepsis combined with heart failure: Based on the Medical Information Mart for Intensive Care IV database,https://doi.org/10.21203/rs.3.rs-3953734/v1,S,4,True,Logistic Regression,Linear / GLM,True,Logistic Regression,Linear / GLM,True,ok
mimic,openalex_mimic_S_ml_top350.csv,328,MDF-Net for abnormality detection by fusing X-rays with clinical data,https://doi.org/10.1038/s41598-023-41463-0,S,10,True,CNN; DNN; Transformer,Deep learning,True,CNN,Deep learning,True,ok
mimic,openalex_mimic_S_ml_top350.csv,329,A flexible symbolic regression method for constructing interpretable clinical prediction models,https://doi.org/10.1038/s41746-023-00833-8,S,9,True,DNN; LSTM; Random Forest; LASSO; Logistic Regression; Ensemble; Decision Tree; Federated Learning,Deep learning; Ensemble / stacking; Linear / GLM; Other classical ML; Tree-based ensemble,True,LSTM,Deep learning,True,ok
mimic,openalex_mimic_S_ml_top350.csv,330,A Predictive Model for Acute Kidney Injury Based on Leukocyte‐Related Indicators in Hepatocellular Carcinoma Patients Admitted to the Intensive Care Unit,https://doi.org/10.1155/mi/7110012,S,2,True,Logistic Regression; Kaplan–Meier,Linear / GLM; Survival models,True,Logistic Regression,Linear / GLM,True,ok
mimic,openalex_mimic_S_ml_top350.csv,331,Interpretable machine learning for 28-day all-cause in-hospital mortality prediction in critically ill patients with heart failure combined with hypertension: A retrospective cohort study based on medical information mart for intensive care database-IV and eICU databases,https://doi.org/10.3389/fcvm.2022.994359,S,11,True,DNN; MLP; Transformer; Random Forest; LASSO; Logistic Regression; k-Nearest Neighbors; Cox Proportional Hazards; Naive Bayes; Ensemble,Deep learning; Ensemble / stacking; Kernel / instance-based; Linear / GLM; Probabilistic / statistical; Survival models; Tree-based ensemble,True,,,False,primary_unclear
mimic,openalex_mimic_S_ml_top350.csv,332,"Peeking into a black box, the fairness and generalizability of a MIMIC-III benchmarking model",https://doi.org/10.1038/s41597-021-01110-7,S,7,True,DNN; LSTM; RNN; Transformer; Logistic Regression; Reinforcement Learning,Deep learning; Linear / GLM; Other classical ML,True,,,False,primary_unclear
mimic,openalex_mimic_S_ml_top350.csv,333,"Towards a decision support tool for intensive care discharge: machine learning algorithm development using electronic healthcare data from MIMIC-III and Bristol, UK",https://doi.org/10.1136/bmjopen-2018-025925,S,0,False,,,False,,,False,not_included_any
mimic,openalex_mimic_S_ml_top350.csv,334,Predicting risk for trauma patients using static and dynamic information from the MIMIC III database,https://doi.org/10.1371/journal.pone.0262523,S,4,True,RNN; TCN; Transformer; Gradient Boosting; XGBoost; Linear Regression; Logistic Regression; Support Vector Machine; Decision Tree,Deep learning; Kernel / instance-based; Linear / GLM; Other classical ML; Tree-based ensemble,True,,,False,primary_unclear
mimic,openalex_mimic_S_ml_top350.csv,335,Mimic-IV-ICD: A new benchmark for eXtreme MultiLabel Classification,https://doi.org/10.48550/arxiv.2304.13998,S,1,True,,,False,,,False,not_included_any
mimic,openalex_mimic_S_ml_top350.csv,336,Association between serum lactate and mortality in critically ill ischemic stroke patients based on MIMIC-IV data,https://doi.org/10.1038/s41598-025-11461-5,S,7,True,Cox Proportional Hazards; Kaplan–Meier,Survival models,True,Kaplan–Meier,Survival models,True,ok
mimic,openalex_mimic_S_ml_top350.csv,337,XGBoost in the Prediction of 28-Day Mortality in Critical Elderly Patients with Hip Fracture: A MIMIC-IV Cohort Study.,nan,S,1,True,XGBoost; Logistic Regression,Linear / GLM; Tree-based ensemble,True,Logistic Regression,Linear / GLM,True,ok
mimic,openalex_mimic_S_ml_top350.csv,338,Association of PIV value with early mortality in ICU patients with sepsis-associated acute kidney injury from the MIMIC IV database,https://doi.org/10.1038/s41598-025-96320-z,S,7,True,Random Forest; Cox Proportional Hazards; Kaplan–Meier,Survival models; Tree-based ensemble,True,,,False,primary_unclear
mimic,openalex_mimic_S_ml_top350.csv,339,Association Between Whole Blood Cell-Derived Inflammatory Markers and All-Cause Mortality in Patients with Sepsis-Associated Acute Kidney Injury: A Retrospective Study Based on the MIMIC-IV Database,https://doi.org/10.1177/08850666251363853,S,1,True,Cox Proportional Hazards; Kaplan–Meier,Survival models,True,,,False,primary_unclear
