dataset,source_csv,row_index,title,doi_or_url,regime,regime_score,relevant,models_detected,families_detected,include_any_use,primary_model,primary_family,include_primary_only,primary_reason
elsa,openalex_elsa_S_ml_top350.csv,343,"Associations of grip strength with cardiovascular, respiratory, and cancer outcomes and all cause mortality: prospective cohort study of half a million UK Biobank participants",https://doi.org/10.1136/bmj.k1651,S,2,True,,,False,,,False,not_included_any
elsa,openalex_elsa_S_ml_top350.csv,344,Development of the Voicing Contrast: A Comparison of Voice Onset Time in Stop Perception and Production,https://doi.org/10.1044/jshr.1901.93,S,0,False,Transformer,Deep learning,False,,,False,not_included_any
elsa,openalex_elsa_S_ml_top350.csv,345,Effectiveness of syringe exchange programs in reducing HIV risk behavior and HIV seroconversion among injecting drug users,https://doi.org/10.1097/00002030-200107270-00002,S,2,True,,,False,,,False,not_included_any
elsa,openalex_elsa_S_ml_top350.csv,346,A peer intervention reduces loneliness and improves social <scp>well‐being</scp> in <scp>low‐income</scp> older adults: A <scp>mixed‐methods</scp> study,https://doi.org/10.1111/jgs.17450,S,0,False,Logistic Regression,Linear / GLM,False,,,False,not_included_any
elsa,openalex_elsa_S_ml_top350.csv,347,"Development of Adolescents' Self-Perceptions, Values, and Task Perceptions According to Gender and Domain in 7th- through 11th-Grade Australian Students",https://doi.org/10.1111/j.1467-8624.2004.00757.x,S,1,True,,,False,,,False,not_included_any
elsa,openalex_elsa_S_ml_top350.csv,348,"Teacher perspectives on integrating ICT into subject teaching: commitment, constraints, caution, and change",https://doi.org/10.1080/0022027032000276961,S,1,True,,,False,,,False,not_included_any
elsa,openalex_elsa_S_ml_top350.csv,349,Genetic variants specific to aging-related verbal memory: Insights from GWASs in a population-based cohort,https://doi.org/10.1371/journal.pone.0182448,S,6,True,Transformer; Linear Regression; Logistic Regression; Mixed-Effects Model,Deep learning; Linear / GLM; Probabilistic / statistical,True,Linear Regression,Linear / GLM,True,ok
hrs,openalex_hrs_S_ml_top350.csv,0,Predictors of Covid-19 level of concern among older adults from the health and retirement study,https://doi.org/10.1038/s41598-022-08332-8,S,8,True,Random Forest; XGBoost; LASSO; Logistic Regression; Support Vector Machine; Ensemble,Ensemble / stacking; Kernel / instance-based; Linear / GLM; Tree-based ensemble,True,Logistic Regression,Linear / GLM,True,ok
hrs,openalex_hrs_S_ml_top350.csv,1,EHRA/HRS/APHRS expert consensus on ventricular arrhythmias,https://doi.org/10.1016/j.joa.2014.08.001,S,3,True,,,False,,,False,not_included_any
hrs,openalex_hrs_S_ml_top350.csv,2,A critique and examination of the polysocial risk score approach: predicting cognition in the Health and Retirement Study,https://doi.org/10.1093/aje/kwae074,S,4,True,LASSO; Mixed-Effects Model,Linear / GLM; Probabilistic / statistical,True,LASSO,Linear / GLM,True,ok
hrs,openalex_hrs_S_ml_top350.csv,3,Machine learning approaches to the social determinants of health in the health and retirement study,https://doi.org/10.1016/j.ssmph.2017.11.008,S,0,False,,,False,,,False,not_included_any
hrs,openalex_hrs_S_ml_top350.csv,4,HRS/EHRA/APHRS Expert Consensus Statement on the Diagnosis and Management of Patients with Inherited Primary Arrhythmia Syndromes,https://doi.org/10.1016/j.joa.2013.07.002,S,2,True,,,False,,,False,not_included_any
hrs,openalex_hrs_S_ml_top350.csv,5,The Hazards of Hazard Ratios,https://doi.org/10.1097/ede.0b013e3181c1ea43,S,3,True,Cox Proportional Hazards; Kaplan–Meier,Survival models,True,Cox Proportional Hazards,Survival models,True,ok
hrs,openalex_hrs_S_ml_top350.csv,6,HRS/EHRA/APHRS/LAHRS/ACC/AHA worldwide practice update for telehealth and arrhythmia monitoring during and after a pandemic,https://doi.org/10.1002/joa3.12389,S,3,True,,,False,,,False,not_included_any
hrs,openalex_hrs_S_ml_top350.csv,7,"The Association of Vision, Hearing, and Dual-Sensory Loss with Walking Speed and Incident Slow Walking: Longitudinal and Time to Event Analyses in the Health and Retirement Study",https://doi.org/10.1055/s-0041-1726017,S,6,True,,,False,,,False,not_included_any
hrs,openalex_hrs_S_ml_top350.csv,8,Development of a diverse osteoporosis screening tool for older US adults from the health and retirement study,https://doi.org/10.1016/j.heliyon.2023.e23806,S,3,True,,,False,,,False,not_included_any
hrs,openalex_hrs_S_ml_top350.csv,9,Aging measures and cancer in the Health and Retirement Study (HRS),https://doi.org/10.1038/s41467-025-60913-z,S,9,True,Logistic Regression; Cox Proportional Hazards,Linear / GLM; Survival models,True,,,False,primary_unclear
hrs,openalex_hrs_S_ml_top350.csv,10,How social/environmental determinants and inflammation affect salivary telomere length among middle-older adults in the health and retirement study,https://doi.org/10.1038/s41598-022-12742-z,S,8,True,Transformer; Logistic Regression; k-Nearest Neighbors; Cox Proportional Hazards,Deep learning; Kernel / instance-based; Linear / GLM; Survival models,True,,,False,primary_unclear
hrs,openalex_hrs_S_ml_top350.csv,11,Forest mapping using 3D data from SPOT-5 HRS and Z/I DMC,https://doi.org/10.1109/igarss.2010.5653818,S,1,True,,,False,,,False,not_included_any
hrs,openalex_hrs_S_ml_top350.csv,12,Health State Risk Categorization: A Machine Learning Clustering Approach Using Health and Retirement Study Data,https://doi.org/10.3905/jfds.2022.4.2.139,S,0,False,,,False,,,False,not_included_any
hrs,openalex_hrs_S_ml_top350.csv,13,Do Race and Everyday Discrimination Predict Mortality Risk? Evidence From the Health and Retirement Study,https://doi.org/10.1177/2333721419855665,S,0,False,Cox Proportional Hazards,Survival models,False,,,False,not_included_any
hrs,openalex_hrs_S_ml_top350.csv,14,HRS,https://doi.org/10.1145/2713579.2713585,S,0,True,Support Vector Machine,Kernel / instance-based,True,,,False,primary_unclear
hrs,openalex_hrs_S_ml_top350.csv,15,Adherence to Mediterranean Diet Is Associated With Lung Function in Older Adults: Data From the Health and Retirement Study,https://doi.org/10.1080/07315724.2020.1740114,S,0,True,Linear Regression; Logistic Regression,Linear / GLM,True,,,False,primary_unclear
hrs,openalex_hrs_S_ml_top350.csv,16,Using syndrome mining with the Health and Retirement Study to identify the deadliest and least deadly frailty syndromes,https://doi.org/10.1038/s41598-020-60869-8,S,5,True,,,False,,,False,not_included_any
hrs,openalex_hrs_S_ml_top350.csv,17,Reexamining the poverty cycle in middle and late adulthood: Evidence from the Health and Retirement Study 2002–2014,https://doi.org/10.1111/ijsw.12454,S,0,False,Logistic Regression,Linear / GLM,False,,,False,not_included_any
hrs,openalex_hrs_S_ml_top350.csv,18,Physical activity initiated from midlife on risk of dementia and cognitive impairment: The Health and Retirement Study,https://doi.org/10.1111/jgs.19109,S,0,False,Logistic Regression,Linear / GLM,False,,,False,not_included_any
hrs,openalex_hrs_S_ml_top350.csv,19,Racial differences in the predictive role of high depressive symptoms on incident heart disease over 18 years: Results from the health and retirement study,https://doi.org/10.5812/cardiovascmed.34767,S,1,True,Cox Proportional Hazards,Survival models,True,Cox Proportional Hazards,Survival models,True,ok
hrs,openalex_hrs_S_ml_top350.csv,20,The Joint Effects of Exposure to Ambient Long-term Air Pollution and Short-term Heat on Epigenetic Aging in the Health and Retirement Study,https://doi.org/10.1093/gerona/glaf092,S,0,True,Linear Regression,Linear / GLM,True,Linear Regression,Linear / GLM,True,ok
hrs,openalex_hrs_S_ml_top350.csv,21,"Hierarchical controls on runoff generation: Topographically driven hydrologic connectivity, geology, and vegetation",https://doi.org/10.1029/2011wr010666,S,0,True,Linear Regression,Linear / GLM,True,Linear Regression,Linear / GLM,True,ok
hrs,openalex_hrs_S_ml_top350.csv,22,Gender Modifies the Association of Cognition With Age-Related Hearing Impairment in the Health and Retirement Study,https://doi.org/10.3389/fpubh.2021.751828,S,9,True,Transformer; Logistic Regression,Deep learning; Linear / GLM,True,Logistic Regression,Linear / GLM,True,ok
hrs,openalex_hrs_S_ml_top350.csv,23,Active versus Passive Sample Attrition: The Health and Retirement Study,nan,S,2,True,Logistic Regression,Linear / GLM,True,Logistic Regression,Linear / GLM,True,ok
hrs,openalex_hrs_S_ml_top350.csv,24,Grandparenthood and risk of mortality: Findings from the Health and Retirement Study,https://doi.org/10.1016/j.socscimed.2020.113371,S,2,True,Cox Proportional Hazards,Survival models,True,,,False,primary_unclear
hrs,openalex_hrs_S_ml_top350.csv,25,Predictors of Long‐Term Nursing Home Placement Under Competing Risk: Evidence from the Health and Retirement Study,https://doi.org/10.1111/jgs.12781,S,0,False,,,False,,,False,not_included_any
hrs,openalex_hrs_S_ml_top350.csv,26,Associations Between Midlife Functional Limitations and Self-Reported Health and Cognitive Status: Results from the 1998–2016 Health and Retirement Study,https://doi.org/10.3233/jad-215192,S,4,True,Logistic Regression,Linear / GLM,True,Logistic Regression,Linear / GLM,True,ok
hrs,openalex_hrs_S_ml_top350.csv,27,Regressive models for risk prediction of repeated multinomial outcomes: An illustration using Health and Retirement Study data,https://doi.org/10.1002/bimj.201800101,S,1,True,,,False,,,False,not_included_any
hrs,openalex_hrs_S_ml_top350.csv,28,Interaction Between Physical Activity and Polygenic Score on Type 2 Diabetes Mellitus in Older Black and White Participants From the Health and Retirement Study,https://doi.org/10.1093/gerona/glab025,S,1,True,Logistic Regression,Linear / GLM,True,Logistic Regression,Linear / GLM,True,ok
hrs,openalex_hrs_S_ml_top350.csv,29,Subjective Survival Probabilities in the Health and Retirement Study: Systematic Biases and Predictive Validity,nan,S,0,False,,,False,,,False,not_included_any
hrs,openalex_hrs_S_ml_top350.csv,30,Initiation of Hearing Aids Use and Incident Dementia Among Mid-to-late Life Adults: The Health and Retirement Study 2010-2018,https://doi.org/10.1177/08919887241302107,S,1,True,Logistic Regression,Linear / GLM,True,Logistic Regression,Linear / GLM,True,ok
hrs,openalex_hrs_S_ml_top350.csv,31,Associations of Cytomegalovirus and Muscle Weakness in Older Adults: Results from the Health and Retirement Study,https://doi.org/10.1093/geroni/igaa057.2252,S,1,True,Linear Regression,Linear / GLM,True,Linear Regression,Linear / GLM,True,ok
hrs,openalex_hrs_S_ml_top350.csv,32,Elevated Biomarkers of Inflammation Are Associated With Reduced Survival Among Breast Cancer Patients,https://doi.org/10.1200/jco.2008.18.9068,S,1,True,Cox Proportional Hazards,Survival models,True,Cox Proportional Hazards,Survival models,True,ok
hrs,openalex_hrs_S_ml_top350.csv,33,The Predictive Validity of Subjective Mortality Expectations: Evidence From the Health and Retirement Study,https://doi.org/10.1007/s13524-012-0164-2,S,0,False,,,False,,,False,not_included_any
hrs,openalex_hrs_S_ml_top350.csv,34,"Religion, a social determinant of mortality? A 10-year follow-up of the Health and Retirement Study",https://doi.org/10.1371/journal.pone.0189134,S,6,True,Transformer; Cox Proportional Hazards,Deep learning; Survival models,True,Cox Proportional Hazards,Survival models,True,ok
hrs,openalex_hrs_S_ml_top350.csv,35,Comparison of Methods for Algorithmic Classification of Dementia Status in the Health and Retirement Study,https://doi.org/10.1097/ede.0000000000000945,S,1,True,,,False,,,False,not_included_any
hrs,openalex_hrs_S_ml_top350.csv,36,Development of Algorithmic Dementia Ascertainment for Racial/Ethnic Disparities Research in the US Health and Retirement Study,https://doi.org/10.1097/ede.0000000000001101,S,0,False,,,False,,,False,not_included_any
hrs,openalex_hrs_S_ml_top350.csv,37,Internet Adoption in Older Adults: Findings from the Health and Retirement Study,https://doi.org/10.1089/cyber.2019.0736,S,0,True,Cox Proportional Hazards,Survival models,True,Cox Proportional Hazards,Survival models,True,ok
hrs,openalex_hrs_S_ml_top350.csv,38,Association Between Immune Response to Cytomegalovirus and Cognition in the Health and Retirement Study,https://doi.org/10.1093/aje/kwaa238,S,1,True,Linear Regression,Linear / GLM,True,Linear Regression,Linear / GLM,True,ok
hrs,openalex_hrs_S_ml_top350.csv,39,HRS Instability in Oxide-Based Bipolar Resistive Switching Cells,https://doi.org/10.1109/ted.2020.3018096,S,0,True,Hidden Markov Model; Markov Model,Probabilistic / statistical,True,,,False,primary_unclear
hrs,openalex_hrs_S_ml_top350.csv,40,"The Association between Sleep Problems, Sleep Medication Use, and Falls in Community-Dwelling Older Adults: Results from the Health and Retirement Study 2010",https://doi.org/10.1155/2016/3685789,S,1,True,Logistic Regression,Linear / GLM,True,Logistic Regression,Linear / GLM,True,ok
hrs,openalex_hrs_S_ml_top350.csv,41,Compounding Stress: Childhood Adversity as a Risk Factor for Adulthood Trauma Exposure in the Health and Retirement Study,https://doi.org/10.1002/jts.22617,S,2,True,Logistic Regression,Linear / GLM,True,Logistic Regression,Linear / GLM,True,ok
hrs,openalex_hrs_S_ml_top350.csv,42,"The association between neighborhood socioeconomic status, cardiovascular and cerebrovascular risk factors, and cognitive decline in the Health and Retirement Study (HRS)",https://doi.org/10.1080/13607863.2019.1594169,S,2,True,Logistic Regression,Linear / GLM,True,Logistic Regression,Linear / GLM,True,ok
hrs,openalex_hrs_S_ml_top350.csv,43,HRS-CE: A hybrid framework to integrate content embeddings in recommender systems for cold start items,https://doi.org/10.1016/j.jocs.2018.09.008,S,0,False,,,False,,,False,not_included_any
hrs,openalex_hrs_S_ml_top350.csv,44,Links between inflammation and immune functioning with cognitive status among older Americans in the Health and Retirement Study,https://doi.org/10.1016/j.bbih.2022.100559,S,0,True,Logistic Regression,Linear / GLM,True,Logistic Regression,Linear / GLM,True,ok
hrs,openalex_hrs_S_ml_top350.csv,45,Validation of a hybrid approach to standardize immunophenotyping analysis in large population studies: The Health and Retirement Study,https://doi.org/10.1038/s41598-020-65016-x,S,3,True,Mixed-Effects Model,Probabilistic / statistical,True,,,False,primary_unclear
hrs,openalex_hrs_S_ml_top350.csv,46,Association of Joint Genetic and Social Environmental Risks With Incident Myocardial Infarction: Results From the Health and Retirement Study,https://doi.org/10.1161/jaha.122.028200,S,0,False,Cox Proportional Hazards,Survival models,False,,,False,not_included_any
hrs,openalex_hrs_S_ml_top350.csv,47,Sexual Identity and Self-Rated Health in Midlife: Evidence from the Health and Retirement Study,https://doi.org/10.1089/heq.2021.0034,S,0,True,Logistic Regression,Linear / GLM,True,Logistic Regression,Linear / GLM,True,ok
hrs,openalex_hrs_S_ml_top350.csv,48,Difference in predictors and barriers to arts and cultural engagement with age in the United States: A cross-sectional analysis using the Health and Retirement Study,https://doi.org/10.31235/osf.io/8pcux,S,0,False,Logistic Regression,Linear / GLM,False,,,False,not_included_any
hrs,openalex_hrs_S_ml_top350.csv,49,Association of Parenthood With Incident Heart Disease in United States’ Older Men and Women: A Longitudinal Analysis of Health and Retirement Study Data,https://doi.org/10.1177/0898264319831512,S,0,False,Cox Proportional Hazards,Survival models,False,,,False,not_included_any
hrs,openalex_hrs_S_ml_top350.csv,50,Receptive and participatory arts engagement and healthy aging: Longitudinal evidence from the Health and Retirement Study,https://doi.org/10.31234/osf.io/q4h6y,S,2,True,Logistic Regression,Linear / GLM,True,Logistic Regression,Linear / GLM,True,ok
hrs,openalex_hrs_S_ml_top350.csv,51,GRANDPARENTHOOD AND RISK OF MORTALITY: FINDINGS FROM THE HEALTH AND RETIREMENT STUDY,https://doi.org/10.1093/geroni/igz038.2340,S,1,True,Cox Proportional Hazards,Survival models,True,,,False,primary_unclear
hrs,openalex_hrs_S_ml_top350.csv,52,Importance of Recalibrating Models for Type 2 Diabetes Onset Prediction: Application of the Diabetes Population Risk Tool on the Health and Retirement Study,https://doi.org/10.1109/embc.2018.8513554,S,1,True,,,False,,,False,not_included_any
hrs,openalex_hrs_S_ml_top350.csv,53,Introduction to the revised American Association for the Study of Liver Diseases Practice Guideline management of adult patients with ascites due to cirrhosis 2012,https://doi.org/10.1002/hep.26359,S,1,True,,,False,,,False,not_included_any
hrs,openalex_hrs_S_ml_top350.csv,54,Lower Social Support is Associated with Accelerated Epigenetic Aging: Results from the Health and Retirement Study,https://doi.org/10.1101/2022.06.03.22275977,S,1,True,,,False,,,False,not_included_any
hrs,openalex_hrs_S_ml_top350.csv,55,Personality traits and body weight: Evidence from the Health and Retirement Study,nan,S,0,False,,,False,,,False,not_included_any
hrs,openalex_hrs_S_ml_top350.csv,56,Association Between Triglyceride Glucose Index and Risk of New-Onset Diabetes Among Chinese Adults: Findings From the China Health and Retirement Longitudinal Study,https://doi.org/10.3389/fcvm.2020.610322,S,8,True,Cox Proportional Hazards,Survival models,True,Cox Proportional Hazards,Survival models,True,ok
hrs,openalex_hrs_S_ml_top350.csv,57,Health Shocks in Patients with Cancer: A Longitudinal Analysis of Financial and Retirement Trends Using the Health and Retirement Study,nan,S,1,True,Logistic Regression,Linear / GLM,True,Logistic Regression,Linear / GLM,True,ok
hrs,openalex_hrs_S_ml_top350.csv,58,Exploring the Relationship Between Engagement in Enriching Early-Life Activities During Adolescence and Cognition in Later-Life: Results From the Health and Retirement Study,https://doi.org/10.1177/01640275221085660,S,1,True,Linear Regression,Linear / GLM,True,Linear Regression,Linear / GLM,True,ok
hrs,openalex_hrs_S_ml_top350.csv,59,The SALT HRS Spectrograph,nan,S,0,False,,,False,,,False,not_included_any
hrs,openalex_hrs_S_ml_top350.csv,60,A dynamic prognostic model to predict survival in primary myelofibrosis: a study by the IWG-MRT (International Working Group for Myeloproliferative Neoplasms Research and Treatment),https://doi.org/10.1182/blood-2009-09-245837,S,2,True,Cox Proportional Hazards,Survival models,True,,,False,primary_unclear
hrs,openalex_hrs_S_ml_top350.csv,61,Associations Between Traumatic Brain Injury Characteristics and Memory Outcomes: Insights from the Health and Retirement Study,https://doi.org/10.3390/ijerph22020150,S,1,True,Linear Regression,Linear / GLM,True,Linear Regression,Linear / GLM,True,ok
hrs,openalex_hrs_S_ml_top350.csv,62,European Heart Rhythm Association (EHRA)/Heart Rhythm Society (HRS)/Asia Pacific Heart Rhythm Society (APHRS)/Latin American Heart Rhythm Society (LAHRS) expert consensus on arrhythmias and cognitive function: What is the best practice?,https://doi.org/10.1002/joa3.12050,S,3,True,,,False,,,False,not_included_any
hrs,openalex_hrs_S_ml_top350.csv,63,A Comparative Analysis of Oral Health and Self-Rated Health: ‘All of Us Research Program’ vs. ‘Health and Retirement Study’,https://doi.org/10.3390/ijerph21091210,S,3,True,Logistic Regression,Linear / GLM,True,Logistic Regression,Linear / GLM,True,ok
hrs,openalex_hrs_S_ml_top350.csv,64,Complex Marital Histories and Economic Well-being: The Continuing Legacy of Divorce and Widowhood as the HRS Cohort Approaches Retirement,https://doi.org/10.1093/geront/36.3.383,S,2,True,,,False,,,False,not_included_any
hrs,openalex_hrs_S_ml_top350.csv,65,How much do respondents in the health and retirement study know about their contributions to tax-deferred contribution plans? A cross-cohort comparison,https://doi.org/10.1017/s1474747214000237,S,3,True,,,False,,,False,not_included_any
hrs,openalex_hrs_S_ml_top350.csv,66,"Trends in the incidence and prevalence of Alzheimer's disease, dementia, and cognitive impairment in the United States",https://doi.org/10.1016/j.jalz.2010.11.002,S,3,True,,,False,,,False,not_included_any
hrs,openalex_hrs_S_ml_top350.csv,67,"State of the Art of Artificial Intelligence in Clinical Electrophysiology in 2025: A Scientific Statement of the European Heart Rhythm Association (EHRA) of the ESC, the Heart Rhythm Society (HRS), and the ESC Working Group on E-Cardiology",https://doi.org/10.1093/europace/euaf071,S,0,False,,,False,,,False,not_included_any
hrs,openalex_hrs_S_ml_top350.csv,68,"Potential Enhancements to Data on Health Insurance, Health Services, and Medicare in the Health and Retirement Study",https://doi.org/10.2202/1558-9544.1262,S,2,True,,,False,,,False,not_included_any
hrs,openalex_hrs_S_ml_top350.csv,69,DNA methylation age acceleration is associated with incident cognitive impairment in the health and retirement study,https://doi.org/10.1177/13872877251333707,S,3,True,Logistic Regression,Linear / GLM,True,Logistic Regression,Linear / GLM,True,ok
hrs,openalex_hrs_S_ml_top350.csv,70,An Update on Bridge Jobs: The HRS War Babies,nan,S,2,True,,,False,,,False,not_included_any
hrs,openalex_hrs_S_ml_top350.csv,71,"Cognition, function, and mood post-COVID-19: Comparative analysis using the health and retirement study",https://doi.org/10.1371/journal.pone.0315425,S,8,True,Logistic Regression,Linear / GLM,True,Logistic Regression,Linear / GLM,True,ok
hrs,openalex_hrs_S_ml_top350.csv,72,The Impact of Technological Change on Older Workers: Evidence from Data on Computer Use,https://doi.org/10.1177/001979390305600309,S,2,True,,,False,,,False,not_included_any
hrs,openalex_hrs_S_ml_top350.csv,73,2021 HRS Educational Framework for Clinical Cardiac Electrophysiology,https://doi.org/10.1016/j.hroo.2022.02.013,S,2,True,,,False,,,False,not_included_any
hrs,openalex_hrs_S_ml_top350.csv,74,HRS/EHRA Expert Consensus Statement on the State of Genetic Testing for the Channelopathies and Cardiomyopathies,https://doi.org/10.1016/j.hrthm.2011.05.020,S,0,False,,,False,,,False,not_included_any
hrs,openalex_hrs_S_ml_top350.csv,75,HRS/EHRA Expert Consensus Statement on the State of Genetic Testing for the Channelopathies and Cardiomyopathies: This document was developed as a partnership between the Heart Rhythm Society (HRS) and the European Heart Rhythm Association (EHRA),https://doi.org/10.1093/europace/eur245,S,0,False,,,False,,,False,not_included_any
hrs,openalex_hrs_S_ml_top350.csv,76,Executive summary: HRS/EHRA/APHRS expert consensus statement on the diagnosis and management of patients with inherited primary arrhythmia syndromes,https://doi.org/10.1093/europace/eut272,S,1,True,,,False,,,False,not_included_any
hrs,openalex_hrs_S_ml_top350.csv,77,EHRA/HRS/APHRS expert consensus on ventricular arrhythmias,https://doi.org/10.1093/europace/euu194,S,0,False,,,False,,,False,not_included_any
hrs,openalex_hrs_S_ml_top350.csv,78,2019 HRS/EHRA/APHRS/LAHRS expert consensus statement on catheter ablation of ventricular arrhythmias,https://doi.org/10.1093/europace/euz132,S,0,False,,,False,,,False,not_included_any
hrs,openalex_hrs_S_ml_top350.csv,79,2019 HRS/EHRA/APHRS/LAHRS expert consensus statement on catheter ablation of ventricular arrhythmias,https://doi.org/10.1016/j.hrthm.2019.03.002,S,0,False,,,False,,,False,not_included_any
hrs,openalex_hrs_S_ml_top350.csv,80,Quest for a summary measure of biological age: the health and retirement study,https://doi.org/10.1007/s11357-021-00325-1,S,4,True,Elastic Net; Logistic Regression,Linear / GLM,True,Elastic Net,Linear / GLM,True,ok
hrs,openalex_hrs_S_ml_top350.csv,81,Surviving Sepsis Campaign,https://doi.org/10.1097/ccm.0b013e31827e83af,S,2,True,,,False,,,False,not_included_any
hrs,openalex_hrs_S_ml_top350.csv,82,"Data Resource Profile: The Survey of Health, Ageing and Retirement in Europe (SHARE)",https://doi.org/10.1093/ije/dyt088,S,1,True,,,False,,,False,not_included_any
hrs,openalex_hrs_S_ml_top350.csv,83,"Expectations of Nursing Home Use in the Health and Retirement Study: The Role of Gender, Health, and Family Characteristics",https://doi.org/10.1093/geronb/52b.5.s240,S,1,True,,,False,,,False,not_included_any
hrs,openalex_hrs_S_ml_top350.csv,84,2019 HRS/EHRA/APHRS/LAHRS expert consensus statement on catheter ablation of ventricular arrhythmias,https://doi.org/10.1007/s10840-019-00663-3,S,8,True,Transformer; Random Forest; Kaplan–Meier,Deep learning; Survival models; Tree-based ensemble,True,Kaplan–Meier,Survival models,True,ok
hrs,openalex_hrs_S_ml_top350.csv,85,Financial Literacy and Planning: Implications for Retirement Wellbeing,https://doi.org/10.3386/w17078,S,1,True,,,False,,,False,not_included_any
hrs,openalex_hrs_S_ml_top350.csv,86,SELF‐REPORTED VERSUS MEASURED HEIGHT AND WEIGHT IN THE HEALTH AND RETIREMENT STUDY,https://doi.org/10.1111/j.1532-5415.2009.02713.x,S,2,True,,,False,,,False,not_included_any
hrs,openalex_hrs_S_ml_top350.csv,87,Meta-analysis of genome-wide association studies for height and body mass index in ∼700000 individuals of European ancestry,https://doi.org/10.1093/hmg/ddy271,S,1,True,,,False,,,False,not_included_any
hrs,openalex_hrs_S_ml_top350.csv,88,2019 HRS/EHRA/APHRS/LAHRS expert consensus statement on catheter ablation of ventricular arrhythmias: executive summary,https://doi.org/10.1093/europace/euz332,S,0,False,,,False,,,False,not_included_any
hrs,openalex_hrs_S_ml_top350.csv,89,The Validity and Reliability of Retrospective Measures of Childhood Socioeconomic Status in the Health and Retirement Study: Evidence From the 1940 U.S. Census,https://doi.org/10.1093/geronb/gbac045,S,0,False,,,False,,,False,not_included_any
