dataset,source_csv,row_index,title,doi_or_url,regime,regime_score,relevant,models_detected,families_detected,include_any_use,primary_model,primary_family,include_primary_only,primary_reason
noaa,openalex_noaa_S_ml_top350.csv,558,Development Priority Map for Flood Countermeasures by Remote Sensing Data with Geographic Information System,https://doi.org/10.1061/(asce)1084-0699(2002)7:5(346),S,0,False,,,False,,,False,not_included_any
noaa,openalex_noaa_S_ml_top350.csv,559,"EVALUATION OF THE COLLECTION, ARCHIVING AND PUBLICATION OF DAILY SNOW DATA IN THE UNITED STATES",https://doi.org/10.1080/02723646.1989.10642372,S,0,False,,,False,,,False,not_included_any
noaa,openalex_noaa_S_ml_top350.csv,560,Snow Cover and Snow Mass Intercomparisons of General Circulation Models and Remotely Sensed Datasets,https://doi.org/10.1175/1520-0442(1996)009<0409:scasmi>2.0.co;2,S,0,False,,,False,,,False,not_included_any
noaa,openalex_noaa_S_ml_top350.csv,561,Interpreting Meteorological Satellite Images Using a Color-Composite Technique,https://doi.org/10.1175/1520-0477(1987)068<0762:imsiua>2.0.co;2,S,0,False,,,False,,,False,not_included_any
noaa,openalex_noaa_S_ml_top350.csv,562,Impacts of Urbanization and Climate Variability on Floods in Northeastern Illinois,https://doi.org/10.1061/(asce)he.1943-5584.0000020,S,0,False,,,False,,,False,not_included_any
noaa,openalex_noaa_S_ml_top350.csv,563,Improved Stepped Frequency Microwave Radiometer Tropical Cyclone Surface Winds in Heavy Precipitation,https://doi.org/10.1175/jtech-d-14-00028.1,S,0,False,,,False,,,False,not_included_any
noaa,openalex_noaa_S_ml_top350.csv,564,GFDL's SPEAR Seasonal Prediction System: Initialization and Ocean Tendency Adjustment (OTA) for Coupled Model Predictions,https://doi.org/10.1029/2020ms002149,S,0,False,Ensemble,Ensemble / stacking,False,,,False,not_included_any
noaa,openalex_noaa_S_ml_top350.csv,565,Global and regional emissions estimates for N <sub>2</sub> O,https://doi.org/10.5194/acp-14-4617-2014,S,0,False,,,False,,,False,not_included_any
noaa,openalex_noaa_S_ml_top350.csv,566,Benchmarking High-Resolution Global Satellite Rainfall Products to Radar and Rain-Gauge Rainfall Estimates,https://doi.org/10.1109/tgrs.2009.2034736,S,0,False,,,False,,,False,not_included_any
noaa,openalex_noaa_S_ml_top350.csv,567,"Polar amplification and elevation-dependence in trends of Northern Hemisphere snow cover extent, 1971–2014",https://doi.org/10.1088/1748-9326/10/4/044010,S,0,False,,,False,,,False,not_included_any
noaa,openalex_noaa_S_ml_top350.csv,568,Evaluation of upper tropospheric water vapor in the NCAR Community Climate Model (CCM3) using modeled and observed HIRS radiances,https://doi.org/10.1029/2002jd002539,S,0,False,,,False,,,False,not_included_any
noaa,openalex_noaa_S_ml_top350.csv,569,Drought-induced vegetation stress in southwestern North America,https://doi.org/10.1088/1748-9326/5/2/024008,S,0,False,,,False,,,False,not_included_any
noaa,openalex_noaa_S_ml_top350.csv,570,A statistical solar flare forecast method,https://doi.org/10.1029/2004sw000131,S,0,False,,,False,,,False,not_included_any
noaa,openalex_noaa_S_ml_top350.csv,571,Cloud_cci Advanced Very High Resolution Radiometer post meridiem (AVHRR-PM) dataset version 3: 35-year climatology of global cloud and radiation properties,https://doi.org/10.5194/essd-12-41-2020,S,0,False,Linear Regression; Ensemble,Ensemble / stacking; Linear / GLM,False,,,False,not_included_any
noaa,openalex_noaa_S_ml_top350.csv,572,Error Structure and Atmospheric Temperature Trends in Observations from the Microwave Sounding Unit,https://doi.org/10.1175/2008jcli2233.1,S,0,False,,,False,,,False,not_included_any
noaa,openalex_noaa_S_ml_top350.csv,573,Analysis of MABEL Bathymetry in Keweenaw Bay and Implications for ICESat-2 ATLAS,https://doi.org/10.3390/rs8090772,S,0,False,,,False,,,False,not_included_any
noaa,openalex_noaa_S_ml_top350.csv,574,An approach to designing a national climate service,https://doi.org/10.1073/pnas.0609090103,S,0,False,,,False,,,False,not_included_any
noaa,openalex_noaa_S_ml_top350.csv,575,A calibration method for fully polarimetric microwave radiometers,https://doi.org/10.1109/tgrs.2003.810203,S,0,False,,,False,,,False,not_included_any
noaa,openalex_noaa_S_ml_top350.csv,576,Experimental Evaluation of Sentinel-2 Spectral Response Functions for NDVI Time-Series Continuity,https://doi.org/10.1109/tgrs.2012.2235447,S,0,False,,,False,,,False,not_included_any
noaa,openalex_noaa_S_ml_top350.csv,577,Greening Local Energy: Explaining the Geographic Distribution of Household Solar Energy Use in the United States,https://doi.org/10.1080/01944360802310594,S,0,False,,,False,,,False,not_included_any
noaa,openalex_noaa_S_ml_top350.csv,578,The ELDORA/ASTRAIA Airborne Doppler Weather Radar: High-Resolution Observations from TOGA COARE,https://doi.org/10.1175/1520-0477(1996)077<0213:teadwr>2.0.co;2,S,0,False,,,False,,,False,not_included_any
noaa,openalex_noaa_S_ml_top350.csv,579,Correction to “Recent cooling of the upper ocean”,https://doi.org/10.1029/2007gl030323,S,0,False,,,False,,,False,not_included_any
noaa,openalex_noaa_S_ml_top350.csv,580,An Overview of the Science Performances and Calibration/Validation of Joint Polar Satellite System Operational Products,https://doi.org/10.3390/rs11060698,S,0,False,,,False,,,False,not_included_any
noaa,openalex_noaa_S_ml_top350.csv,581,Evaluation of snow extent and its variability in the Atmospheric Model Intercomparison Project,https://doi.org/10.1029/98jd00109,S,0,False,,,False,,,False,not_included_any
noaa,openalex_noaa_S_ml_top350.csv,582,The GSMaP Precipitation Retrieval Algorithm for Microwave Sounders—Part I: Over-Ocean Algorithm,https://doi.org/10.1109/tgrs.2009.2019954,S,0,False,,,False,,,False,not_included_any
noaa,openalex_noaa_S_ml_top350.csv,583,A Multifrequency Polarimetric SAR Processing Chain to Observe Oil Fields in the Gulf of Mexico,https://doi.org/10.1109/tgrs.2011.2158828,S,0,False,,,False,,,False,not_included_any
noaa,openalex_noaa_S_ml_top350.csv,584,Evaluation of snow products over the Tibetan Plateau,https://doi.org/10.1002/hyp.10427,S,0,False,,,False,,,False,not_included_any
noaa,openalex_noaa_S_ml_top350.csv,585,Using Moderate Resolution Imaging Spectrometer (MODIS) to calibrate advanced very high resolution radiometer reflectance channels,https://doi.org/10.1029/2001jd002035,S,0,False,,,False,,,False,not_included_any
noaa,openalex_noaa_S_ml_top350.csv,586,An assessment of buoy‐derived and numerical weather prediction surface heat fluxes in the tropical Pacific,https://doi.org/10.1029/2005jc003324,S,0,False,,,False,,,False,not_included_any
noaa,openalex_noaa_S_ml_top350.csv,587,Forecast of NDVI in coniferous areas using temporal ARIMA analysis and climatic data at a regional scale,https://doi.org/10.1080/01431160903586765,S,0,False,ARIMA,Probabilistic / statistical,False,,,False,not_included_any
noaa,openalex_noaa_S_ml_top350.csv,588,Response of the Joint Ocean-Atmosphere Model to the Seasonal Variation of the Solar Radiation,https://doi.org/10.1175/1520-0493(1972)100<0042:rotjom>2.3.co;2,S,0,False,,,False,,,False,not_included_any
noaa,openalex_noaa_S_ml_top350.csv,589,Inter-calibration of polar imager solar channels using SEVIRI,https://doi.org/10.5194/amt-6-2495-2013,S,0,False,,,False,,,False,not_included_any
noaa,openalex_noaa_S_ml_top350.csv,590,"Estimating Recent Local Impacts of Sea-Level Rise on Current Real-Estate Losses: A Housing Market Case Study in Miami-Dade, Florida",https://doi.org/10.1007/s11113-018-9473-5,S,3,True,,,False,,,False,not_included_any
noaa,openalex_noaa_S_ml_top350.csv,591,Hemispheric snow cover from satellites,https://doi.org/10.1017/s0260305500013112,S,0,False,RNN,Deep learning,False,,,False,not_included_any
noaa,openalex_noaa_S_ml_top350.csv,592,IWRAP: the Imaging Wind and Rain Airborne Profiler for remote sensing of the ocean and the atmospheric boundary layer within tropical cyclones,https://doi.org/10.1109/tgrs.2005.851640,S,0,False,,,False,,,False,not_included_any
noaa,openalex_noaa_S_ml_top350.csv,593,Tactical Modeling of Surface Oil Transport During the Deepwater Horizon Spill Response,https://doi.org/10.1029/2011gm001128,S,0,False,Ensemble,Ensemble / stacking,False,,,False,not_included_any
noaa,openalex_noaa_S_ml_top350.csv,594,An elastic contour matching model for tropical cyclone pattern recognition,https://doi.org/10.1109/3477.931532,S,0,False,,,False,,,False,not_included_any
noaa,openalex_noaa_S_ml_top350.csv,595,Implementation of GOES‐based land surface temperature diurnal cycle to AVHRR,https://doi.org/10.1080/01431160500117634,S,0,False,,,False,,,False,not_included_any
noaa,openalex_noaa_S_ml_top350.csv,596,Variation of Great Lakes water levels derived from Geosat altimetry,https://doi.org/10.1029/94wr00064,S,0,False,,,False,,,False,not_included_any
noaa,openalex_noaa_S_ml_top350.csv,597,Atmospheric transmittance of an absorbing gas 7 Further improvements to the OPTRAN 6 approach,https://doi.org/10.1364/ao.45.002028,S,0,False,,,False,,,False,not_included_any
noaa,openalex_noaa_S_ml_top350.csv,598,Measurements and products from the Solar Backscatter Ultraviolet (SBUV/2) and Ozone Mapping and Profiler Suite (OMPS) instruments,https://doi.org/10.1080/01431160902825040,S,0,False,,,False,,,False,not_included_any
noaa,openalex_noaa_S_ml_top350.csv,599,Multivariate ensemble Model Output Statistics using empirical copulas,https://doi.org/10.1002/qj.2414,S,0,False,Ensemble,Ensemble / stacking,False,,,False,not_included_any
noaa,openalex_noaa_S_ml_top350.csv,600,Surface Emissivity of Arctic Sea Ice at AMSU Window Frequencies,https://doi.org/10.1109/tgrs.2008.916630,S,0,False,,,False,,,False,not_included_any
noaa,openalex_noaa_S_ml_top350.csv,601,Preliminary Assessment of Wind and Wave Retrieval from Chinese Gaofen-3 SAR Imagery,https://doi.org/10.3390/s17081705,S,0,False,,,False,,,False,not_included_any
noaa,openalex_noaa_S_ml_top350.csv,602,Lionfish: a major marine invasion,https://doi.org/10.3354/meps11909,S,0,False,,,False,,,False,not_included_any
noaa,openalex_noaa_S_ml_top350.csv,603,Geostationary Operational Environmental Satellite (GOES)-14 super rapid scan operations to prepare for GOES-R,https://doi.org/10.1117/1.jrs.7.073462,S,0,False,,,False,,,False,not_included_any
noaa,openalex_noaa_S_ml_top350.csv,604,Short-Range Ensemble Predictions of 2-m Temperature and Dewpoint Temperature over New England,https://doi.org/10.1175/1520-0493(2003)131<2510:sepomt>2.0.co;2,S,0,False,Ensemble,Ensemble / stacking,False,,,False,not_included_any
noaa,openalex_noaa_S_ml_top350.csv,605,Mid-upper tropospheric methane retrieval from IASI and its validation,https://doi.org/10.5194/amt-6-2255-2013,S,0,False,,,False,,,False,not_included_any
noaa,openalex_noaa_S_ml_top350.csv,606,Statistical method to predict the sunspots number,https://doi.org/10.1016/j.nrjag.2018.08.001,S,0,False,ARIMA,Probabilistic / statistical,False,,,False,not_included_any
noaa,openalex_noaa_S_ml_top350.csv,607,Quaternary rivers on the New Jersey shelf: Relation of seafloor to buried valleys,https://doi.org/10.1130/0091-7613(1980)8<276:qrotnj>2.0.co;2,S,0,False,,,False,,,False,not_included_any
noaa,openalex_noaa_S_ml_top350.csv,608,Adjusting Satellite Precipitation Data to Facilitate Hydrologic Modeling,https://doi.org/10.1175/2010jhm1206.1,S,0,False,,,False,,,False,not_included_any
noaa,openalex_noaa_S_ml_top350.csv,609,Surface Mooring Network in the Kuroshio Extension,https://doi.org/10.1109/jsyst.2008.925982,S,0,False,,,False,,,False,not_included_any
noaa,openalex_noaa_S_ml_top350.csv,610,"A new land cover map of central Africa derived from multi-resolution, multi-temporal AVHRR data",https://doi.org/10.1080/014311698213803,S,0,False,,,False,,,False,not_included_any
noaa,openalex_noaa_S_ml_top350.csv,611,Economic feasibility of cooling dry cows across the United States,https://doi.org/10.3168/jds.2016-11566,S,0,False,,,False,,,False,not_included_any
noaa,openalex_noaa_S_ml_top350.csv,612,The Evaluation of Real-Time Hurricane Analysis and Forecast System (HAFS) Stand-Alone Regional (SAR) Model Performance for the 2019 Atlantic Hurricane Season,https://doi.org/10.3390/atmos11060617,S,0,False,,,False,,,False,not_included_any
noaa,openalex_noaa_S_ml_top350.csv,613,Evaluation of preliminary experiments assimilating Seasat significant wave heights into a spectral wave model,https://doi.org/10.1029/jc093ic11p14099,S,0,True,Ensemble,Ensemble / stacking,True,,,False,primary_unclear
noaa,openalex_noaa_S_ml_top350.csv,614,Flood forecasting on the Tocantins River using ensemble rainfall forecasts and real‐time satellite rainfall estimates,https://doi.org/10.1111/jfr3.12177,S,0,False,Ensemble,Ensemble / stacking,False,,,False,not_included_any
noaa,openalex_noaa_S_ml_top350.csv,615,Seasonal fluctuation in the incidence of intracranial aneurysm rupture and its relationship to changing climatic conditions,https://doi.org/10.3171/jns.1994.81.4.0525,S,0,False,,,False,,,False,not_included_any
noaa,openalex_noaa_S_ml_top350.csv,616,The 1997 Pan American Climate Studies Tropical Eastern Pacific Process Study. Part II: Stratocumulus Region<sup>*</sup>,https://doi.org/10.1175/1520-0477(2000)081<0483:tpacst>2.3.co;2,S,0,False,,,False,,,False,not_included_any
noaa,openalex_noaa_S_ml_top350.csv,617,Aerosol measurements at the South Pole,https://doi.org/10.1111/j.1600-0889.1986.tb00189.x,S,0,False,,,False,,,False,not_included_any
noaa,openalex_noaa_S_ml_top350.csv,618,"Predation on gray whales and prolonged feeding on submerged carcasses by transient killer whales at Unimak Island, Alaska",https://doi.org/10.3354/meps08906,S,0,False,,,False,,,False,not_included_any
noaa,openalex_noaa_S_ml_top350.csv,619,Artificial neural network based daily local forecasting for global solar radiation,https://doi.org/10.1016/j.apenergy.2014.05.055,S,0,False,,,False,,,False,not_included_any
noaa,openalex_noaa_S_ml_top350.csv,620,Predicted growth in plastic waste exceeds efforts to mitigate plastic pollution,https://doi.org/10.1126/science.aba3656,S,0,False,,,False,,,False,not_included_any
noaa,openalex_noaa_S_ml_top350.csv,621,"An ANN algorithm for automatic, real-time tsunami detection in deep-sea level measurements",https://doi.org/10.1016/j.oceaneng.2007.11.009,S,0,False,,,False,,,False,not_included_any
noaa,openalex_noaa_S_ml_top350.csv,622,Interannual variability in the oxygen isotopes of atmospheric CO2 driven by El Niño,https://doi.org/10.1038/nature10421,S,0,False,,,False,,,False,not_included_any
noaa,openalex_noaa_S_ml_top350.csv,623,Interannual Variability in Terrestrial Net Primary Production: Exploration of Trends and Controls on Regional to Global Scales,https://doi.org/10.1007/s100219900056,S,0,False,,,False,,,False,not_included_any
noaa,openalex_noaa_S_ml_top350.csv,624,"Prediction of crop yield, water consumption and water use efficiency with a SVAT-crop growth model using remotely sensed data on the North China Plain",https://doi.org/10.1016/j.ecolmodel.2004.07.032,S,0,False,,,False,,,False,not_included_any
noaa,openalex_noaa_S_ml_top350.csv,625,Annual variations in water storage and precipitation in the Amazon Basin,https://doi.org/10.1007/s00190-007-0153-1,S,0,False,,,False,,,False,not_included_any
noaa,openalex_noaa_S_ml_top350.csv,626,Verification of the Origins of Rotation in Tornadoes Experiment: VORTEX,https://doi.org/10.1175/1520-0477(1994)075<0995:votoor>2.0.co;2,S,0,False,,,False,,,False,not_included_any
noaa,openalex_noaa_S_ml_top350.csv,627,An assessment on oil spill trajectory prediction: Case study on oil spill off Ennore Port,https://doi.org/10.1007/s12040-018-1015-3,S,0,False,,,False,,,False,not_included_any
openaq,openalex_openaq_S_ml_top350.csv,0,Machine Learning-Based Prediction of PM2.5 and PM10 Levels in Raipur’s Air Quality,https://doi.org/10.55041/ijsrem50284,S,1,True,LSTM; Random Forest; XGBoost; Linear Regression,Deep learning; Linear / GLM; Tree-based ensemble,True,,,False,primary_unclear
openaq,openalex_openaq_S_ml_top350.csv,1,NASA’s Satellite-Powered Air Quality Forecasting,https://doi.org/10.1109/icssas66150.2025.11081087,S,0,False,CNN; DNN,Deep learning,False,,,False,not_included_any
openaq,openalex_openaq_S_ml_top350.csv,2,"MYAIRCARE: A Smart Environmental Health Platform for Outdoor Pollution Tracking, Personalized Risk Prediction, and Real-Time Alert Generation Using IoT and Machine Learning",https://doi.org/10.1109/icsss66939.2025.11346135,S,1,True,LightGBM; Random Forest,Tree-based ensemble,True,LightGBM,Tree-based ensemble,True,ok
openaq,openalex_openaq_S_ml_top350.csv,3,Novel Prediction Model for Air Quality And Health Risk Prediction,https://doi.org/10.1109/icipcn67432.2026.11438653,S,1,True,LSTM; XGBoost,Deep learning; Tree-based ensemble,True,,,False,primary_unclear
openaq,openalex_openaq_S_ml_top350.csv,4,Sustainable Modeling of the Urban Air Quality in Abu Dhabi Using Machine Learning and Open-Source Satellite Data,https://doi.org/10.69709/susproc.2025.120032,S,0,False,LSTM; Random Forest,Deep learning; Tree-based ensemble,False,,,False,not_included_any
openaq,openalex_openaq_S_ml_top350.csv,5,Regime-aware hybrid ensemble learning for adaptive $$\hbox {PM}_{2.5}$$ forecasting in urban environments,https://doi.org/10.1038/s41598-026-45437-w,S,0,False,CNN; DNN; GRU; LSTM; RNN; Transformer; CatBoost; Gradient Boosting; LightGBM; XGBoost; Ensemble; Federated Learning,Deep learning; Ensemble / stacking; Other classical ML; Tree-based ensemble,False,,,False,not_included_any
openaq,openalex_openaq_S_ml_top350.csv,6,AN INTEGRATED MACHINE LEARNING FRAMEWORK FOR AIR QUALITY MONITORING AND ASSESSMENT,https://doi.org/10.5281/zenodo.18609164,S,0,False,Random Forest; Linear Regression,Linear / GLM; Tree-based ensemble,False,,,False,not_included_any
openaq,openalex_openaq_S_ml_top350.csv,7,AN INTEGRATED MACHINE LEARNING FRAMEWORK FOR AIR QUALITY MONITORING AND ASSESSMENT,https://doi.org/10.5281/zenodo.18609163,S,0,False,Random Forest; Linear Regression,Linear / GLM; Tree-based ensemble,False,,,False,not_included_any
openaq,openalex_openaq_S_ml_top350.csv,8,Artificial Neural Network for the Prediction of Particulate Matter (PM<sub>2.5</sub>),https://doi.org/10.1109/icaect49130.2021.9392611,S,0,True,Linear Regression,Linear / GLM,True,Linear Regression,Linear / GLM,True,ok
openaq,openalex_openaq_S_ml_top350.csv,9,IMPLEMENTASI BIG DATA ANALYTICS DALAM KLASIFIKASI KUALITAS UDARA MENGGUNAKAN ALGORITMA GRADIENT-BOOSTED TREE CLASSIFIER PADA PYSPARK,https://doi.org/10.58641/technomedia.v2i1.124,S,0,False,,,False,,,False,not_included_any
openaq,openalex_openaq_S_ml_top350.csv,10,AIR QUALITY FORECASTING USING LSTM MODELS: A STUDY IN DELHI,https://doi.org/10.25215/8194288770.22,S,0,False,DNN; LSTM,Deep learning,False,,,False,not_included_any
openaq,openalex_openaq_S_ml_top350.csv,11,"A Deep Learning approach to de-bias Air Quality forecasts, using heterogeneous Open Data sources as reference",https://doi.org/10.5194/egusphere-egu22-1255,S,0,False,DNN; MLP,Deep learning,False,,,False,not_included_any
openaq,openalex_openaq_S_ml_top350.csv,12,Reconstructing global PM<sub>2.5</sub> monitoring dataset from OpenAQ using a two-step spatio-temporal model based on SES-IDW and LSTM,https://doi.org/10.1088/1748-9326/ac52c9,S,0,False,LSTM; Gradient Boosting,Deep learning; Tree-based ensemble,False,,,False,not_included_any
openaq,openalex_openaq_S_ml_top350.csv,13,Providing Fine Temporal and Spatial Resolution Analyses of Airborne Particulate Matter Utilizing Complimentary In Situ IoT Sensor Network and Remote Sensing Approaches,https://doi.org/10.3390/rs16132454,S,0,False,,,False,,,False,not_included_any
openaq,openalex_openaq_S_ml_top350.csv,14,Providing Fine Temporal and Spatial Resolution Analyses of Airborne Particulate Matter Utilizing Complimentary In-Situ IoT Sensor Network and Remote Sensing Approaches,https://doi.org/10.20944/preprints202405.1685.v1,S,0,False,,,False,,,False,not_included_any
openaq,openalex_openaq_S_ml_top350.csv,15,Creating an open algorithm ecosystem on top of open air quality data from 70 countries,https://doi.org/10.1097/01.ee9.0000607452.93774.44,S,1,True,,,False,,,False,not_included_any
openaq,openalex_openaq_S_ml_top350.csv,16,Exposure assessment of PM2.5 using smart spatial interpolation on regulatory air quality stations with clustering of densely-deployed microsensors,https://doi.org/10.1016/j.envpol.2021.118401,S,1,True,,,False,,,False,not_included_any
openaq,openalex_openaq_S_ml_top350.csv,17,"Science AMA Series: We're the OpenAQ Team, building the world's first open data, open-source real-time and historical air pollution platform. We are building it because open data helps people fight air inequality and no one else was building it. Ask Us Anything!",https://doi.org/10.15200/winn.148362.20666,S,0,False,,,False,,,False,not_included_any
openaq,openalex_openaq_S_ml_top350.csv,18,An Automated Data Ingestion Workflow for the TOAR Database,https://doi.org/10.5194/egusphere-egu23-7455,S,0,False,,,False,,,False,not_included_any
openaq,openalex_openaq_S_ml_top350.csv,19,"PM2.5 Exposure Assessment and Health Impact Analysis for School Environments in Tashkent, Uzbekistan",https://doi.org/10.5281/zenodo.17815458,S,0,False,,,False,,,False,not_included_any
openaq,openalex_openaq_S_ml_top350.csv,20,"PM2.5 Exposure Assessment and Health Impact Analysis for School Environments in Tashkent, Uzbekistan",https://doi.org/10.5281/zenodo.17802403,S,0,False,,,False,,,False,not_included_any
openaq,openalex_openaq_S_ml_top350.csv,21,"PM2.5 Exposure Assessment and Health Impact Analysis for School Environments in Tashkent, Uzbekistan",https://doi.org/10.5281/zenodo.17792119,S,0,False,,,False,,,False,not_included_any
openaq,openalex_openaq_S_ml_top350.csv,22,"PM2.5 Exposure Assessment and Health Impact Analysis for School Environments in Tashkent, Uzbekistan (Station 8881 - U.S. Embassy)",https://doi.org/10.5281/zenodo.17792118,S,0,False,,,False,,,False,not_included_any
openaq,openalex_openaq_S_ml_top350.csv,23,"PM2.5 Exposure Assessment and Health Impact Analysis for School Environments in Tashkent, Uzbekistan (Station 8881 - U.S. Embassy)",https://doi.org/10.5281/zenodo.18163610,S,0,False,,,False,,,False,not_included_any
openaq,openalex_openaq_S_ml_top350.csv,24,"PM2.5 Exposure Assessment and Health Impact Analysis for School Environments in Tashkent, Uzbekistan",https://doi.org/10.5281/zenodo.17897779,S,0,False,,,False,,,False,not_included_any
openaq,openalex_openaq_S_ml_top350.csv,25,Quality-Assurance Procedures in Low- and Middle-Income Countries,https://doi.org/10.1596/978-1-4648-1727-4_ch4,S,0,False,,,False,,,False,not_included_any
openaq,openalex_openaq_S_ml_top350.csv,26,Detecting Pollution Anomalies in Multivariate Air Quality Datasets with Unsupervised Machine Learning,https://doi.org/10.51584/ijrias.2025.100700097,S,1,True,Autoencoder; CNN; DNN; GRU; Graph neural network; LSTM; Ensemble,Deep learning; Ensemble / stacking,True,Autoencoder,Deep learning,True,ok
openaq,openalex_openaq_S_ml_top350.csv,27,"Dataset: Daily Air Quality Index and Pollutant Concentrations for Mumbai, India",https://doi.org/10.17632/9dcb8jmbts.1,S,0,False,,,False,,,False,not_included_any
openaq,openalex_openaq_S_ml_top350.csv,28,"Dataset: Daily Air Quality Index and Pollutant Concentrations for Mumbai, India",https://doi.org/10.17632/9dcb8jmbts,S,0,False,,,False,,,False,not_included_any
openaq,openalex_openaq_S_ml_top350.csv,29,"Dataset: Daily Air Quality Index and Pollutant Concentrations for Pune, India",https://doi.org/10.17632/y6p778djzj,S,0,False,,,False,,,False,not_included_any
openaq,openalex_openaq_S_ml_top350.csv,30,"Dataset: Daily Air Quality Index and Pollutant Concentrations for Pune, India",https://doi.org/10.17632/y6p778djzj.1,S,0,False,,,False,,,False,not_included_any
openaq,openalex_openaq_S_ml_top350.csv,31,Predicting PM2.5 Concentrations Across USA Using Machine Learning,https://doi.org/10.22541/au.167631720.03707478/v1,S,0,False,LSTM; AdaBoost; Gradient Boosting; Random Forest; Linear Regression; Support Vector Machine; k-Nearest Neighbors; Decision Tree,Deep learning; Kernel / instance-based; Linear / GLM; Other classical ML; Tree-based ensemble,False,,,False,not_included_any
openaq,openalex_openaq_S_ml_top350.csv,32,Predicting PM2.5 Concentrations Across USA Using Machine Learning,https://doi.org/10.22541/essoar.167810257.71512045/v1,S,0,False,LSTM; AdaBoost; Gradient Boosting; Random Forest; Linear Regression; Support Vector Machine; k-Nearest Neighbors; Decision Tree,Deep learning; Kernel / instance-based; Linear / GLM; Other classical ML; Tree-based ensemble,False,,,False,not_included_any
openaq,openalex_openaq_S_ml_top350.csv,33,AI-Based Predictive Modeling For Air Quality Assessment And Environmental Risk Forecasting In Urban Ecosystems,https://doi.org/10.64252/n5gynb06,S,1,True,LSTM; Gradient Boosting; Random Forest; Ensemble,Deep learning; Ensemble / stacking; Tree-based ensemble,True,Ensemble,Ensemble / stacking,True,ok
openaq,openalex_openaq_S_ml_top350.csv,34,Predicting PM<sub>2.5</sub> Concentrations Across USA Using Machine Learning,https://doi.org/10.1029/2023ea002911,S,0,True,LSTM; AdaBoost; Gradient Boosting; Random Forest; XGBoost; Linear Regression; Support Vector Machine; Decision Tree,Deep learning; Kernel / instance-based; Linear / GLM; Other classical ML; Tree-based ensemble,True,,,False,primary_unclear
openaq,openalex_openaq_S_ml_top350.csv,35,Residual Stacking with Temporal Convolutional Network and Light Gradient Boosting for Air Quality Index Prediction,https://doi.org/10.22266/ijies2026.0331.17,S,0,False,TCN; Gradient Boosting; LightGBM; Ensemble,Deep learning; Ensemble / stacking; Tree-based ensemble,False,,,False,not_included_any
openaq,openalex_openaq_S_ml_top350.csv,36,A dataset of harmonized global air quality monitoring metadata,https://doi.org/10.1038/s41597-026-06797-0,S,2,True,CNN; DNN; Transformer,Deep learning,True,,,False,primary_unclear
