openalex_id,doi,title,year,publication_date,type,cited_by_count,relevance_score,authors,source,dataset_mentioned,ml_match_count,matched_ml_terms,regime_selected,regime_match_count,matched_regime_terms,abstract
https://openalex.org/W2988998929,https://doi.org/10.1155/2019/8152713,A Long Short-Term Memory Ensemble Approach for Improving the Outcome Prediction in Intensive Care Unit,2019,2019-11-03,article,35,67.35871,"Jing Xia, Pan Su, Min Zhu, et al.",Computational and Mathematical Methods in Medicine,True,9,prediction; classifier; classification; algorithm; random forest; neural network; recurrent neural network; rnn; lstm,S,0,,"In intensive care unit (ICU), it is essential to predict the mortality of patients and mathematical models aid in improving the prognosis accuracy. Recently, recurrent neural network (RNN), especially long short-term memory (LSTM) network, showed advantages in sequential modeling and was promising for clinical prediction. However, ICU data are highly complex due to the diverse patterns of diseases; therefore, instead of single LSTM model, an ensemble algorithm of LSTM (eLSTM) is proposed, utilizing the superiority of the ensemble framework to handle the diversity of clinical data. The eLSTM algorithm was evaluated by the acknowledged database of ICU admissions Medical Information Mart for Intensive Care III (MIMIC-III). The investigation in total of 18415 cases shows that compared with clinical scoring systems SAPS II, SOFA, and APACHE II, random forests classification algorithm, and the single LSTM classifier, the eLSTM model achieved the superior performance with the largest value of area under the receiver operating characteristic curve (AUROC) of 0.8451 and the largest area under the precision-recall curve (AUPRC) of 0.4862. Furthermore, it offered an early prognosis of ICU patients. The results demonstrate that the eLSTM is capable of dynamically predicting the mortality of patients in complex clinical situations."
https://openalex.org/W3189666424,https://doi.org/10.3390/bios11080269,Atrial Fibrillation Prediction from Critically Ill Sepsis Patients,2021,2021-08-09,article,28,64.47161,"Syed Khairul Bashar, Eric Ding, Allan J. Walkey, et al.",Biosensors,True,9,machine learning; prediction; predictive; classifier; algorithm; random forest; support vector machine; svm; ann,S,0,,"Sepsis is defined by life-threatening organ dysfunction during infection and is the leading cause of death in hospitals. During sepsis, there is a high risk that new onset of atrial fibrillation (AF) can occur, which is associated with significant morbidity and mortality. Consequently, early prediction of AF during sepsis would allow testing of interventions in the intensive care unit (ICU) to prevent AF and its severe complications. In this paper, we present a novel automated AF prediction algorithm for critically ill sepsis patients using electrocardiogram (ECG) signals. From the heart rate signal collected from 5-min ECG, feature extraction is performed using the traditional time, frequency, and nonlinear domain methods. Moreover, variable frequency complex demodulation and tunable Q-factor wavelet-transform-based time-frequency methods are applied to extract novel features from the heart rate signal. Using a selected feature subset, several machine learning classifiers, including support vector machine (SVM) and random forest (RF), were trained using only the 2001 Computers in Cardiology data set. For testing the proposed method, 50 critically ill ICU subjects from the Medical Information Mart for Intensive Care (MIMIC) III database were used in this study. Using distinct and independent testing data from MIMIC III, the SVM achieved 80% sensitivity, 100% specificity, 90% accuracy, 100% positive predictive value, and 83.33% negative predictive value for predicting AF immediately prior to the onset of AF, while the RF achieved 88% AF prediction accuracy. When we analyzed how much in advance we can predict AF events in critically ill sepsis patients, the algorithm achieved 80% accuracy for predicting AF events 10 min early. Our algorithm outperformed a state-of-the-art method for predicting AF in ICU patients, further demonstrating the efficacy of our proposed method. The annotations of patients' AF transition information will be made publicly available for other investigators. Our algorithm to predict AF onset is applicable for any ECG modality including patch electrodes and wearables, including Holter, loop recorder, and implantable devices."
https://openalex.org/W4401015862,https://doi.org/10.1097/md.0000000000038747,Development and Validation of an Interpretable Machine Learning Model for Early Prognosis Prediction in ICU Patients with Malignant Tumors and Hyperkalemia,2024,2024-07-26,article,6,55.223297,"Zhijun Bu, Nan Jiang, Kecheng Li, et al.",Medicine,True,9,machine learning; prediction; predictive; algorithm; lasso; gradient boosting; xgboost; auc; area under the curve,S,0,,"This study aims to develop and validate a machine learning (ML) predictive model for assessing mortality in patients with malignant tumors and hyperkalemia (MTH). We extracted data on patients with MTH from the Medical Information Mart for Intensive Care-IV, version 2.2 (MIMIC-IV v2.2) database. The dataset was split into a training set (75%) and a validation set (25%). We used the Least Absolute Shrinkage and Selection Operator (LASSO) regression to identify potential predictors, which included clinical laboratory indicators and vital signs. Pearson correlation analysis tested the correlation between predictors. In-hospital death was the prediction target. The Area Under the Curve (AUC) and accuracy of the training and validation sets of 7 ML algorithms were compared, and the optimal 1 was selected to develop the model. The calibration curve was used to evaluate the prediction accuracy of the model further. SHapley Additive exPlanations (SHAP) and Local Interpretable Model-agnostic Explanations (LIME) enhanced model interpretability. 496 patients with MTH in the Intensive Care Unit (ICU) were included. After screening, 17 clinical features were included in the construction of the ML model, and the Pearson correlation coefficient was <0.8, indicating that the correlation between the clinical features was small. eXtreme Gradient Boosting (XGBoost) outperformed other algorithms, achieving perfect scores in the training set (accuracy: 1.000, AUC: 1.000) and high scores in the validation set (accuracy: 0.734, AUC: 0.733). The calibration curves indicated good predictive calibration of the model. SHAP analysis identified the top 8 predictive factors: urine output, mean heart rate, maximum urea nitrogen, minimum oxygen saturation, minimum mean blood pressure, maximum total bilirubin, mean respiratory rate, and minimum pH. In addition, SHAP and LIME performed in-depth individual case analyses. This study demonstrates the effectiveness of ML methods in predicting mortality risk in ICU patients with MTH. It highlights the importance of predictors like urine output and mean heart rate. SHAP and LIME significantly enhanced the model's interpretability."
https://openalex.org/W4308118698,https://doi.org/10.3390/jcm11216460,Applying an Improved Stacking Ensemble Model to Predict the Mortality of ICU Patients with Heart Failure,2022,2022-10-31,article,39,54.038193,"Chih‐Chou Chiu, Chung-Min Wu, Te-Nien Chien, et al.",Journal of Clinical Medicine,True,9,prediction; classifier; classification; gbm; adaboost; knn; ensemble model; stacking; bagging,S,0,,"Cardiovascular diseases have been identified as one of the top three causes of death worldwide, with onset and deaths mostly due to heart failure (HF). In ICU, where patients with HF are at increased risk of death and consume significant medical resources, early and accurate prediction of the time of death for patients at high risk of death would enable them to receive appropriate and timely medical care. The data for this study were obtained from the MIMIC-III database, where we collected vital signs and tests for 6699 HF patient during the first 24 h of their first ICU admission. In order to predict the mortality of HF patients in ICUs more precisely, an integrated stacking model is proposed and applied in this paper. In the first stage of dataset classification, the datasets were subjected to first-level classifiers using RF, SVC, KNN, LGBM, Bagging, and Adaboost. Then, the fusion of these six classifier decisions was used to construct and optimize the stacked set of second-level classifiers. The results indicate that our model obtained an accuracy of 95.25% and AUROC of 82.55% in predicting the mortality rate of HF patients, which demonstrates the outstanding capability and efficiency of our method. In addition, the results of this study also revealed that platelets, glucose, and blood urea nitrogen were the clinical features that had the greatest impact on model prediction. The results of this analysis not only improve the understanding of patients' conditions by healthcare professionals but allow for a more optimal use of healthcare resources."
https://openalex.org/W4386280496,https://doi.org/10.1371/journal.pone.0289930,Paying attention to cardiac surgical risk: An interpretable machine learning approach using an uncertainty-aware attentive neural network,2023,2023-08-30,article,5,53.544147,"Jahan C. Penny‐Dimri, Christoph Bergmeir, Christopher M. Reid, et al.",PLoS ONE,True,9,machine learning; deep learning; prediction; regression model; logistic regression; xgboost; neural network; auc; model performance,S,0,,"Machine learning (ML) is increasingly applied to predict adverse postoperative outcomes in cardiac surgery. Commonly used ML models fail to translate to clinical practice due to absent model explainability, limited uncertainty quantification, and no flexibility to missing data. We aimed to develop and benchmark a novel ML approach, the uncertainty-aware attention network (UAN), to overcome these common limitations. Two Bayesian uncertainty quantification methods were tested, generalized variational inference (GVI) or a posterior network (PN). The UAN models were compared with an ensemble of XGBoost models and a Bayesian logistic regression model (LR) with imputation. The derivation datasets consisted of 153,932 surgery events from the Australian and New Zealand Society of Cardiac and Thoracic Surgeons (ANZSCTS) Cardiac Surgery Database. An external validation consisted of 7343 surgery events which were extracted from the Medical Information Mart for Intensive Care (MIMIC) III critical care dataset. The highest performing model on the external validation dataset was a UAN-GVI with an area under the receiver operating characteristic curve (AUC) of 0.78 (0.01). Model performance improved on high confidence samples with an AUC of 0.81 (0.01). Confidence calibration for aleatoric uncertainty was excellent for all models. Calibration for epistemic uncertainty was more variable, with an ensemble of XGBoost models performing the best with an AUC of 0.84 (0.08). Epistemic uncertainty was improved using the PN approach, compared to GVI. UAN is able to use an interpretable and flexible deep learning approach to provide estimates of model uncertainty alongside state-of-the-art predictions. The model has been made freely available as an easy-to-use web application demonstrating that by designing uncertainty-aware models with innately explainable predictions deep learning may become more suitable for routine clinical use."
https://openalex.org/W4311446572,https://doi.org/10.2196/preprints.44763,Machine Learning Algorithms Predict Successful Weaning From Mechanical Ventilation Before Intubation: Retrospective Analysis From the Medical Information Mart for Intensive Care IV Database (Preprint),2022,2022-12-02,preprint,0,53.33862,"Jinchul Kim, Yun Kwan Kim, Hyeyeon Kim, et al.",NA,True,9,machine learning; prediction; classifier; algorithm; logistic regression; random forest; catboost; ensemble model; cross-validation,S,0,,"<sec> <title>BACKGROUND</title> The prediction of successful weaning from mechanical ventilation (MV) in advance of intubation can facilitate discussions regarding end-of-life care before unnecessary intubation. </sec> <sec> <title>OBJECTIVE</title> We aimed to develop a machine learning–based model that predicts successful weaning from ventilator support based on routine clinical and laboratory data taken before or immediately after intubation. </sec> <sec> <title>METHODS</title> We used the Medical Information Mart for Intensive Care IV database, which is an open-access database covering 524,740 admissions of 382,278 patients in Beth Israel Deaconess Medical Center, United States, from 2008 to 2019. We selected adult patients who underwent MV in the intensive care unit (ICU). Clinical and laboratory variables that are considered relevant to the prognosis of the patient in the ICU were selected. Data collected before or within 24 hours of intubation were used to develop machine learning models that predict the probability of successful weaning within 14 days of ventilator support. Developed models were integrated into an ensemble model. Performance metrics were calculated by 5-fold cross-validation for each model, and a permutation feature importance and Shapley additive explanations analysis was conducted to better understand the impacts of individual variables on outcome prediction. </sec> <sec> <title>RESULTS</title> Of the 23,242 patients, 19,025 (81.9%) patients were successfully weaned from MV within 14 days. Using the preselected 46 clinical and laboratory variables, the area under the receiver operating characteristic curve of CatBoost classifier, random forest classifier, and regularized logistic regression classifier models were 0.860 (95% CI 0.852-0.868), 0.855 (95% CI 0.848-0.863), and 0.823 (95% CI 0.813-0.832), respectively. Using the ensemble voting classifier using the 3 models above, the final model revealed the area under the receiver operating characteristic curve of 0.861 (95% CI 0.853-0.869), which was significantly better than that of Simplified Acute Physiology Score II (0.749, 95% CI 0.742-0.756) and Sequential Organ Failure Assessment (0.588, 95% CI 0.566-0.609). The top features included lactate and anion gap. The model’s performance achieved a plateau with approximately the top 21 variables. </sec> <sec> <title>CONCLUSIONS</title> We developed machine learning algorithms that can predict successful weaning from MV in advance to intubation in the ICU. Our models can aid the appropriate management for patients who hesitate to decide on ventilator support or meaningless end-of-life care. </sec>"
https://openalex.org/W4408380132,https://doi.org/10.1038/s41598-025-93516-1,Development and validation of machine learning models for predicting extubation failure in patients undergoing cardiac surgery: a retrospective study,2025,2025-03-12,article,5,50.389866,"Xiaofeng Jiang, Wenyong Peng, Jianbo Xu, et al.",Scientific Reports,True,9,machine learning; prediction model; prediction; predictive; algorithm; logistic regression; random forest; xgboost; auc,S,0,,"Patients with multiple comorbidities and those undergoing complex cardiac surgery may experience extubation failure and reintubation. The aim of this study was to establish an extubation prediction model using explainable machine learning and identify the most important predictors of extubation failure in patients undergoing cardiac surgery. Data from 776 adult patients who underwent cardiac surgery and were intubated for more than 24 h were obtained from the Medical Information Mart for Intensive Care (MIMIC)-IV database. The primary endpoint was extubation failure according to the WIND criteria, with 205 patients experiencing extubation failure. The data was split into a training set (80%) and a test set (20%). The performance of the XGBoost algorithm was the highest (AUC 0.793, Mean Precision 0.700, Brier Score0.150), which was better than that of logistic regression (AUC 0.766, Mean Precision 0.553, Brier Score0.173) and random forest (AUC 0.791, Mean Precision 0.510, Brier Score 0.181). The most crucial predictor of extubation failure is the mean value of the anion gap in the 24 h before extubation. The other main features include ventilator parameters and blood gas indicators. By applying machine learning to large datasets, we developed a new method for predicting extubation failure after cardiac surgery in critically ill patients. Based on the predictive factors analyzed, internal environmental indicators and ventilation characteristics were important predictors of extubation failure. Therefore, these predictive factors should be considered when determining extubation readiness."
https://openalex.org/W4401242336,https://doi.org/10.1177/20552076241264194,Prediction of patient flow in the emergency department using explainable artificial intelligence,2024,2024-01-01,article,7,49.800426,"Pedro A. Moreno-Sánchez, Matti Aalto, Mark van Gils",Digital Health,True,9,machine learning; artificial intelligence; prediction model; prediction; classifier; classification; model development; gradient boosting; xgboost,S,0,,"Introduction Overcrowding in emergency departments (ED) is a significant problem affecting patient outcomes, hospital length of stay, and staff job satisfaction. This issue often stems from unpredictable patient flow and suboptimal resource allocation. Objectives This study aims to develop two machine learning (ML) models to assist in early and accurate resource allocation in EDs. The first model predicts patient admission at the time of triage, while the second predicts the specialty of care needed indicated by the initial ward transfer. Methods The study leverages the Medical Information Mart for Intensive Care (MIMIC-IV) database with 425,000 ED visits including basic vital signs, medications, presentation information, diagnoses, and demographic information about the patients. Ensemble tree classifiers are employed for model development, and model's explainability is assessed by investigating feature importance. The best model is selected based on the balance between performance and explainability. Features’ importances are calculated and presented using SHapley Additive exPlanations and models’ intrinsic feature importance. Results The best-balanced admission prediction model in terms of classification performance and explainability achieved an accuracy of 0.775 and an area under the receiver operating curve (AUROC) of 0.779 by using eXtreme Gradient Boosting (XGBoost). The resource allocation prediction model, using a one-vs-rest approach, attained an AUROC of 0.783 again by using XGBoost. The models shared acuity and age in the three most important features, whereas admission ratio and gender were the additional features for admission prediction and resource prediction, respectively. Conclusion The study successfully demonstrates the potential of ML models in predicting patient admission and required specialty care at the ED triage stage. While the admission prediction model shows moderate performance compared to existing studies, the resource prediction model exhibits superior performance compared to related works. The research highlights the importance of explainability in ML models, suggesting the need for further practical implementation to refine and validate these models in real-world settings."
https://openalex.org/W4393035181,https://doi.org/10.1109/icacs60934.2024.10473298,Convolutional Neural Network Based Predictive Framework for Intensive Care Unit Readmission,2024,2024-02-19,article,2,41.525387,"Nadia Rasheed, Muhammad Usman Akram, Jahan Zeb",NA,True,9,machine learning; prediction; predictive; neural network; ann; convolutional neural network; cnn; auc; area under the curve,S,0,,"The cost of intensive care is huge, which necessitates careful thought regarding transfer of patients to lower-level ward care. Discharging a patient too early carries the risk of inadequate monitoring and care, often leading to readmission to the ICU. This risk can be mitigated by state-of-the-art machine learning methods. Limited research was carried out on readmission prediction tasks and the methods used were unable to attain good results. This study focuses on developing an ICURP (Intensive Care Unit Readmission Prediction) framework that can be used for the effective prediction of unplanned ICU readmission within 30 days. Particularly, the framework deals with the missing values (via the last observation carried forward technique) and data imbalance (via the Over-sampling Technique). Our approach incorporates temporal features from chart events data with low-dimensional embeddings of medical concepts such as diseases coded using the ICD-9 code. Convolutional neural network (CNN) is used to fit three alternative CNN models using the last 24-hour, 48-hour and 72-hour ICU stay data. Models are trained and validated using the Medical Information Mart for Intensive Care (MIMIC-III) dataset. To evaluate the effectiveness of our proposed methods, we conducted testing on the unseen data of the MIMIC-III dataset. The model trained using the last 48-hour ICU data has outperformed other models and reached an area under the curve of receiver operating characteristic (AUC-ROC) of 0.88. The results suggested that our ICURP framework has the potential to surpass the existing standard of ICU discharge by accurately predicting readmissions up to 30 days of discharge time using a reduced features set."
https://openalex.org/W4390659385,https://doi.org/10.21203/rs.3.rs-3834698/v1,Machine learning for in-hospital mortality prediction in critically ill patients with acute heart failure: A retrospective analysis based on MIMIC -Ⅳ databases,2024,2024-01-08,preprint,2,39.598854,"Jun Li, Yiwu Sun, Jie Ren, et al.",Research Square,True,9,machine learning; prediction; predictive; regression model; algorithm; lasso; xgboost; auc; area under the curve,S,0,,"<title>Abstract</title> Background The incidence rate, mortality rate and readmission rate of acute heart failure (AHF) are high, and the in-hospital mortality of AHF patients in ICU is higher. However, there is no method to accurately predict the mortality of AHF patients at present. Methods The Medical Information Mart for Intensive Care Ⅳ (MIMIC-Ⅳ) database was used to perform a retrospective study. Patients meeting the inclusion criteria were identified from the MIMIC-Ⅳ database and randomly divided into training set (n = 3580, 70%) and validation set (n = 1534, 30%). The variates we collected include demographic data, vital signs, comorbidities, laboratory test results and treatment information within 24 hours of ICU admission. By using the Least Absolute Shrinkage and Selection Operator (LASSO) regression model in the training set, we screened variates that affect the in-hospital mortality of AHF patients. Subsequently, in the training set, five common machine learning (ML) algorithms were applied to construct models using variates selected by LASSO to predict the in-hospital mortality of AHF patients. We evaluated the predictive ability of the models by sensitivity, specificity, accuracy, the area under the curve (AUC) of receiver operating characteristics (ROC), and clinical net benefit in the validation set. In order to obtain a model with the best predictive ability, we compared the predictive ability of common scoring systems with the best ML model. Results Among the 5114 patients, in-hospital mortality was 12.5%. By comparing AUC, the XGBoost model had the best predictive ability among all ML models, and the XGBoost model was chosen as our final model for its higher net benefit. Meanwhile, its predictive ability is superior to common scoring systems. Conclusions The XGBoost model can effectively predict the in-hospital mortality of AHF patients admitted to the ICU, which may assist clinicians in precise management and early intervention of patients with AHF to reduce mortality."
