openalex_id,doi,title,year,publication_date,type,cited_by_count,relevance_score,authors,source,dataset_mentioned,ml_match_count,matched_ml_terms,regime_selected,regime_match_count,matched_regime_terms,abstract
https://openalex.org/W3152710073,https://doi.org/10.1109/ibcast51254.2021.9393012,Mortality Prediction in ICU Patients Using Machine Learning Models,2021,2021-01-12,article,7,70.270134,"Fawad Ahmad, Huma Ayub, Rehan Liaqat, et al.",2021 International Bhurban Conference on Applied Sciences and Technologies (IBCAST),True,7,machine learning; prediction model; prediction; regression model; logistic regression; support vector machine; svm,S,0,,Effective utilization of limited intensive care unit (ICU) allocations is a challenging task for medical experts to save precious human lives. The prolonged ICU stay of relatively secure patients and patients with low chances of recovery can cause life-threatening effects on patients waiting for ICU accommodation. Machine learning-based techniques for early prediction of mortality can help in this regard. This paper presents two mortality prediction models using the support vector machine (SVM) and linear discriminant analysis. The proposed models use clinical data of the ICU patients for early prediction of mortality. Distribution filtering is performed using the chi-square distribution during pre-processing. A subset of the publicly available Medical Information Mart for Intensive Care (MIMIC-III v1.4) dataset is used for the evaluation of the proposed models. The problem of class imbalance is handled by synthetic minority oversampling technique. The comparison of obtained results is performed with existing SVM and multiple logistic regression models to show the effectiveness of the proposed models. The results of the study can be helpful for clinical experts for better decision making regarding the utilization of ICU allocations.
https://openalex.org/W4404544294,https://doi.org/10.1007/s00521-024-10468-9,Multitask multilayer-prediction model for predicting mechanical ventilation and the associated mortality rate,2024,2024-11-20,article,44,64.15276,"Nora El-Rashidy, Zahraa Tarek, Ahmed M. Elshewey, et al.",Neural Computing and Applications,True,7,prediction model; prediction; classification; neural network; neural networks; lstm; auc,S,0,,"Abstract Mechanical ventilation (MV) is a crucial intervention in the intensive care unit (ICU) for severely ill patients. However, it can potentially contribute to lung damage due to the opening and closing of small airways and alveoli. This study aims to enhance the accuracy of mechanical ventilation prediction using a comprehensive dataset from the Medical Information Mart for Intensive Care (MIMIC-III). The data were extracted with three time frames, 6, 12, and 24 h. Then, 6 h left as a time gap and the ventilation as well as the mortality during the next 48 h. The proposed model consists of two layers: Layer 1 predicts ventilation and mortality in the ICU, while Layer 2 predicts the duration of ventilation. Classification techniques are applied to identify patients in need of ventilators, employing multilayer multitask long short-term memory (LSTM) models. Regression tasks use neural networks (multilayer perception). The optimum feature subset was obtained using particle swarm optimization (PSO). Additionally, this study examines the correlation between ventilation and mortality among patients with and without acute respiratory distress syndrome (ARDS). The findings of this research can enhance health-care outcomes and inform policymakers about resource allocation in overwhelmed health services. The best results were obtained when utilizing the first 24 h for prediction. The proposed MTL model achieved promising performance of 0.944, 0.923, 0.951, and 0.921 for the first task and 0.971, 0.961, 0.963, and 0.970 for the second task for accuracy, precision, recall, score, and AUC, respectively."
https://openalex.org/W4386878253,https://doi.org/10.1002/jor.25675,Machine learning‐based mortality prediction in hip fracture patients using biomarkers,2023,2023-09-20,article,8,61.805576,"George Asrian, Abhinav Suri, Chamith S. Rajapakse",Journal of Orthopaedic Research®,True,7,machine learning; prediction model; prediction; classification; gbm; lightgbm; auc,S,0,,"The purpose of this retrospective study was to assess whether mortality following a hip fracture can be predicted by a machine learning model trained on basic blood and lab test data as well as basic demographic data. Additionally, the purpose was to identify the key variables most associated with 1-, 5-, and 10-year mortality and investigate their clinical significance. Input data included 3751 hip fracture patient records sourced from the Medical Information Mart for Intensive Care IV database, which provided records from in-hospital database systems at the Beth Israel Deaconess Medical Center. The 1-year mortality rate for all patients studied was 21% and for those aged 80+ was 29%. We assessed 10 different machine learning classification models, finding LightGBM to have the strongest 1-year mortality prediction performance, with accuracy of 81%, AUC of 0.79, sensitivity of 0.34, and specificity of 0.98 on the test set. The strongest-weighted features of the 1-year model included age, glucose, red blood cell distribution width, mean corpuscular hemoglobin concentration, white blood cells, urea nitrogen, prothrombin time, platelet count, calcium levels, and partial thromboplastin time. Most of these were also in the top 10 features of the LightGBM 5- and 10-year prediction models trained. Testing for these high-ranking biomarkers in new hip fracture patients can aid clinicians in assessing the likelihood of poor outcomes for hip fracture patients, and additional research can use these biomarkers to develop a mortality risk score."
https://openalex.org/W4393999098,https://doi.org/10.1097/md.0000000000037634,Improving predictions: Enhancing in-hospital mortality forecast for ICU patients with sepsis-induced coagulopathy using a stacking ensemble model,2024,2024-04-05,article,4,60.180496,"X. Liu, Hao Niu, Jiahua Peng",Medicine,True,7,machine learning; prediction; predictive; ensemble model; stacking; auc; area under the curve,S,0,,"The incidence of sepsis-induced coagulopathy (SIC) is high, leading to increased mortality rates and prolonged hospitalization and intensive care unit (ICU) stays. Early identification of SIC patients at risk of in-hospital mortality can improve patient prognosis. The objective of this study is to develop and validate machine learning (ML) models to dynamically predict in-hospital mortality risk in SIC patients. A ML model is established based on the Medical Information Mart for Intensive Care IV (MIMIC-IV) database to predict in-hospital mortality in SIC patients. Utilizing univariate feature selection for feature screening. The optimal model was determined by calculating the area under the curve (AUC) with a 95% confidence interval (CI). The optimal model was interpreted using Shapley Additive Explanation (SHAP) values. Among the 3112 SIC patients included in MIMIC-IV, a total of 757 (25%) patients experienced mortality during their ICU stay. Univariate feature selection helps us to pick out the 20 most critical variables from the original feature. Among the 10 developed machine learning models, the stacking ensemble model exhibited the highest AUC (0.795, 95% CI: 0.763-0.827). Anion gap and age emerged as the most significant features for predicting the mortality risk in SIC. In this study, an ML model was constructed that exhibited excellent performance in predicting in-hospital mortality risk in SIC patients. Specifically, the stacking ensemble model demonstrated superior predictive ability."
https://openalex.org/W3213578600,https://doi.org/10.1109/gcat52182.2021.9587778,Early Sepsis Detection using Machine Learning and Neural Networks,2021,2021-10-01,article,5,57.01871,"Nemil Shah, Jay Bhatia, Nimit Vasavat, et al.",2021 2nd Global Conference for Advancement in Technology (GCAT),True,7,machine learning; deep learning; xgboost; neural network; neural networks; deep neural network; auc,S,0,,"Sepsis can cause overwhelming changes that impair multiple organs, leading to their failure and sometimes even having fatal results. Low blood pressure, difficulty in breathing, fever, mental confusion, and fast heart rate are some of the symptoms. Infections acquired in health care settings also frequently result in Sepsis. These infections affect hundreds of millions of patients globally every year and are one of the most recurrent adverse events during care delivery. Clinical conditions can rapidly deteriorate as healthcare-associated disorders are often impervious to antibiotics. During critical scenarios such as an intensive care unit, Early diagnosis and timely medical treatment of sepsis is crucial to give the patient prompt treatment since there is an increase in the mortality rate as each hour passes away in critical care. This paper proposes a method to predict the inception of sepsis 6 hours in advance using various machine learning and deep learning models and presents a comparative study of the same. The Medical Information Mart for Intensive Care III (MIMIC3) dataset was used to test the traditional machine learning methods such as RandomForest(RF), XGBoost, and also Deep Learning techniques such as neural networks and Autoencoders with XGBoost. The dataset contains an extensive range of parameters that are associated with laboratory, vitals, and demographics of patients which help them classify as sepsis and non-sepsis patients. A data pipeline was successfully created to clean the data, impute missing values and perform various feature engineering techniques. Our best performing model is a Deep Neural Network with an AUC ROC score of 0.888."
https://openalex.org/W3151552516,https://doi.org/10.1007/978-3-030-86514-6_23,Multitask Recalibrated Aggregation Network for Medical Code Prediction,2021,2021-01-01,book-chapter,12,47.22156,"Wei Sun, Shaoxiong Ji, Erik Cambria, et al.",Lecture notes in computer science,True,7,machine learning; prediction; predictive; algorithm; neural network; neural networks; deep neural network,S,0,,"Abstract Medical coding translates professionally written medical reports into standardized codes, which is an essential part of medical information systems and health insurance reimbursement. Manual coding by trained human coders is time-consuming and error-prone. Thus, automated coding algorithms have been developed, building especially on the recent advances in machine learning and deep neural networks. To solve the challenges of encoding lengthy and noisy clinical documents and capturing code associations, we propose a multitask recalibrated aggregation network. In particular, multitask learning shares information across different coding schemes and captures the dependencies between different medical codes. Feature recalibration and aggregation in shared modules enhance representation learning for lengthy notes. Experiments with a real-world MIMIC-III dataset show significantly improved predictive performance."
https://openalex.org/W4397000584,https://doi.org/10.1109/scc59637.2023.10527491,"Machine Learning-Based Pre-Diagnosis Tools in Emergency Departments: Predicting Hospitalization, Mortality and Triage Acuity",2023,2023-12-01,article,3,46.62145,"Yacine Yaddaden, Yacine Benahmed, Marc-Denis Rioux, et al.",NA,True,7,machine learning; artificial intelligence; prediction; classifier; logistic regression; decision tree; random forest,S,0,,"With demographic growth, aging populations, and the recent advent of the Covid-19 pandemic, emergency department staff are increasingly overwhelmed, leading to a decline in the quality of patient care and an alarming rise in hospital mortality rates. Thus, there is a growing need for accurate and reliable pre-diagnostic tools to optimize patient flow and improve the quality of care. While many artificial intelligence-based tools have been tested for pre-diagnosis in emergency services, they are still not effective enough. Moreover, exploring the use of additional indicators to enhance preliminary diagnosis should also be considered. This paper aims to predict the Emergency Severity Index-a standard reference for triaging patients-along with other indicators that clinicians can use to refine preliminary diagnoses, particularly regarding patient hospitalization and mortality. To achieve this, we utilized the MIMIC-IV (Medical Information Mart for Intensive Care) and MIMIC-IV ED (Emergency Department) datasets, applying several machine learning techniques. We propose a new pipeline for these prediction tasks, employing Polynomial Features for feature extraction and Principal Component Analysis for dimensionality reduction. Our proposed methods achieved high accuracy rates, with hospitalization prediction reaching 97.00%, mortality pre-diction at 86.41 %, and triage acuity prediction scoring of 99.80% using Logistic Regression, Random Forest, and Decision Tree classifiers."
https://openalex.org/W4403937425,https://doi.org/10.1109/iscc61673.2024.10733722,Bi-directional Estimation of Infant Heart and Respiration Rates Using Machine Learning Algorithms,2024,2024-06-26,article,1,38.667664,"Bithi Banik, Constanza Zurita Valdebenito, Alauddin Bhuiyan, et al.",NA,True,7,machine learning; algorithm; gradient boosting; gradient boosting machine; neural network; multilayer perceptron; convolutional neural network,S,0,,"Heart rate and respiratory rate are critical vital signs in infants, used as non-invasive indicators to assess health status and address potential issues. However, many healthcare settings face a limitation: the inability to measure these parameters simultaneously, as most non-invasive medical-grade instruments track either heart rate or respiratory rate, not both. Addressing this gap, the study investigates the use of machine learning techniques for the bi-directional estimation of infant heart and respiratory rates. It evaluates the performance of several machine learning models, including Convolutional Neural Network, Multilayer Perceptron, Gated Recurrent Units, Long Short-Term Memory, and the gradient boosting models Extreme Gradient Boosting and Light Gradient Boosting Machine, in predicting these vital signs using the Medical Information Mart for Intensive Care II dataset. Numerical results show that the gradient boosting models Extreme Gradient Boosting and Light Gradient Boosting Machine outperformed the neural network-based approaches in accuracy."
https://openalex.org/W4220943678,https://doi.org/10.1101/2022.03.05.22271961,Mining for Health: A Comparison of Word Embedding Methods for Analysis of EHRs Data,2022,2022-03-08,preprint,9,71.83641,"Emily Getzen, Yucheng Ruan, Lyle Ungar, et al.",medRxiv,True,6,machine learning; predictive modeling; prediction model; prediction; predictive; algorithm,S,4,structured data; structured; electronic health record; ehr,"Abstract Electronic health records (EHRs), routinely collected as part of healthcare delivery, offer great promise for advancing precision health. At the same time, they present significant analytical challenges. In EHRs, data for individual patients are collected at irregular time intervals and with varying frequencies; they include both structured and unstructured data. Advanced statistical and machine learning methods have been developed to tackle these challenges, for example, for predicting diagnoses earlier and more accurately. One powerful tool for extracting useful information from EHRs data is word embedding algorithms, which represent words as vectors of real numbers that capture the words’ semantic and syntactic similarities. Learning embeddings can be viewed as automated feature engineering, producing features that can be used for predictive modeling of medical events. Methods such as Word2Vec, BERT, FastText, ELMo, and GloVe have been developed for word embedding, but there has been little work on re-purposing these algorithms for the analysis of structured medical data. Our work seeks to fill this important gap. We extended word embedding methods to embed (structured) medical codes from a patient’s entire medical history, and used the resultant embeddings to build prediction models for diseases. We assessed the performance of multiple embedding methods in terms of predictive accuracy and computation time using the Medical Information Mart for Intensive Care (MIMIC) database. We found that using Word2Vec, Fast-Text, and GloVe algorithms yield comparable models, while more recent contextual embeddings provide marginal further improvement. Our results provide insights and guidance to practitioners regarding the use of word embedding methods for the analysis of EHR data."
https://openalex.org/W4404304670,https://doi.org/10.48550/arxiv.2410.17363,DeLLiriuM: A large language model for delirium prediction in the ICU using structured EHR,2024,2024-10-22,preprint,2,41.917007,"Miguel Á. Contreras, Sumit Kapoor, Jiaqing Zhang, et al.",arXiv (Cornell University),True,6,artificial intelligence; deep learning; prediction model; prediction; predictive; ann,S,4,structured; cohort; electronic health record; ehr,"Delirium is an acute confusional state that has been shown to affect up to 31% of patients in the intensive care unit (ICU). Early detection of this condition could lead to more timely interventions and improved health outcomes. While artificial intelligence (AI) models have shown great potential for ICU delirium prediction using structured electronic health records (EHR), most of them have not explored the use of state-of-the-art AI models, have been limited to single hospitals, or have been developed and validated on small cohorts. The use of large language models (LLM), models with hundreds of millions to billions of parameters, with structured EHR data could potentially lead to improved predictive performance. In this study, we propose DeLLiriuM, a novel LLM-based delirium prediction model using EHR data available in the first 24 hours of ICU admission to predict the probability of a patient developing delirium during the rest of their ICU admission. We develop and validate DeLLiriuM on ICU admissions from 104,303 patients pertaining to 195 hospitals across three large databases: the eICU Collaborative Research Database, the Medical Information Mart for Intensive Care (MIMIC)-IV, and the University of Florida Health's Integrated Data Repository. The performance measured by the area under the receiver operating characteristic curve (AUROC) showed that DeLLiriuM outperformed all baselines in two external validation sets, with 0.77 (95% confidence interval 0.76-0.78) and 0.84 (95% confidence interval 0.83-0.85) across 77,543 patients spanning 194 hospitals. To the best of our knowledge, DeLLiriuM is the first LLM-based delirium prediction tool for the ICU based on structured EHR data, outperforming deep learning baselines which employ structured features and can provide helpful information to clinicians for timely interventions."
https://openalex.org/W4281559688,https://doi.org/10.1093/jamiaopen/ooac042,A machine learning approach to identifying delirium from electronic health records,2022,2022-04-06,article,8,80.0694,"Jae Hyun Kim, May Hua, Robert A. Whittington, et al.",JAMIA Open,True,6,machine learning; predictive; classification; regression model; logistic regression; auc,S,3,cohort; electronic health record; ehr,"The identification of delirium in electronic health records (EHRs) remains difficult due to inadequate assessment or under-documentation. The purpose of this research is to present a classification model that identifies delirium using retrospective EHR data. Delirium was confirmed with the Confusion Assessment Method for the Intensive Care Unit. Age, sex, Elixhauser comorbidity index, drug exposures, and diagnoses were used as features. The model was developed based on the Columbia University Irving Medical Center EHR data and further validated with the Medical Information Mart for Intensive Care III dataset. Seventy-six patients from Surgical/Cardiothoracic ICU were included in the model. The logistic regression model achieved the best performance in identifying delirium; mean AUC of 0.874 ± 0.033. The mean positive predictive value of the logistic regression model was 0.80. The model promises to identify delirium cases with EHR data, thereby enable a sustainable infrastructure to build a retrospective cohort of delirium."
https://openalex.org/W3184870479,https://doi.org/10.1016/j.jbi.2021.103876,Interpretability of time-series deep learning models: A study in cardiovascular patients admitted to Intensive care unit,2021,2021-07-27,article,56,60.00856,"Ilaria Gandin, Arjuna Scagnetto, Simona Romani, et al.",Journal of Biomedical Informatics,True,6,deep learning; algorithm; neural network; recurrent neural network; lstm; auc,S,3,cohort; electronic health record; ehr,"Interpretability is fundamental in healthcare problems and the lack of it in deep learning models is currently the major barrier in the usage of such powerful algorithms in the field. The study describes the implementation of an attention layer for Long Short-Term Memory (LSTM) neural network that provides a useful picture on the influence of the several input variables included in the model. A cohort of 10,616 patients with cardiovascular diseases is selected from the MIMIC III dataset, an openly available database of electronic health records (EHRs) including all patients admitted to an ICU at Boston's Medical Centre. For each patient, we consider a 10-length sequence of 1-hour windows in which 48 clinical parameters are extracted to predict the occurrence of death in the next 7 days. Inspired from the recent developments in the field of attention mechanisms for sequential data, we implement a recurrent neural network with LSTM cells incorporating an attention mechanism to identify features driving model's decisions over time. The performance of the LSTM model, measured in terms of AUC, is 0.790 (SD = 0.015). Regard our primary objective, i.e. model interpretability, we investigate the role of attention weights. We find good correspondence with driving predictors of a transparent model (r = 0.611, 95% CI [0.395, 0.763]). Moreover, most influential features identified at the cohort-level emerge as known risk factors in the clinical context. Despite the limitations of study dataset, this work brings further evidence of the potential of attention mechanisms in making deep learning model more interpretable and suggests the application of this strategy for the sequential analysis of EHRs."
https://openalex.org/W4412813304,https://doi.org/10.1038/s41598-025-13299-3,Explainable machine learning for predicting ICU mortality in myocardial infarction patients using pseudo-dynamic data,2025,2025-07-31,article,7,50.83465,"Munib Mesinovic, Peter Watkinson, Tingting Zhu",Scientific Reports,True,6,machine learning; deep learning; prediction; predictive; algorithm; xgboost,S,3,tabular; cohort; ehr,"Myocardial infarction (MI) remains one of the greatest contributors to mortality, and patients admitted to the intensive care unit (ICU) with myocardial infarction are at higher risk of death. In this study, we use two retrospective cohorts extracted from two US-based ICU databases, eICU and MIMIC-IV, to develop an explainable pseudo-dynamic machine learning framework for mortality prediction in the ICU. The method provides accurate prediction for ICU patients up to 24 hours before the event and provides time-resolved interpretability. We compare standard supervised machine learning algorithms with novel tabular deep learning approaches and find that an integrated XGBoost model in our EHR time-series extraction framework (XMI-ICU) performs best. The framework was evaluated on a held-out test set from eICU and externally validated on the MIMIC-IV cohort using the most important features identified by time-resolved Shapley values. XMI-ICU achieved AUROCs of 92.0 (balanced accuracy of 82.3) for a 6-hour prediction of mortality. We demonstrate that XMI-ICU maintains reliable predictive performance across different prediction horizons (6, 12, 18, and 24 hours) during ICU stay while also achieving successful external validation in a separate patient cohort from MIMIC-IV without any previous training on that dataset. We also evaluated the framework for clinical risk analysis by comparing it to the standard APACHE IV system in active use. We show that our framework successfully leverages time-series physiological measurements from ICU health records by translating them into stacked static prediction problems for mortality in heart attack patients and can offer clinical insight from time-resolved interpretability through the use of Shapley values."
