openalex_id,doi,title,year,publication_date,type,cited_by_count,relevance_score,authors,source,dataset_mentioned,ml_match_count,matched_ml_terms,regime_selected,regime_match_count,matched_regime_terms,abstract
https://openalex.org/W3092310125,https://doi.org/10.1109/access.2020.3029429,Extreme Multi-Label ICD Classification: Sensitivity to Hospital Service and Time,2020,2020-01-01,article,16,58.622864,"Alberto Blanco, Alicia Pérez, Arantza Casillas",IEEE Access,True,5,machine learning; classification; neural network; recurrent neural network; rnn,S,2,electronic health record; ehr,"This work deals with clinical text mining for automatic classification of Electronic Health Records (EHRs) with respect to the International Classification of Diseases (ICD). ICD is the international standard for the identification of diseases and health conditions in EHRs and the foundation for reporting health statistics. Machine learning-based techniques have proven robust to infer classification models from EHRs. Since each EHR tends to involve multiple diseases, multi-label classification is required. The concern in this work is the versatility of the models inferred and their ability to generalise in two ways: as time goes ahead and across hospital services or health specialties. Indeed, in this work, we show the capabilities of a Bidirectional Recurrent Neural Network (RNN) with GRU units and ELMo embeddings on two corpora (a corpus comprising a set of EHRs within the Basque Health System, namely Osakidetza, and the well-known MIMIC-III corpus). To delve into and assess the versatility of the models, we focus on their resilience across hospital admissions taken over two different years and also across six distinct hospital services. In addition, we paid attention to the classification performance to estimate ICD codes of different granularity (e.g. with or without essential modifiers). Our best results are 39.55% and 47.28% F-Score for the Osakidetza and MIMIC-III datasets respectively, with the original main label-sets. Regarding the models evaluated per specialty, the most remarkable results are 57.00% and 72.74% F-Score, in the Cardiology and Nephrology medical services respectively."
https://openalex.org/W4397023118,https://doi.org/10.1038/s41746-024-01120-w,StrokeClassifier: ischemic stroke etiology classification by ensemble consensus modeling using electronic health records,2024,2024-05-17,article,18,57.805153,"Ho‐Joon Lee, Lee H. Schwamm, Lauren Sansing, et al.",npj Digital Medicine,True,5,machine learning; artificial intelligence; prediction; classifier; classification,S,2,electronic health record; ehr,"Determining acute ischemic stroke (AIS) etiology is fundamental to secondary stroke prevention efforts but can be diagnostically challenging. We trained and validated an automated classification tool, StrokeClassifier, using electronic health record (EHR) text from 2039 non-cryptogenic AIS patients at 2 academic hospitals to predict the 4-level outcome of stroke etiology adjudicated by agreement of at least 2 board-certified vascular neurologists' review of the EHR. StrokeClassifier is an ensemble consensus meta-model of 9 machine learning classifiers applied to features extracted from discharge summary texts by natural language processing. StrokeClassifier was externally validated in 406 discharge summaries from the MIMIC-III dataset reviewed by a vascular neurologist to ascertain stroke etiology. Compared with vascular neurologists' diagnoses, StrokeClassifier achieved the mean cross-validated accuracy of 0.74 and weighted F1 of 0.74 for multi-class classification. In MIMIC-III, its accuracy and weighted F1 were 0.70 and 0.71, respectively. In binary classification, the two metrics ranged from 0.77 to 0.96. The top 5 features contributing to stroke etiology prediction were atrial fibrillation, age, middle cerebral artery occlusion, internal carotid artery occlusion, and frontal stroke location. We designed a certainty heuristic to grade the confidence of StrokeClassifier's diagnosis as non-cryptogenic by the degree of consensus among the 9 classifiers and applied it to 788 cryptogenic patients, reducing cryptogenic diagnoses from 25.2% to 7.2%. StrokeClassifier is a validated artificial intelligence tool that rivals the performance of vascular neurologists in classifying ischemic stroke etiology. With further training, StrokeClassifier may have downstream applications including its use as a clinical decision support system."
https://openalex.org/W4404254218,https://doi.org/10.1038/s41467-024-54071-x,Shareable artificial intelligence to extract cancer outcomes from electronic health records for precision oncology research,2024,2024-11-12,article,19,53.11419,"Kenneth L. Kehl, Justin Jee, Karl Pichotta, et al.",Nature Communications,True,5,machine learning; artificial intelligence; predictive; classification; ann,S,2,electronic health record; ehr,"Databases that link molecular data to clinical outcomes can inform precision cancer research into novel prognostic and predictive biomarkers. However, outside of clinical trials, cancer outcomes are typically recorded only in text form within electronic health records (EHRs). Artificial intelligence (AI) models have been trained to extract outcomes from individual EHRs. However, patient privacy restrictions have historically precluded dissemination of these models beyond the centers at which they were trained. In this study, the vulnerability of text classification models trained directly on protected health information to membership inference attacks is confirmed. A teacher-student distillation approach is applied to develop shareable models for annotating outcomes from imaging reports and medical oncologist notes. 'Teacher' models trained on EHR data from Dana-Farber Cancer Institute (DFCI) are used to label imaging reports and discharge summaries from the Medical Information Mart for Intensive Care (MIMIC)-IV dataset. 'Student' models are trained to use these MIMIC documents to predict the labels assigned by teacher models and sent to Memorial Sloan Kettering (MSK) for evaluation. The student models exhibit high discrimination across outcomes in both the DFCI and MSK test sets. Leveraging private labeling of public datasets to distill publishable clinical AI models from academic centers could facilitate deployment of machine learning to accelerate precision oncology research."
https://openalex.org/W4210277770,https://doi.org/10.1109/access.2022.3148279,Comparison of Neural Language Modeling Pipelines for Outcome Prediction From Unstructured Medical Text Notes,2022,2022-01-01,article,25,50.99124,"Chérubin Mugisha, Incheon Paik",IEEE Access,True,5,machine learning; prediction; predictive; algorithm; transformer,S,2,structured; electronic health record,"Machine learning techniques and algorithm-based approaches are becoming more and more vital to support clinical decision-making. In the medical area, natural language processing (NLP) techniques have shown the ability to extract useful information from electronic health records. On the one hand, statistic, semantic, and contextualized word embedding-based models and on the other hand preprocessing approaches are the keys to a better representation of a document. Using narratives from the Intensive Care Unit, we elaborated a comparison of the most used methods and preprocessing approaches to tackle an outcome prediction problem and guide researchers into NLP pipelines in the medical area. We used real data from Medical Information Mart for Intensive Care-III (MIMIC-III). We selected all notes related to patients with pneumonia. We conducted a deep analysis on text preprocessing tasks producing three datasets: raw data with minor preprocessing, meticulous preprocessing, and extreme preprocessing filtering only medical-related terminologies using Named Entity Recognition algorithms. We then used these three sets in five models, of which two are based on the traditional noncontextual word embedding techniques and three use contextualized word embedding based on a transformer. We demonstrated that transformer-based models outperform other word embedding models and a profound preprocessing yielded an accuracy of 98.2 F1-score. These results show the highly competitive ability of NLP predictive models against other models that use medical data. With an appropriate NLP pipeline, the information contained in medical narratives can be used to draw up a patient profile, and admission notes can help to ascertain a mortality risk of a patient admitted to the Intensive Care Unit."
https://openalex.org/W2998493587,https://doi.org/10.48550/arxiv.1912.12397,Natural language processing of MIMIC-III clinical notes for identifying diagnosis and procedures with neural networks,2019,2019-12-28,preprint,27,416.74835,"Siddhartha Nuthakki, Sunil Neela, Judy Wawira Gichoya, et al.",arXiv (Cornell University),True,5,machine learning; deep learning; prediction; neural network; neural networks,S,1,structured,"Coding diagnosis and procedures in medical records is a crucial process in the healthcare industry, which includes the creation of accurate billings, receiving reimbursements from payers, and creating standardized patient care records. In the United States, Billing and Insurance related activities cost around $471 billion in 2012 which constitutes about 25% of all the U.S hospital spending. In this paper, we report the performance of a natural language processing model that can map clinical notes to medical codes, and predict final diagnosis from unstructured entries of history of present illness, symptoms at the time of admission, etc. Previous studies have demonstrated that deep learning models perform better at such mapping when compared to conventional machine learning models. Therefore, we employed state-of-the-art deep learning method, ULMFiT on the largest emergency department clinical notes dataset MIMIC III which has 1.2M clinical notes to select for the top-10 and top-50 diagnosis and procedure codes. Our models were able to predict the top-10 diagnoses and procedures with 80.3% and 80.5% accuracy, whereas the top-50 ICD-9 codes of diagnosis and procedures are predicted with 70.7% and 63.9% accuracy. Prediction of diagnosis and procedures from unstructured clinical notes benefit human coders to save time, eliminate errors and minimize costs. With promising scores from our present model, the next step would be to deploy this on a small-scale real-world scenario and compare it with human coders as the gold standard. We believe that further research of this approach can create highly accurate predictions that can ease the workflow in a clinical setting."
https://openalex.org/W2979862508,https://doi.org/10.1109/embc.2019.8856442,UMLS mapping and Word embeddings for ICD code assignment using the MIMIC-III intensive care database,2019,2019-07-01,article,18,350.99527,"Henning Schäfer, Christoph M. Friedrich",NA,True,5,classification; support vector machine; support vector machines; svm; cross-validation,S,1,electronic health record,"Diagnosis codes are used as a billing mechanism in the Electronic Health Record and have the capability to benefit decision support systems, which aim to assist coders by suggesting a relevant subset of potential codes to choose from. Due to the large set of possible labels and length of patient records, automatic ICD code assignment is considered to be a challenging task within the field of multi-label classification. This paper introduces a baseline for automatic ICD code assignment using Support Vector Machines (SVM) and FastText with Unified Medical Language System (UMLS) metathesaurus mappings into word embedding models. Training data is obtained from the Medical Information Mart for Intensive Care (MIMIC-III) database and extended with 'is-a' relationships from ICD-9 hierarchy. FastText is evaluated with different label count estimations, of which an approach based on label cardinality yields a F1-Score of 62.2%. FastText achieves high recall results and mentionable performance improvements over previous models. Reported values are obtained through 10-fold cross-validation."
https://openalex.org/W4206505399,https://doi.org/10.1177/10760296211073925,Risk Factors for Pulmonary Embolism in ICU Patients: A Retrospective Cohort Study from the MIMIC-III Database,2022,2022-01-01,article,16,325.39673,"Chengbin Huang, Chenxuan Hong, Tianhao Xu, et al.",Clinical and Applied Thrombosis/Hemostasis,True,5,predictive; logistic regression; auc; roc curve; area under the curve,S,1,cohort,"Pulmonary embolism (PE) is a common and potentially lethal form of venous thromboembolic disease in ICU patients. A limited number of risk factors have been associated with PE in ICU patients. In this study, we aimed to screen the independent risk factors of PE in ICU patients that can be used to evaluate the patient's condition and provide targeted treatment. We performed a retrospective cohort study using a freely accessible critical care database Medical Information Mart for Intensive Care (MIMIC)-III. The ICU patients were divided into two groups based on the incidence of PE. Finally, 9871 ICU patients were included, among which 204 patients (2.1%) had pulmonary embolism. During the multivariate logistic regression analysis, sepsis, hospital_LOS (the length of stay in hospital), type of admission, tumor, APTT (activated partial thromboplastin time) and platelet were independent risk factors for patients for PE in ICU, with OR values of 1.471 (95%CI 1.001-2.162), 1.001 (95%CI 1.001-1.001), 3.745 (95%CI 2.187-6.414), 1.709 (95%CI 1.247-2.341), 1.014 (95%CI 1.010-1.017) and 1.002 (95%CI 1.001-1.003) (<i>P</i><sub>s</sub> < 0.05). ROC curve analysis showed that the composite indicator had a higher predictive value for ICU patients with PE, with a ROC area under the curve (AUC) of 0.743 (95%CI 0.710 -0.776, <i>p</i> < 0.001). Finally, sepsis, tumor, platelet count, length of stay in the hospital, emergency admission and APTT were independent predictors of PE in ICU patients."
https://openalex.org/W4307187690,https://doi.org/10.1097/md.0000000000031251,Predicting in-hospital mortality for MIMIC-III patients: A nomogram combined with SOFA score,2022,2022-10-21,article,2,179.5841,"Ran Liu, Haiwang Liu, Ling Li, et al.",Medicine,True,5,prediction; logistic regression; lasso; auc; area under the curve,S,1,multivariable,"Predicting the mortality of patients provides a reference for doctors to judge their physical condition. This study aimed to construct a nomogram to improve the prediction accuracy of patients' mortality. Patients with severe diseases were screened from the Medical Information Mart for Intensive Care (MIMIC) III database; 70% of patients were randomly selected as the training set for the model establishment, while 30% were used as the test set. The least absolute shrinkage and selection operator (LASSO) regression method was used to filter variables and select predictors. A multivariable logistic regression fit was used to determine the association between in-hospital mortality and risk factors and to construct a nomogram. A total of 9276 patients were included. The area under the curve (AUC) for the clinical nomogram based on risk factors selected by LASSO and multivariable logistic regressions were 0.849 (95% confidence interval [CI]: 0.835-0.863) and 0.821 (95% CI: 0.795-0.846) in the training and test sets, respectively. Therefore, this nomogram might help predict the in-hospital mortality of patients admitted to the intensive care unit (ICU)."
https://openalex.org/W4300537458,https://doi.org/10.48550/arxiv.1912.12397,Natural language processing of MIMIC-III clinical notes for identifying\n diagnosis and procedures with neural networks,2019,2019-12-27,preprint,3,179.15987,"Siddhartha Nuthakki, Sunil Neela, Judy Wawira Gichoya, et al.",arXiv (Cornell University),True,5,machine learning; deep learning; prediction; neural network; neural networks,S,1,structured,"Coding diagnosis and procedures in medical records is a crucial process in\nthe healthcare industry, which includes the creation of accurate billings,\nreceiving reimbursements from payers, and creating standardized patient care\nrecords. In the United States, Billing and Insurance related activities cost\naround $471 billion in 2012 which constitutes about 25% of all the U.S hospital\nspending. In this paper, we report the performance of a natural language\nprocessing model that can map clinical notes to medical codes, and predict\nfinal diagnosis from unstructured entries of history of present illness,\nsymptoms at the time of admission, etc. Previous studies have demonstrated that\ndeep learning models perform better at such mapping when compared to\nconventional machine learning models. Therefore, we employed state-of-the-art\ndeep learning method, ULMFiT on the largest emergency department clinical notes\ndataset MIMIC III which has 1.2M clinical notes to select for the top-10 and\ntop-50 diagnosis and procedure codes. Our models were able to predict the\ntop-10 diagnoses and procedures with 80.3% and 80.5% accuracy, whereas the\ntop-50 ICD-9 codes of diagnosis and procedures are predicted with 70.7% and\n63.9% accuracy. Prediction of diagnosis and procedures from unstructured\nclinical notes benefit human coders to save time, eliminate errors and minimize\ncosts. With promising scores from our present model, the next step would be to\ndeploy this on a small-scale real-world scenario and compare it with human\ncoders as the gold standard. We believe that further research of this approach\ncan create highly accurate predictions that can ease the workflow in a clinical\nsetting.\n"
https://openalex.org/W4400000799,https://doi.org/10.3390/biomedicines12071415,Predictive Value of Multiple Scoring Systems in the Prognosis of Septic Patients with Different Infection Sites: Analysis of the Medical Information Mart for the Intensive Care IV Database,2024,2024-06-25,article,6,165.46225,"Di Zhang, Chang-yong Wang, Qianfeng Li, et al.",Biomedicines,True,5,prediction; predictive; logistic regression; auc; area under the curve,S,1,cohort,"The heterogeneity nature of sepsis is significantly impacted by the site of infection. This study aims to explore the predictive value of multiple scoring systems in assessing the prognosis of septic patients across different infection sites. Data for this retrospective cohort study were extracted from the Medical Information Mart for Intensive Care IV database (MIMIC-IV) (v2.2). Adult patients meeting the criteria for sepsis 3.0 and admitted to the intensive care unit (ICU) were enrolled. Infection sites included were pneumonia, urinary tract infection (UTI), cellulitis, abdominal infection, and bacteremia. The primary outcome assessed was 28-day mortality. The sequential Organ Failure Assessment (SOFA) score, Oxford Acute Severity of Illness Score (OASIS), and Logistic Organ Dysfunction System (LODS) score were compared. Binomial logistic regression analysis was conducted to evaluate the association between these variables and mortality. Additionally, differences in the area under the curve (AUC) of receiver operating characteristic (ROC) among the scoring systems were analyzed. A total of 4721 patients were included in the analysis. The average 28-day mortality rate was 9.4%. Significant differences were observed in LODS, OASIS, and SOFA scores between the 28-day survival and non-survival groups across different infection sites (<i>p</i> < 0.01). In the pneumonia group and abdominal infection group, both the LODS and OASIS scoring systems emerged as independent risk factors for mortality in septic patients (odds ratio [OR]: 1.165, 95% confidence interval [CI]: 1.109-1.224, <i>p</i> < 0.001; OR: 1.047, 95% CI: 1.028-1.065, <i>p</i> < 0.001) (OR: 1.200, 95% CI: 1.091-1.319, <i>p</i> < 0.001; OR: 1.060, 95% CI: 1.025-1.095, <i>p</i> < 0.001). For patients with UTI, the LODS, OASIS, and SOFA scoring systems were identified as independent risk factors for mortality (OR: 1.142, 95% CI: 1.068-1.220, <i>p</i> < 0.001; OR: 1.062, 95% CI: 1.037-1.087, <i>p</i> < 0.001; OR: 1.146, 95% CI: 1.046-1.255, <i>p</i> = 0.004), with the AUC of LODS score and OASIS significantly higher than that of the SOFA score (<i>p</i> = 0.006). Among patients with cellulitis, the OASIS and SOFA scoring systems were identified as independent risk factors for mortality (OR: 1.055, 95% CI: 1.007-1.106, <i>p</i> = 0.025; OR: 1.187, 95% CI: 1.005-1.403, <i>p</i> = 0.044), with no significant difference in prognosis prediction observed (<i>p</i> = 0.243). In the bacteremia group, the LODS scoring system was identified as an independent risk factor for mortality (OR: 1.165, 95% CI: 1.109-1.224, <i>p</i> < 0.001). The findings suggest that LODS scores offer better prognostic accuracy for predicting the mortality risk in septic patients with pneumonia, abdominal infections, bacteremia, and UTI compared to SOFA scores."
https://openalex.org/W4234396653,https://doi.org/10.21203/rs.3.rs-135817/v1,A novel nomogram for predicting survival in patients with severe acute pancreatitis: an analysis based on the large MIMIC-III clinical database,2020,2020-12-31,preprint,2,149.9723,"Di di Han, Shuo Feng Xu, Zhuo Cheng Li, et al.",NA,True,5,prediction model; prediction; classification; cox; auc,S,1,cohort,"<title>Abstract</title> <bold>Background </bold>Severe acute pancreatitis (SAP) can cause various complications. Septic shock is a relatively common and serious complication that causes uncontrolled systemic inflammatory response syndrome, which is one of the main causes of death. This study aimed to develop a nomogram for predicting the overall survival of SAP patients during the initial 24 hours following admission. <bold>Materials and Methods </bold>All data utilized in this study were obtained from the MIMIC-III (Medical Information Mart for Intensive Care III) database. The data were analyzed using multivariate Cox regression, and the performance of the proposed nomogram was evaluated based on Harrell’s concordance index (C-index) and the area under the receiver operating characteristic curve(AUC). The clinical value of the prediction model was tested using decision-curve analysis (DCA). The primary outcomes were 28-day,60-day, and 90-day mortality rates. <bold>Results</bold> The 850 patients included in the analysis comprised 595 in the training cohort and 255 in the validation cohort. The training cohort consisted of 353 (59.3%) males and 242 (40.7%) females with SAP. Multivariate Cox regression showed that weight, sex, insurance status, explicit sepsis, SAPSII score, Elixhauser score, bilirubin, anion gap, creatinine, hematocrit, hemoglobin, RDW, SpO 2 , and respiratory rate were independent prognostic factors for the survival of SAP patients admitted to an intensive care unit. The predicted values were compared using C-indexes, calibration plots, integrated discrimination improvement, net reclassification improvement, and DCA. <bold>Conclusions</bold> We have identified some important demographic and laboratory parameters related to the prognosis of patients with SAP, and have used them to establish a more accurate and convenient nomogram for evaluating their 28-day, 60-day, and 90-day all-cause mortality rates. The prognostic value of the novel nomogram is superior to that of the traditional SAPSII scoring system alone."
