openalex_id,doi,title,year,publication_date,type,cited_by_count,relevance_score,authors,source,dataset_mentioned,ml_match_count,matched_ml_terms,regime_selected,regime_match_count,matched_regime_terms,abstract
https://openalex.org/W4403789029,https://doi.org/10.48550/arxiv.2409.16339,"Large-scale digital phenotyping: identifying depression and anxiety indicators in a general UK population with over 10,000 participants",2024,2024-09-24,preprint,0,1.0339544,"Yuezhou Zhang, Callum Stewart, Yatharth Ranjan, et al.",arXiv (Cornell University),False,4,machine learning; prediction model; prediction; xgboost,M,2,wearable; digital phenotyping,"Digital phenotyping offers a novel and cost-efficient approach for managing depression and anxiety. Previous studies, often limited to small-to-medium or specific populations, may lack generalizability. We conducted a cross-sectional analysis of data from 10,129 participants recruited from a UK-based general population between June 2020 and August 2022. Participants shared wearable (Fitbit) data and self-reported questionnaires on depression (PHQ-8), anxiety (GAD-7), and mood via a study app. We first examined the correlations between PHQ-8/GAD-7 scores and wearable-derived features, demographics, health data, and mood assessments. Subsequently, unsupervised clustering was used to identify behavioural patterns associated with depression or anxiety. Finally, we employed separate XGBoost models to predict depression and anxiety and compared the results using different subsets of features. We observed significant associations between the severity of depression and anxiety with several factors, including mood, age, gender, BMI, sleep patterns, physical activity, and heart rate. Clustering analysis revealed that participants simultaneously exhibiting lower physical activity levels and higher heart rates reported more severe symptoms. Prediction models incorporating all types of variables achieved the best performance ($R^2$=0.41, MAE=3.42 for depression; $R^2$=0.31, MAE=3.50 for anxiety) compared to those using subsets of variables. This study identified potential indicators for depression and anxiety, highlighting the utility of digital phenotyping and machine learning technologies for rapid screening of mental disorders in general populations. These findings provide robust real-world insights for future healthcare applications."
https://openalex.org/W4312373350,https://doi.org/10.2196/39425,Objective Prediction of Next-Day’s Affect Using Multimodal Physiological and Behavioral Data: Algorithm Development and Validation Study,2022,2022-12-08,article,22,12.78521,"Salar Jafarlou, Jocelyn Lai, Iman Azimi, et al.",JMIR Formative Research,False,4,machine learning; prediction model; prediction; algorithm,M,1,multimodal,"Generic machine learning-based affect prediction models, trained with population data, outperform existing methods, which use the individual's historical information. Our findings indicated that our mood prediction method outperformed the existing methods. Additionally, we found that sleep and activity level were the most important features for predicting next-day PA and NA, respectively."
https://openalex.org/W4388380594,https://doi.org/10.3390/s23218987,"Quantifying Digital Biomarkers for Well-Being: Stress, Anxiety, Positive and Negative Affect via Wearable Devices and Their Time-Based Predictions",2023,2023-11-05,article,17,11.319157,"Berrenur Saylam, Özlem Durmaz İncel",Sensors,False,4,prediction; random forest; xgboost; lstm,M,1,wearable,"Wearable devices have become ubiquitous, collecting rich temporal data that offers valuable insights into human activities, health monitoring, and behavior analysis. Leveraging these data, researchers have developed innovative approaches to classify and predict time-based patterns and events in human life. Time-based techniques allow the capture of intricate temporal dependencies, which is the nature of the data coming from wearable devices. This paper focuses on predicting well-being factors, such as stress, anxiety, and positive and negative affect, on the Tesserae dataset collected from office workers. We examine the performance of different methodologies, including deep-learning architectures, LSTM, ensemble techniques, Random Forest (RF), and XGBoost, and compare their performances for time-based and non-time-based versions. In time-based versions, we investigate the effect of previous records of well-being factors on the upcoming ones. The overall results show that time-based LSTM performs the best among conventional (non-time-based) RF, XGBoost, and LSTM. The performance even increases when we consider a more extended previous period, in this case, 3 past-days rather than 1 past-day to predict the next day. Furthermore, we explore the corresponding biomarkers for each well-being factor using feature ranking. The obtained rankings are compatible with the psychological literature. In this work, we validated them based on device measurements rather than subjective survey responses."
https://openalex.org/W4315489974,https://doi.org/10.3991/ijim.v17i01.35131,Depression Detection Through Smartphone Sensing: A Federated Learning Approach,2023,2023-01-10,article,16,11.194143,"Nawrin Tabassum, Mustofa Ahmed, Nushrat Jahan Shorna, et al.",International Journal of Interactive Mobile Technologies (iJIM),False,4,machine learning; algorithm; neural network; deep neural network,M,1,smartphone,"Depression is one of the most common mental health disorders which affects thousands of lives worldwide. The variation of depressive symptoms among individuals makes it difficult to detect and diagnose early. Moreover, the diagnosing procedure relies heavily on human intervention, making it prone to mistakes. Previous research shows that smartphone sensor data correlates to the users’ mental conditions. By applying machine learning algorithms to sensor data, the mental health status of a person can be predicted. However, traditional machine learning faces privacy challenges as it involves gathering patient data for training. Newly, federated learning has emerged as an effective solution for addressing the privacy issues of classical machine learning. In this study, we apply federated learning to predict depression severity using smartphone sensing capabilities. We develop a deep neural network model and measure its performance in centralized and federated learning settings. The results are quite promising, which validates the potential of federated learning as an alternative to traditional machine learning, with the added benefit of data privacy."
https://openalex.org/W4304890991,https://doi.org/10.3389/fdgth.2022.877762,Digital phenotyping for classification of anxiety severity during COVID-19,2022,2022-10-13,article,9,9.914407,"Binh Nguyen, Martin Ivanov, Venkat Bhat, et al.",Frontiers in Digital Health,False,4,classification; support vector machine; svm; cross validation,M,1,digital phenotyping,"COVID-19 has led to an increase in anxiety among Canadians. Canadian Perspectives Survey Series (CPSS) is a dataset created by Statistics Canada to monitor the effects of COVID-19 among Canadians. Survey data were collected to evaluate health and health-related behaviours. This work evaluates CPSS2 and CPSS4, which were collected in May and July of 2020, respectively. The survey data consist of up to 102 questions. This work proposes the use of the survey data characteristics to identify the level of anxiety within the Canadian population during the first- and second-phases of COVID-19 and is validated by using the General Anxiety Disorder (GAD)-7 questionnaire. Minimum redundancy maximum relevance (mRMR) is applied to select the top features to represent user anxiety, and support vector machine (SVM) is used to classify the separation of anxiety severity. We employ SVM for binary classification with 10-fold cross validation to separate the labels of <i>Minimal</i> and <i>Severe</i> anxiety to achieve an overall accuracy of <mml:math xmlns:mml=""http://www.w3.org/1998/Math/MathML""><mml:mn>94.77</mml:mn> <mml:mo>±</mml:mo> <mml:mn>0.13</mml:mn> <mml:mtext>%</mml:mtext></mml:math> and <mml:math xmlns:mml=""http://www.w3.org/1998/Math/MathML""><mml:mn>97.35</mml:mn> <mml:mo>±</mml:mo> <mml:mn>0.11</mml:mn> <mml:mtext>%</mml:mtext></mml:math> for CPSS2 and CPSS4, respectively. After analysis, we compared the results of the first and second phases of COVID-19 and determined a subset of the features that could be represented as pseudo passive (PP) data. The accurate classification provides a proxy on the potential onsets of anxiety to provide tailored interventions. Future works can augment the proposed PP data for carrying out a more detailed digital phenotyping."
https://openalex.org/W3089386605,https://doi.org/10.1101/2020.10.03.20206235,Detecting and Monitoring Brain Disorders Using Smartphones and Machine Learning,2020,2020-10-06,preprint,6,9.442497,"Rich Colbaugh, K. Glass, Volv Global",medRxiv,False,4,machine learning; predictive modeling; predictive; algorithm,M,1,smartphone,"Abstract The ubiquity of smartphones in modern life suggests the possibility to use them to continuously monitor patients, for instance to detect undiagnosed diseases or track treatment progress. Such data collection and analysis may be especially beneficial to patients with i.) mental disorders , as these individuals can experience intermittent symptoms and impaired decision-making, which may impede diagnosis and care-seeking, and ii.) progressive neurological diseases , as real-time monitoring could facilitate earlier diagnosis and more effective treatment. This paper presents a new method of leveraging passively-collected smartphone data and machine learning to detect and monitor brain disorders such as depression and Parkinson’s disease. Crucially, the algorithm is able learn accurate, interpretable models from small numbers of labeled examples (i.e., smartphone users for whom sensor data has been gathered and disease status has been determined). Predictive modeling is achieved by learning from both real patient data and ‘synthetic’ patients constructed via adversarial learning. The proposed approach is shown to outperform state-of-the-art techniques in experiments involving disparate brain disorders and multiple patient datasets."
https://openalex.org/W2974156825,,Exploring the use of online social network activity and smartphone photography as an intervention to track and influence emotional well-being,2018,2018-09-01,dissertation,0,0.2330293,James Alexander Lee,Kent Academic Repository (University of Kent),False,4,machine learning; classification; algorithm; ann,M,1,smartphone,"The proliferation of internet and mobile technologies has expanded the means of detecting and influencing mental health, with this thesis focusing on the affective phenomena associated with emotional well-being including mood, affect and emotion. Traditional detection techniques including surveys and self-reports are grounded in the psychological literature; however, they introduce an inhibiting burden on the participants. The ability to passively detect psychological state using technologies including online behavioural tracking and mobile sensors is a prevalent focus of the current literature. Traditional positive psychology interventions commonly involve emotionally expressive writing tasks which can also be tedious for participants. Augmenting traditional intervention techniques with technologies such as smartphone applications can be one method to modernise interventions. The first research study in this thesis aimed to utilise online social network (OSN) activity to detect mood changes. The study involved collecting the participants' behavioural activities such as likes, comments and tweets from their Facebook and Twitter profiles. Machine learning was used to create an algorithm to classify participants according to their online activity and their self-reported mood as ground truth. The findings indicated that participants can be grouped into those who displayed positive, negative or weak correlations with their online activity. Following the classification, the system used a sliding window of 7 days to track the participant's mood changes for those in the positive and negative groups. The second research study introduced a positive psychology intervention in the form of a smartphone application called SnapAppy which promotes positive thinking by integrating momentary smartphone photography with traditional intervention methodologies. Participants were required to take photos and write about positive moments, past events, acts of kindness and gratuitous situations, encouraging them to think more positively. The results indicated that features such as the number of photos taken, the effort applied to annotating the photos, the number of photos revisited and the photos containing people were positively correlated with an improvement in mood and affect. The product of this thesis is a novel method of passively tracking mood changes using online social network activity and an innovative smartphone intervention utilising photography to influence emotional well-being."
https://openalex.org/W2515289904,https://doi.org/10.1145/2971648.2971748,Test time feature ordering with FOCUS,2016,2016-09-09,article,22,16.647987,"Kirstin Early, Stephen E. Fienberg, Jennifer Mankoff",NA,False,4,machine learning; prediction; predictive; algorithm,M,0,,"Predictive algorithms are a critical part of the ubiquitous computing vision, enabling appropriate action on behalf of users. A common class of algorithms, which has seen uptake in ubiquitous computing, is supervised machine learning algorithms. Such algorithms are trained to make predictions based on a set of features (selected at training time). However, features needed at prediction time (such as mobile information that impacts battery life, or information collected from users via experience sampling) may be costly to collect. In addition, both cost and value of a feature may change dynamically based on real-world context (such as battery life or user location) and prediction context (what features are already known, and what their values are). We contribute a framework for dynamically trading off feature cost against prediction quality at prediction time. We demonstrate this work in the context of three prediction tasks: providing prospective tenants estimates for energy costs in potential homes, estimating momentary stress levels from both sensed and user-provided mobile data, and classifying images to facilitate opportunistic device interactions. Our results show that while our approach to cost-sensitive feature selection is up to 45% less costly than competing approaches, error rates are equivalent or better."
https://openalex.org/W4303427132,https://doi.org/10.1145/3564752,Designing Human-centered AI for Mental Health: Developing Clinically Relevant Applications for Online CBT Treatment,2022,2022-10-07,article,150,16.211508,"Anja Thieme, Maryann Hanratty, Maria Lyons, et al.",ACM Transactions on Computer-Human Interaction,False,4,machine learning; prediction model; prediction; algorithm,M,0,,"Recent advances in AI and machine learning (ML) promise significant transformations in the future delivery of healthcare. Despite a surge in research and development, few works have moved beyond demonstrations of technical feasibility and algorithmic performance. However, to realize many of the ambitious visions for how AI can contribute to clinical impact requires the closer design and study of AI tools or interventions within specific health and care contexts. This article outlines our collaborative, human-centered approach to developing an AI application that predicts treatment outcomes for patients who are receiving human-supported, internet-delivered Cognitive Behavioral Therapy (iCBT) for symptoms of depression and anxiety. Intersecting the fields of HCI, AI, and healthcare, we describe how we addressed the specific challenges of (1) identifying clinically relevant AI applications ; and (2) designing AI applications for sensitive use contexts like mental health. Aiming to better assist the work practices of iCBT supporters, we share how learnings from an interview study with 15 iCBT supporters surfaced their practices and information needs and revealed new opportunities for the use of AI. Combined with insights from the clinical literature and technical feasibility constraints, this led to the development of two clinical outcome prediction models. To clarify their potential utility for use in practice, we conducted 13 design sessions with iCBT supporters that utilized interface mock-ups to concretize the AI output and derive additional design requirements. Our findings demonstrate how design choices can impact interpretations of the AI predictions as well as supporter motivation and sense of agency. We detail how this analysis and the design principles derived from it enabled the integration of the prediction models into a production interface. Reporting on identified risks of over-reliance on AI outputs and needs for balanced information assessment and preservation of a focus on individualized care, we discuss and reflect on what constitutes a responsible, human-centered approach to AI design in this healthcare context."
https://openalex.org/W4225014345,https://doi.org/10.1145/3491102.3501826,Towards Relatable Explainable AI with the Perceptual Process,2022,2022-04-28,article,58,13.238538,"Wencan Zhang, Brian Y. Lim",CHI Conference on Human Factors in Computing Systems,False,4,machine learning; prediction; neural network; deep neural network,M,0,,"Machine learning models need to provide contrastive explanations, since people often seek to understand why a puzzling prediction occurred instead of some expected outcome. Current contrastive explanations are rudimentary comparisons between examples or raw features, which remain difficult to interpret, since they lack semantic meaning. We argue that explanations must be more relatable to other concepts, hypotheticals, and associations. Inspired by the perceptual process from cognitive psychology, we propose the XAI Perceptual Processing Framework and RexNet model for relatable explainable AI with Contrastive Saliency, Counterfactual Synthetic, and Contrastive Cues explanations. We investigated the application of vocal emotion recognition, and implemented a modular multi-task deep neural network to predict and explain emotions from speech. From think-aloud and controlled studies, we found that counterfactual explanations were useful and further enhanced with semantic cues, but not saliency explanations. This work provides insights into providing and evaluating relatable contrastive explainable AI for perception applications."
https://openalex.org/W2986705763,https://doi.org/10.11591/ijece.v9i5.pp3872-3879,Student risk identification learning model using machine learning approach,2019,2019-10-01,article,12,12.431234,"K H Susheelamma, K. M. Ravikumar",International Journal of Power Electronics and Drive Systems/International Journal of Electrical and Computer Engineering,False,4,machine learning; classification; algorithm; xgboost,M,0,,"&lt;p class=""Abstract""&gt;Several challenges are associated with online based learning systems, the most important of which is the lack of student motivation in various course materials and for various course activities. Further, it is important to identify student who are at risk of failing to complete the course on time. The existing models applied machine learning approach for solving it. However, these models are not efficient as they are trained using legacy data and also failed to address imbalanced data issues for both training and testing the classification approach. Further, they are not efficient for classifying new courses. For overcoming these research challenges, this work presented a novel design by training the learning model for identifying risk using current courses. Further, we present an XGBoost classification algorithm that can classify risk for new courses. Experiments are conducted to evaluate performance of proposed model. The outcome shows the proposed model attain significant performance over stat-of-art model in terms of ROC, F-measure, Precision and Recall.&lt;/p&gt;"
https://openalex.org/W2902900773,https://doi.org/10.14569/ijacsa.2018.091142,A Novel Student Risk Identification Model using Machine Learning Approach,2018,2018-01-01,article,8,11.536233,"Nityashree Nadar, Dr.R.Kamatchi -",International Journal of Advanced Computer Science and Applications,False,4,machine learning; classification; support vector machine; svm,M,0,,"This research work aim at addressing issues in detecting student, who are at risk of failing to complete their course. The conceptual design presents a solution for efficient learning in non-existence of data from previous courses, which are generally used for training state-of-art machine learning (ML) based model. The expected scenarios usually occurs in scenario when university introduces new courses for academics. For addressing this work, build a novel learning model that builds a ML from data constructed from present course. The proposed model uses data about already submitted task, which further induces the issues of imbalanced data for both training and testing the classification model. The contribution of the proposed model are: the design of training the learning model for detecting risk student utilizing information from present courses, tackling challenges of imbalanced data which is present in both training and testing data, defining the issues as a classification task, and lastly, developing a novel non-linear support vector machine (NL-SVM) classification model. Experiment outcome shows proposed model attain significant outcome when compared with state-of-art model."
https://openalex.org/W4407229447,https://doi.org/10.1017/s0033291724003295,"Artificial intelligence in mental health care: a systematic review of diagnosis, monitoring, and intervention applications",2025,2025-01-01,review,96,8.547968,"Pablo Cruz-Gonzalez, Anxun He, Eva K. M. Lam, et al.",Psychological Medicine,False,4,machine learning; artificial intelligence; random forest; support vector machine,M,0,,"Artificial intelligence (AI) has been recently applied to different mental health illnesses and healthcare domains. This systematic review presents the application of AI in mental health in the domains of diagnosis, monitoring, and intervention. A database search (CCTR, CINAHL, PsycINFO, PubMed, and Scopus) was conducted from inception to February 2024, and a total of 85 relevant studies were included according to preestablished inclusion criteria. The AI methods most frequently used were support vector machine and random forest for diagnosis, machine learning for monitoring, and AI chatbot for intervention. AI tools appeared to be accurate in detecting, classifying, and predicting the risk of mental health conditions as well as predicting treatment response and monitoring the ongoing prognosis of mental health disorders. Future directions should focus on developing more diverse and robust datasets and on enhancing the transparency and interpretability of AI models to improve clinical practice."
https://openalex.org/W4360869584,https://doi.org/10.31234/osf.io/vwpd8,Semantic signals in self-reference: The detection and prediction of depressive symptoms from the daily diary entries of a sample with major depressive disorder,2023,2023-03-23,preprint,4,6.526996,"Amanda C Collins, Damien Lekkas, Matthew D. Nemesure, et al.",NA,False,4,prediction; classification; regression model; auc,M,0,,"Individuals with major depressive disorder (MDD) experience fewer positive and more negative emotions and use fewer positive words to describe themselves. Natural language processing (NLP) techniques have been used to predict depression, with pronoun and emotion usage being identified as important features. However, it is unclear how depressed individuals use positive and negative words when writing about themselves. Individuals with MDD (N=258) completed ecological momentary assessments (EMAs) three times a day (including the Patient Health Questionnaire-9 (PHQ-9) and a free-text diary entry) and weekly EMAs (including a free-text response to a life events prompt) over a 90-day study period. Using NLP techniques, we generated 20 model features to detect and predict average weekly depression from diary entries. Two regression models detected and predicted total PHQ-9 and two classification models detected and predicted moderate to severe depression. The models classified current (AUC=0.68) and future depression (AUC=0.63), and suggest that lower valence increased usage of “I”/“me”/“my”, and lower valence of passages with “I”/“me” as the subject, influenced model predictions towards more severe depression, supporting prior research. These findings highlight that depressed individuals use less positive and more negative words when referring to themselves. Treatments targeting positive affect and digital interventions that written components may be beneficial for targeting MDD."
