openalex_id,doi,title,year,publication_date,type,cited_by_count,relevance_score,authors,source,dataset_mentioned,ml_match_count,matched_ml_terms,regime_selected,regime_match_count,matched_regime_terms,abstract
https://openalex.org/W7134938353,https://doi.org/10.20944/preprints202603.0728.v1,Lagun’s Law as a Structural Constraint on Volitional Drive: Straight Validation Across Independent Secondary Datasets,2026,2026-03-10,preprint,0,1.5538448,Nikesh Lagun,Preprints.org,False,1,ann,M,1,smartphone,"Background: Motivation research has generated many constructs, yet many theories remain structurally under-specified, relying on flexible verbal accounts or models whose functional form is optimized to data rather than fixed in advance. This limits falsifiability, cross-domain comparison, and principled failure. Theory: Lagun’s Law proposes a fixed six-variable structural equation of volitional drive specifying ignition gating, nonlinear amplification, divisive resistance, and an explicit variability term. The law is defined by its functional architecture rather than by any particular semantic interpretation or measurement instantiation. Objective: This study evaluates Lagun’s Law using straight structural validation: assessing whether a pre-specified equation exhibits recurring empirical signatures when applied without reparameterization, optimization, or post hoc modification. The aim is to test structural admissibility. Method: The equation was instantiated using pre-defined proxies across four independent secondary datasets spanning learning analytics, intelligent tutoring systems, naturalistic smartphone sensing, and laboratory neurophysiology. All proxies respected temporal precedence and outcome non-overlap. Where full instantiation was not possible, analyses were treated as reduced-form tests. Results: Recurring structural signatures were observed across all four datasets. Readiness functioned as a prerequisite rather than a graded predictor, divisive resistance effects were observed in three of four datasets, and independent behavioral variability persisted across contexts. Nonlinear amplification was directly testable in two datasets and attenuated or untestable elsewhere due to measurement constraints. Conclusion: These findings provide empirical grounding for Lagun’s Law as a structurally admissible constraint on volitional drive, clarifying its scope conditions and falsification pathways while avoiding claims of causality, universality, or optimal measurement."
https://openalex.org/W3206514648,,TREATISE-B: a toolbox for exploratory analysis of behavioral time series,2021,2021-08-23,article,0,1.5313878,Arsi Ikäheimonen,Aaltodoc (Aalto University),False,1,machine learning,M,1,multimodal,"Human mood undergoes fluctuations of various time scales in response to the intrinsic and extrinsic factors and stressors. Disturbed mood fluctuations characterize mood-related disorders, such as major depressive disorder. Due to this, mood fluctuations are used to indicate changes in a subject's mental state.&#13;\n&#13;\n&#13;\nThe assessments of the subject's moods should be conducted frequently to capture the fluctuations. The simplest way of assessing the subject's mood is by surveys or questionnaires. However, these methods are prone to recall bias and low adherence. To alleviate these problems, several passive sensing methods have been developed, including passive sensing using digital devices. This method provides behavioral and social interaction data and physiological data that could potentially be used to infer and predict a subject's mood. &#13;\n&#13;\n&#13;\nYet, the analysis of mood dynamics is challenging due to individual differences and variability. Furthermore, the interactions between the mood, behavioral, and physiological measurements are still not well understood. As there are no readily available tools to explore and understand these interactions, we created TREATISE-B: a toolbox for exploratory analysis of behavioral time series. The focus of this thesis is to present the implemented toolbox and evaluate its suitability for the analysis. &#13;\n&#13;\n&#13;\nThe toolbox was tested with two data sets containing multimodal longitudinal data. The tests revealed changes in behavioral data and discontinuities in physiological data co-occurring during periods of high stress and negative mood. We also observed high variability in the collected data between the subjects. &#13;\n&#13;\n&#13;\nThe results suggest that the toolbox and implemented methods are a suitable option for exploratory analysis. Furthermore, the toolbox may serve as an initial stepping stone for future research, facilitating the data analysis phase by reducing the time needed for programming.&#13;\n&#13;\n&#13;\nFurther analysis of the discovered anomalies and discontinuities may shed some light on the mood dynamics and the mechanics behind the mood disorders. The findings may also help feature selection for machine learning applications predicting the mood from passively sensed behavioral data. This information would also be helpful for early warning sign detection, which can be used to predict and prevent mood disorder onsets and relapses, which may be beneficial for improving current psychological treatments."
https://openalex.org/W2950834775,https://doi.org/10.13140/rg.2.2.35933.31207,MIMiS: Minimally Intrusive Mining of Smartphone User Behaviors,2018,2018-01-01,preprint,0,1.5256256,"Pravallika Devineni, Evangelos E. Papalexakis, Kalina J. Michalska, et al.",arXiv (Cornell University),False,1,prediction,M,1,smartphone,"How intrusive does a life-saving user-monitoring application really need to be? While most previous research was focused on analyzing mental state of users from social media and smartphones, there is little effort towards protecting user privacy in these analyses. A challenge in analyzing user behaviors is that not only is the data multi-dimensional with a myriad of user activities but these activities occur at varying temporal rates. The overarching question of our work is: Given a set of sensitive user features, what is the minimum amount of information required to group users with similar behavior? Furthermore, does this user behavior correlate with their mental state? Towards answering those questions, our contributions are two fold: we introduce the concept of privacy surfaces that combine sensitive user data at different levels of intrusiveness. As our second contribution, we introduce MIMiS, an unsupervised privacy-aware framework that clusters users in a given privacy surface configuration to homogeneous groups with respect to their temporal signature. In addition, we explore the trade-off between intrusiveness and prediction accuracy. MIMiS employs multi-set decomposition in order to deal with incompatible temporal granularities in user activities. We extensively evaluate MIMiS on real data. Across a variety of privacy surfaces, MIMiS identified groups that are highly homogeneous with respect to self-reported mental health scores. Finally, we conduct an in-depth exploration of the discovered clusters, identifying groups whose behavior is consistent with academic deadlines."
https://openalex.org/W7113421421,,TREATISE-B: kartoittavan aikasarja-analyysin työkalupakki käyttätymishavaintoaineistolle,2021,2021-08-23,other,0,1.5106657,"Ikäheimonen, Arsi",Aaltodoc (Aalto University),False,1,machine learning,M,1,multimodal,"Human mood undergoes fluctuations of various time scales in response to the intrinsic and extrinsic factors and stressors. Disturbed mood fluctuations characterize mood-related disorders, such as major depressive disorder. Due to this, mood fluctuations are used to indicate changes in a subject's mental state. The assessments of the subject's moods should be conducted frequently to capture the fluctuations. The simplest way of assessing the subject's mood is by surveys or questionnaires. However, these methods are prone to recall bias and low adherence. To alleviate these problems, several passive sensing methods have been developed, including passive sensing using digital devices. This method provides behavioral and social interaction data and physiological data that could potentially be used to infer and predict a subject's mood. Yet, the analysis of mood dynamics is challenging due to individual differences and variability. Furthermore, the interactions between the mood, behavioral, and physiological measurements are still not well understood. As there are no readily available tools to explore and understand these interactions, we created TREATISE-B: a toolbox for exploratory analysis of behavioral time series. The focus of this thesis is to present the implemented toolbox and evaluate its suitability for the analysis. The toolbox was tested with two data sets containing multimodal longitudinal data. The tests revealed changes in behavioral data and discontinuities in physiological data co-occurring during periods of high stress and negative mood. We also observed high variability in the collected data between the subjects. The results suggest that the toolbox and implemented methods are a suitable option for exploratory analysis. Furthermore, the toolbox may serve as an initial stepping stone for future research, facilitating the data analysis phase by reducing the time needed for programming. Further analysis of the discovered anomalies and discontinuities may shed some light on the mood dynamics and the mechanics behind the mood disorders. The findings may also help feature selection for machine learning applications predicting the mood from passively sensed behavioral data. This information would also be helpful for early warning sign detection, which can be used to predict and prevent mood disorder onsets and relapses, which may be beneficial for improving current psychological treatments."
https://openalex.org/W4288077473,https://doi.org/10.31219/osf.io/g5bpe,Modeling social interaction dynamics measured with smartphone sensors: An ambulatory assessment study on social interactions and loneliness,2022,2022-07-28,preprint,0,1.4591671,"Timon Elmer, Gerine M. A. Lodder",NA,False,1,survival model,M,1,smartphone,"More and more data are being collected using combined active (e.g., surveys) and passive (e.g., smartphone sensors) ambulatory assessment methods. Fine-grained temporal data, such as smartphone-sensors data, allow gaining new insights into the dynamics of social interactions in day-to-day life and how these are associated with psychosocial phenomena – such as loneliness. So far, however, smartphone sensor data have often been aggregated over time, thus, not doing justice to the fine-grained temporality of these data. In this article, we demonstrate how time-stamped sensor data of social interactions can be modeled with multistate survival models. We examine how loneliness is associated with (a) the time between social interaction (i.e., interaction rate) and (b) duration of social interactions in a student population (N_participants = 45, N_observations = 74,645). Before a 10-week ambulatory assessment phase, participants completed the UCLA loneliness scale, covering subscales on intimate, relational, and collective loneliness. Results from the multistate survival models indicated that loneliness subscales were not significantly associated with differences in social interaction rate and duration– only relational loneliness predicted shorter social interaction encounters. These findings illustrate how the combination of new measurement and modeling methods can advance knowledge on social interaction dynamics in daily life settings and how they relate to psychosocial phenomena such as loneliness."
https://openalex.org/W4410335961,https://doi.org/10.1587/transinf.2024edp7248,Estimating Present Bias Using Behavior History,2025,2025-05-13,article,0,1.2093937,"Shuhei Yamamoto, Yasunori Akagi, Tomu Tominaga, et al.",IEICE Transactions on Information and Systems,False,1,transformer,M,1,wearable,"Present bias, the cognitive bias that prioritizes immediate rewards over future ones, is considered one of the factors that can hinder goal achievement. Estimation of present bias enables the development of effective intervention strategies for behavioral change. This paper proposes a novel method using behavior history, captured by wearable devices for estimating the present bias. We employ Transformer due to its proficiency in learning relationships within sequential data like behavioral history, including continuous (e.g., heart rate) and event data (e.g., sleep onset). To allow Transformer to capture behavior patterns affected by present bias from behavior history, we introduce two novel architectures for effectively processing continuous and event data timestamp information in behavioral history: temporal and event encoders (TE and EE). TE discerns the periodic characteristics of continuous data, while EE examines temporal interdependencies in the event data. These encoders enable our proposed model to capture temporally (ir)regular behavioral patterns associated with present bias. Our experiments using the behavior history logs of 257 subjects collected over 28 days demonstrated that our method estimates the subjects' present bias accurately."
https://openalex.org/W4400812659,https://doi.org/10.5753/ctd.2024.1916,Kratos: An Intelligent Model for Assisting People with Problematic Smartphone Use Through Context Histories Analysis,2024,2024-07-19,article,0,1.199095,"Gustavo Lazarotto Schroeder, Rosemary Francisco, Jorge Luís Victória Barbosa",NA,False,1,machine learning,M,1,smartphone,"Global smartphone usage has surged, becoming indispensable in people’s daily lives. Despite benefits, concerns arise about prolonged hyper-connected experiences. The excessive use of smartphones coupled with demographic and mental health-related risk factors can lead to problematic smartphone use (PSU), characterized as compulsive smartphone use disrupting daily life, work, and relationships. This article summarizes an Academic Master’s Dissertation introducing Kratos, a computational model designed to identify PSU through context awareness, context histories, machine learning, and ontology. The main scientific contribution of the Kratos model is the automatic PSU identification and intervention proposals using machine learning and ontological inferences. In the assessment of the model, the Kratos Dataset Simulator (KDS) generated simulations for 49 individuals for 30 days. The machine learning and ontology experiments occurred based on the KDS simulated dataset. The creation of smartphone use behavior profiles allowed the use of Manhattan Distance to identify the behavior as normal or PSU. A silhouette analysis allowed the validation of the consistency of the clusters after the behavior identification process occurred. The results demonstrated the model’s ability to consistently distinguish the smartphone use behaviors, correctly separating the clusters of behaviors. Based on the Machine Learning and Ontology results, Kratos recommends literature-based interventions for PSU behaviors. Thus, this research improves PSU identification and assistance through the proposed model."
https://openalex.org/W2972439239,,Evaluation of Methods for Data-Driven Tools that Empower Mental Health Professionals,2019,2019-01-01,article,0,1.1632202,Orianna DeMasi,eScholarship (California Digital Library),False,1,algorithm,M,1,smartphone,"It is estimated that nearly one in five adults in the United States live with mental illness, and for individuals who struggle with mental health, the experience can be excruciating. The rise of mobile devices presents a unique opportunity to improve mental health outcomes, in part through empowering mental health professionals. Because many individuals always have their smartphones with them, smartphones may be able to enable health professionals to identify when an individual is in need and provide immediate care, rather than the current model of delaying care until a scheduled appointment. To this end, I investigate the feasibility of two new data-driven tools: one to identify when care is needed and the second to help train counselors to intervene when care is needed. The first tool I consider seeks to use a smartphone to sense an individual's well-being. Such a tool could be used to inform health professionals of patients' states, evaluate the efficacy of therapies, and deliver just-in-time interventions. To evaluate the potential accuracy of such a tool, I collect students' passive smartphone data and self-reported well-being measures, and then consider predicting well-being on a daily basis and detecting significant changes over a period of time. As this approach seems unreliable for most individuals, I further explore for which individuals such an approach may be reliable and develop a framework for evaluating longitudinal sensing quality. I find that while correlations between smartphone-sensed measures and reported wellbeing scores exist, these relationships are often too weak to reliably predict wellbeing. The second tool I explore seeks to help suicide prevention counselors practice intervening over chat for individuals in crisis. For this, I collect and leverage synthetic conversation transcripts and show how to evaluate a baseline system for counselors to practice crisis de-escalation strategies in a no-risk environment. While text retrieval and generation methods can return responses that make sense in limited context most of the time, i.e., in greater that 50% of examples, generated responses are shorter than retrieving full messages, implying that generation may potentially be a less engaging approach. Overall, I find that significant consideration of context is needed to provide meaningful evaluation of methods for the tools envisioned. While popular algorithms and methods may hold potential to develop the tools discussed, rigorous evaluation and further work is needed to ensure reliability within the application context."
https://openalex.org/W4366850512,https://doi.org/10.48550/arxiv.2304.11049,Using Mobile Data and Deep Models to Assess Auditory Verbal Hallucinations,2023,2023-04-20,preprint,0,1.0774522,"Shayan Mirjafari, Subigya Nepal, Weichen Wang, et al.",arXiv (Cornell University),False,1,predictive,M,1,data fusion,"Hallucination is an apparent perception in the absence of real external sensory stimuli. An auditory hallucination is a perception of hearing sounds that are not real. A common form of auditory hallucination is hearing voices in the absence of any speakers which is known as Auditory Verbal Hallucination (AVH). AVH is fragments of the mind's creation that mostly occur in people diagnosed with mental illnesses such as bipolar disorder and schizophrenia. Assessing the valence of hallucinated voices (i.e., how negative or positive voices are) can help measure the severity of a mental illness. We study N=435 individuals, who experience hearing voices, to assess auditory verbal hallucination. Participants report the valence of voices they hear four times a day for a month through ecological momentary assessments with questions that have four answering scales from ``not at all'' to ``extremely''. We collect these self-reports as the valence supervision of AVH events via a mobile application. Using the application, participants also record audio diaries to describe the content of hallucinated voices verbally. In addition, we passively collect mobile sensing data as contextual signals. We then experiment with how predictive these linguistic and contextual cues from the audio diary and mobile sensing data are of an auditory verbal hallucination event. Finally, using transfer learning and data fusion techniques, we train a neural net model that predicts the valance of AVH with a performance of 54\% top-1 and 72\% top-2 F1 score."
https://openalex.org/W4225065761,,Stress detection on smartphone data with a machine learning approach based on Mahalanobis distance-based outlier finding and ReliefF feature selection,2021,2021-06-07,article,0,1.0676305,"Ensar Arif Sağbaş, Serdar Korukoğlu, Serkan Ballı",DergiPark (Istanbul University),False,1,machine learning,M,1,smartphone,"Stres kişinin odaklanması, uyanık kalması ve tetikte olması durumlarında fayda sağlamaktadır. Fakat yüksek dozda strese maruz kalmak kişinin sağlığına zarar vermektedir. Bu nedenle stresin tespit edilip en kısa sürede rahatlamaya geçilmesi önemlidir. Bu çalışmada, akıllı telefondan elde edilen dokunmatik panel, yerçekimi, doğrusal ivme ve jiroskop verileri ile yazma davranışları incelenmiştir. Elde edilen sonuçlardan yazma davranışları ile kişilerin stres seviyeleri arasında bir bağlantı olduğu görülmüştür. Bu kapsamda genişletilmiş bir veri kümesi oluşturulmuştur. Stresin daha yüksek doğrulukta tespit edilebilmesi için Mahalanobis uzaklığı tabanlı bir aykırı veri tespiti yaklaşımı uygulanmıştır. Devamında, verimli özniteliklerin tespit edilerek sınıflandırma gerçekleştirilmesi için ReliefF öznitelik seçimi yöntemi ve makine öğrenmesi teknikleri kombine edilerek bir yapı oluşturulmuştur. Aykırı verilerin temizlenerek elde edilen sonuçlar, oluşturulan yapıların yüksek doğrulukta başarı yakaladığını göstermiştir. Ek olarak aykırı veri tespiti ve temizliği, sınıflandırma başarısını 1.77 puan artırmıştır."
https://openalex.org/W4247072343,https://doi.org/10.21203/rs.3.rs-40879/v1,What does social support sound like? Challenges and opportunities for using passive episodic audio collection to assess the social environment,2020,2020-07-14,preprint,0,0.9586754,"Anubhuti Poudyal, Alastair van Heerden, Ashley Hagaman, et al.",NA,False,1,classification,M,1,smartphone,"<title>Abstract</title> <bold>Background</bold>: The social environment, including social support, social burden, and quality of interactions, influences a range of health outcomes, including mental health. Passive audio data collection on mobile phones (e.g., episodic recording of the auditory environment without requiring any active input from the phone user) enables new opportunities to understand the social environment. We evaluated the use of passive audio collection on mobile phones as a window onto the relationship between the social environment within a study of mental health among adolescent mothers in Nepal.<bold>Methods</bold>: We enrolled 23 adolescent mothers who first participated in qualitative interviews to describe their social support and identify sounds potentially associated with that support. Then episodic recordings were collected for two weeks from the same women using an app to capture 30 seconds of audio every 15 minutes from 4am to 9pm. Audio data were processed and classified using a pretrained model. Each classification category was accompanied by a predicted accuracy score. Manual validation of the machine-predicted speech and non-speech categories (10%) was done for accuracy.<bold>Results</bold>: In qualitative interviews, mothers described a range of positive and negative social interactions and the sounds that accompanied these. Potential positive sounds included adult speech and laughter, baby babbling and laughter, and sounds from baby toys. Sounds characterizing negative stimuli included yelling, crying, screaming by adults and crying by babies. Sounds associated with social isolation included silence and TV or radio noises. Speech comprised of 43% of all passively recorded audio clips (n=7725). Manual validation showed a 23% false positive rate and 62% false-negative rate for speech, demonstrating potential underestimation of speech exposure. Other common sounds included music and vehicular noises.<bold>Conclusions</bold>: Passively capturing audio has the potential to improve understanding of the social environment. However, the limited accuracy of the pre-trained model used in this study did not adequately distinguish between positive and negative social interactions. To improve the contribution of passive audio collection to understanding the social environment, future work should improve the accuracy of audio categorization, code for constellations of sounds, and combine audio with other smartphone data collection such as location and activity."
