openalex_id,doi,title,year,publication_date,type,cited_by_count,relevance_score,authors,source,dataset_mentioned,ml_match_count,matched_ml_terms,regime_selected,regime_match_count,matched_regime_terms,abstract
https://openalex.org/W4285117486,https://doi.org/10.1109/taffc.2022.3176967,Capturing Interaction Quality in Long Duration (Simulated) Space Missions With Wearables,2022,2022-05-23,article,5,5.6226716,"Ekin Gedik, Jeffrey Olenick, Chu‐Hsiang Chang, et al.",IEEE Transactions on Affective Computing,False,2,ann; auc,M,1,wearable,"Space exploration is evolving with the recent increase in interest and investment. For the success of planned long-duration crewed missions, good interpersonal interactions between crew members are crucial. In this study, we evaluate the use of wearables for detection and estimation of the quality of each social interaction participants have throughout a long mission rather than aggregate measures of interactions. Our proposed method utilizes Temporal Convolutional Networks(TCNs) for extracting individual representations from acceleration and audio streams and learnable pooling layers(NetVLAD) to aggregate these representations into fixed-size representations. Use of NetVLAD layers provides an intelligent alternative to simple aggregation for handling variable-sized interactions and interactions with missing data. We evaluate our method on a 4-month simulated space mission where 5 participants wore Sociometric Badges and provided reports on their interactions in terms of effectiveness, frustration, and satisfaction. Our method provides an average ROC-AUC score of 0.64. Since we are not aware of any comparable baselines, we compare our method to hand-crafted features formerly utilized for cohesion estimation in similar scenarios and show it significantly outperforms them. We also present ablation studies where we replace the components in our approach with well-known alternatives and show that they provide better performance than their respective counterparts."
https://openalex.org/W4408500819,https://doi.org/10.52783/jns.v14.2058,Machine Learning-Based Sentiment Analysis for Suicide Prevention and Mental Health Monitoring in Educational Institutions,2025,2025-03-11,article,1,4.7365766,"Anas Habib Zuberi, Ambreen Anees, Nadeem Anjum, et al.",Journal of Neonatal Surgery,False,2,machine learning; deep learning,M,1,multimodal,"Mental health issues and suicidal tendencies among students are growing concerns in educational institutions. Early detection and intervention are crucial for prevention, yet traditional methods often rely on self-reporting and manual assessments, which may be delayed or inaccurate. This study explores the use of machine learning-based sentiment analysis to monitor students' emotional well-being and identify signs of distress. By analyzing text from social media, academic forums, and communication platforms, Natural Language Processing (NLP) and deep learning models can detect negative sentiment patterns indicative of mental health risks. The proposed approach aims to develop an intelligent, real-time monitoring system for early intervention and personalized support. The findings contribute to AI-driven solutions for mental health awareness and suicide prevention in educational settings.The model accurately detects mental distress and suicidal tendencies using NLP and deep learning, enabling early intervention.Future work can integrate multimodal data, real-time monitoring, and AI-driven interventions for improved mental health support."
https://openalex.org/W4403095000,https://doi.org/10.1109/taffc.2024.3474098,Measuring Affective State: Subject-Dependent and -Independent Prediction Based on Longitudinal Multimodal Sensing,2024,2024-10-03,article,4,4.2677402,"Lea Berkemeier, W. Kamphuis, Anne-Marie Brouwer, et al.",IEEE Transactions on Affective Computing,False,2,prediction; random forest,M,1,multimodal,"Current sensors offering passive and continuous monitoring of behavioral patterns potentially enable real-time affective state monitoring. Previous research on affective state prediction with multimodal sensing in daily life has shown only small-to-moderate effects. One reason for this limited success might be the large variability across individuals. Current research is often of short duration, preventing proper within-individual modeling. With an extensive longitudinal data collection of nine months, this research focuses on individual-level predictions of valence and arousal in daily life. Sixteen PhD candidates from The Netherlands provided data about their affective states (self-reported valence and arousal), physiology (Oura rings) and behavioral patterns (AWARE framework for mobile phone data). Supporting our hypothesis, subject-dependent random forest (RF) models significantly outperformed subject-independent leave-one-subject-out (LOSO) models in predicting self-reported valence and arousal. The subject-dependent models achieved an average Spearman's rho correlation of 0.30 [0.14-0.60] for valence and 0.36 [0.16-0.69] for arousal. In many cases, participants’ a priori indicated informative sources matched with the feature importance. Making use of participants’ self-knowledge might thus help to reduce the amount of data to be collected. For future work, longer-term changes in affective state and combinations of features for estimating real behavioral patterns should be explored."
https://openalex.org/W4226094428,https://doi.org/10.1007/978-3-030-94212-0_10,Your Smartphone Knows you Better than you May Think: Emotional Assessment ‘on the Go’ Via TapSense,2022,2022-01-01,book-chapter,7,4.1999044,"Surjya Ghosh, Johanna Löchner, Bivas Mitra, et al.",Health informatics,False,2,machine learning; auc,M,1,smartphone,"Abstract Quality of life (QoL) is a subjective term often determined by various aspects of living, such as personal well-being, health, family, and safety. QoL is challenging to capture objectively but can be anticipated through a person’s emotional state; especially positive emotions indicate an increased QoL and may be a potential indicator for other QoL aspects (such as health, safety). Affective computing is the study of technologies that can quantitatively assess human emotions from external clues. It can leverage different modalities including facial expression, physiological responses, or smartphone usage patterns and correlate them with the person’s life quality assessments. Smartphones are emerging as a main modality, mostly because of their ubiquitous availability and use throughout daily life activities. They include a plethora of onboard sensors (e.g., accelerometer, gyroscope, GPS) and can sense different user activities passively (e.g., mobility, app usage history). This chapter presents a research study (here referred to as the TapSense study) that focuses on assessing the individual’s emotional state from the smartphone usage patterns. In this TapSense study, the keyboard interaction of n = 22 participants was unobtrusively monitored for 3 weeks to determine the users’ emotional state (i.e., happy, sad, stressed, relaxed) using a personalized machine learning model. TapSense can assess emotions with an average AUCROC of 78%(±7% std). We summarize the findings and reflect upon these in the context of the potential developments within affective computing at large, in the long term, indicating a person’s quality of life."
https://openalex.org/W4398141231,https://doi.org/10.2196/47805,"Framework for Ranking Machine Learning Predictions of Limited, Multimodal, and Longitudinal Behavioral Passive Sensing Data: Combining User-Agnostic and Personalized Modeling",2024,2024-05-20,article,2,4.0045695,"Tahsin Mullick, Sam Shaaban, Ana Radović, et al.",JMIR AI,False,2,machine learning; prediction,M,1,multimodal,The FLMS aims to fill the gap that currently exists when modeling passive sensor data with a small number of data points. It achieves this through leveraging both user-agnostic and personalized modeling techniques in tandem with an effective ranking strategy to filter predictions.
https://openalex.org/W4400064792,https://doi.org/10.48550/arxiv.2406.17181,FacePsy: An Open-Source Affective Mobile Sensing System -- Analyzing Facial Behavior and Head Gesture for Depression Detection in Naturalistic Settings,2024,2024-06-24,preprint,1,2.8849344,"Rahul Islam, Sang Won Bae",arXiv (Cornell University),False,2,prediction; regression model,M,1,smartphone,"Depression, a prevalent and complex mental health issue affecting millions worldwide, presents significant challenges for detection and monitoring. While facial expressions have shown promise in laboratory settings for identifying depression, their potential in real-world applications remains largely unexplored due to the difficulties in developing efficient mobile systems. In this study, we aim to introduce FacePsy, an open-source mobile sensing system designed to capture affective inferences by analyzing sophisticated features and generating real-time data on facial behavior landmarks, eye movements, and head gestures -- all within the naturalistic context of smartphone usage with 25 participants. Through rigorous development, testing, and optimization, we identified eye-open states, head gestures, smile expressions, and specific Action Units (2, 6, 7, 12, 15, and 17) as significant indicators of depressive episodes (AUROC=81%). Our regression model predicting PHQ-9 scores achieved moderate accuracy, with a Mean Absolute Error of 3.08. Our findings offer valuable insights and implications for enhancing deployable and usable mobile affective sensing systems, ultimately improving mental health monitoring, prediction, and just-in-time adaptive interventions for researchers and developers in healthcare."
https://openalex.org/W4381248680,https://doi.org/10.48550/arxiv.2306.09753,A context model for collecting diversity-aware data,2023,2023-06-16,preprint,0,1.3139366,"Matteo Busso, Xiaoyue Li",arXiv (Cornell University),False,2,artificial intelligence; ann,M,1,smartphone,"Diversity-aware data are essential for a robust modeling of human behavior in context. In addition, being the human behavior of interest for numerous applications, data must also be reusable across domain, to ensure diversity of interpretations. Current data collection techniques allow only a partial representation of the diversity of people and often generate data that is difficult to reuse. To fill this gap, we propose a data collection methodology, within a hybrid machine-artificial intelligence approach, and its related dataset, based on a comprehensive ontological notion of context which enables data reusability. The dataset has a sample of 158 participants and is collected via the iLog smartphone application. It contains more than 170 GB of subjective and objective data, which comes from 27 smartphone sensors that are associated with 168,095 self-reported annotations on the participants context. The dataset is highly reusable, as demonstrated by its diverse applications."
https://openalex.org/W4416679404,https://doi.org/10.36227/techrxiv.176403977.77890479/v1,Multimodal Passive Digital Biomarkers for ADHD Classification and Subtype Discovery,2025,2025-11-25,article,0,1.017382,"Saumya Yadav, Aditya Upadhyay, Jainendra Shukla",NA,False,2,classification; naive bayes,M,1,multimodal,"Attention-Deficit/Hyperactivity Disorder (ADHD) is a prevalent neurodevelopmental condition often complicated by comorbid anxiety. Traditional diagnostic methods rely heavily on subjective clinician interpretation and lack ecological validity. To address these challenges, we propose a multimodal framework using passive sensing of motor activity and heart rate variability (HRV) to improve ADHD characterisation and reveal neurobehavioural subgroups. We utilised the HYPERAKTIV dataset, which includes data from 103 participants (25 ADHD, 25 non-ADHD) with clinically validated diagnoses. We hypothesise that combining actigraphy and HRV enables a more comprehensive profiling of ADHD traits by capturing attentional dysregulation and emotional arousal in realworld contexts. Our results show that the multimodal model outperforms unimodal approaches, achieving an F1-score of 0.79 and a Matthews Correlation Coefficient of 0.51 using Bernoulli Naive Bayes, compared to 0.47 and 0.53 for the best unimodal models. We then apply clustering to uncover subtypes within the ADHD group based on Attention Deficit Disorder (ADD) and anxiety. This reveals two subgroups: one with low anxiety and another with heightened anxiety, both showing comparable levels of ADD. Interestingly, non-ADHD individuals, both with and without anxiety, overlapped primarily with the low-anxiety ADHD cluster, suggesting that this subtype reflects a more general behavioural-physiological profile. These findings demonstrate the potential of passive digital biomarkers for objective, ecologically valid assessment and personalised phenotyping in neurodevelopmental disorders."
https://openalex.org/W3180128024,https://doi.org/10.48550/arxiv.2107.04137,Exploring Post COVID-19 Outbreak Intradaily Mobility Pattern Change in College Students: a GPS-focused Smartphone Sensing Study,2021,2021-07-08,preprint,0,0.9267172,"Congyu Wu, Hagen Fritz, Cameron Craddock, et al.",arXiv (Cornell University),False,2,predictive modeling; predictive,M,1,smartphone,"With the outbreak of the COVID-19 pandemic in 2020, most colleges and universities move to restrict campus activities, reduce indoor gatherings and move instruction online. These changes required that students adapt and alter their daily routines accordingly. To investigate patterns associated with these behavioral changes, we collected smartphone sensing data using the Beiwe platform from two groups of undergraduate students at a major North American university, one from January to March of 2020 (74 participants), the other from May to August (52 participants), to observe the differences in students' daily life patterns before and after the start of the pandemic. In this paper, we focus on the mobility patterns evidenced by GPS signal tracking from the students' smartphones and report findings using several analytical methods including principal component analysis, circadian rhythm analysis, and predictive modeling of perceived sadness levels using mobility-based digital metrics. Our findings suggest that compared to the pre-COVID group, students in the mid-COVID group generally (1) registered a greater amount of midday movement than movement in the morning (8-10am) and in the evening (7-9pm), as opposed to the other way around; (2) exhibited significantly less intradaily variability in their daily movement, and (3) had a significant lower correlation between their mobility patterns and negative mood."
https://openalex.org/W4382725939,https://doi.org/10.12720/jait.14.3.559-570,Crowdsensing: Assessment of Cognitive Fitness Using Machine Learning,2023,2023-01-01,article,0,0.35892737,"Samin Ahsan Tausif, Aysha Gazi Mouri, Ishfaq Rahman, et al.",Journal of Advances in Information Technology,False,2,machine learning; regression model,M,1,smartphone,"The expanded use of smartphones and the Internet of Things have enabled the usage of mobile crowdsensing technologies to improve public health care in clinical sciences.Mobile crowdsensing enlightens a new sensing pattern that can reliably differentiate individuals based on their cognitive fitness.In previous studies on this domain, the visual correlation has not been illustrated between physiological functions and the mental fitness of human beings.Therefore, there exists potential gaps in providing mathematical evidence of correlation between physical activities & cognitive health.Moreover, empirical analysis of autonomous smartphone sensing to assess mental health is yet to be researched on a large scale, showing the correspondence between ubiquitous mobile sensors data and Patient Health Questionnaire-9 (PHQ-9) depression scales.This research systematically collects mobile sensors' data along with standard PHQ-9 questionnaire data and utilizes traditional machine learning techniques (Supervised and Unsupervised) for performing necessary analysis.Moreover, we have conducted statistical t-tests to find similarities or to differentiate between people of distinct cognitive fitness levels.This research has successfully demonstrated the numerical evidence of correlations between physiological activities and the cognitive fitness of human beings.The Fine-tuned regression models built for the purpose of predicting users' cognitive fitness score, perform accurately to a certain extent.In this analysis, crowdsensing is perceived to differentiate several people's cognitive fitness levels comprehensively.Furthermore, our study has addressed a significant insights to assessing people's mental fitness by relying upon their smartphone usage."
https://openalex.org/W2321609854,https://doi.org/10.2196/jmir.5505,Mobile Phone-Based Unobtrusive Ecological Momentary Assessment of Day-to-Day Mood: An Explorative Study,2016,2016-03-29,article,213,31.27867,"Joost Asselbergs, Jeroen Ruwaard, Michal Ejdys, et al.",Journal of Medical Internet Research,False,2,data mining; prediction,M,0,,"Mobile phone-based unobtrusive EMA is a technically feasible and potentially powerful EMA variant. The method is young and positive findings may not replicate. At present, we do not recommend the application of FSR-based mood prediction in real-world clinical settings. Further psychometric studies and more advanced data mining techniques are needed to unlock unobtrusive EMA's true potential."
https://openalex.org/W2739036537,https://doi.org/10.1371/journal.pone.0184604,Meaningless comparisons lead to false optimism in medical machine learning,2017,2017-09-26,article,69,29.736698,"Orianna DeMasi, Konrad P. Körding, Benjamin Recht",PLoS ONE,False,2,machine learning; algorithm,M,0,,"A new trend in medicine is the use of algorithms to analyze big datasets, e.g. using everything your phone measures about you for diagnostics or monitoring. However, these algorithms are commonly compared against weak baselines, which may contribute to excessive optimism. To assess how well an algorithm works, scientists typically ask how well its output correlates with medically assigned scores. Here we perform a meta-analysis to quantify how the literature evaluates their algorithms for monitoring mental wellbeing. We find that the bulk of the literature (∼77%) uses meaningless comparisons that ignore patient baseline state. For example, having an algorithm that uses phone data to diagnose mood disorders would be useful. However, it is possible to explain over 80% of the variance of some mood measures in the population by simply guessing that each patient has their own average mood-the patient-specific baseline. Thus, an algorithm that just predicts that our mood is like it usually is can explain the majority of variance, but is, obviously, entirely useless. Comparing to the wrong (population) baseline has a massive effect on the perceived quality of algorithms and produces baseless optimism in the field. To solve this problem we propose ""user lift"" that reduces these systematic errors in the evaluation of personalized medical monitoring."
https://openalex.org/W3045066320,https://doi.org/10.2196/19962,Predicting Early Warning Signs of Psychotic Relapse From Passive Sensing Data: An Approach Using Encoder-Decoder Neural Networks,2020,2020-07-24,article,107,21.087564,"Daniel A. Adler, Dror Ben‐Zeev, Vincent W.-S. Tseng, et al.",JMIR mhealth and uhealth,False,2,neural network; neural networks,M,0,,Our proposed method predicted a higher rate of anomalies in patients with SSDs within the 30-day near relapse period and can be used to uncover individual-level behaviors that change before relapse. This approach will enable technologists and clinicians to build unobtrusive digital mental health tools that can predict incipient relapse in SSDs.
https://openalex.org/W3216936753,https://doi.org/10.1038/s41598-021-03423-4,Social Media Discussions Predict Mental Health Consultations on College Campuses,2022,2022-01-07,article,46,16.493288,"Koustuv Saha, Asra Yousuf, Ryan L. Boyd, et al.",Scientific Reports,False,2,machine learning; prediction,M,0,,"The mental health of college students is a growing concern, and gauging the mental health needs of college students is difficult to assess in real-time and in scale. To address this gap, researchers and practitioners have encouraged the use of passive technologies. Social media is one such ""passive sensor"" that has shown potential as a viable ""passive sensor"" of mental health. However, the construct validity and in-practice reliability of computational assessments of mental health constructs with social media data remain largely unexplored. Towards this goal, we study how assessing the mental health of college students using social media data correspond with ground-truth data of on-campus mental health consultations. For a large U.S. public university, we obtained ground-truth data of on-campus mental health consultations between 2011-2016, and collected 66,000 posts from the university's Reddit community. We adopted machine learning and natural language methodologies to measure symptomatic mental health expressions of depression, anxiety, stress, suicidal ideation, and psychosis on the social media data. Seasonal auto-regressive integrated moving average (SARIMA) models of forecasting on-campus mental health consultations showed that incorporating social media data led to predictions with r = 0.86 and SMAPE = 13.30, outperforming models without social media data by 41%. Our language analyses revealed that social media discussions during high mental health consultations months consisted of discussions on academics and career, whereas months of low mental health consultations saliently show expressions of positive affect, collective identity, and socialization. This study reveals that social media data can improve our understanding of college students' mental health, particularly their mental health treatment needs."
https://openalex.org/W2768276157,https://doi.org/10.18122/b20q5r,Academic performance prediction in a gender-imbalanced environment,2018,2018-04-07,dataset,23,14.98576,"Piotr Sapieżyński, Valentin Kassarnig, Christo Wilson",NA,False,2,prediction; predictive,M,0,,"Individual characteristics and informal social processes are among the factors that contribute to a student’s performance in an academic context. Universities can leverage this knowledge to limit drop-out rates and increase performance through interventions targeting at-risk students. Data-driven recommendation systems have been proposed to identify such students for early interventions. However, as we show in this paper, it is possible to identify certain groups of students whose performance is best predicted using indicators that differ from those predictive for the majority. Naïve approaches that do not account for this fact might favor the majority class and lead to disparate mistreatment in the case of minorities. In this paper we investigate the low academic performance predictors of female and male participants of the Copenhagen Networks Study. We find that social indicators (e.g. mean grade point average of peers or fraction of low-performing peers) predict lowperformance of male participants more accurately than they do for female participants, and that this situation is reversed for individual behaviors. Because of the gender imbalance among the participants, optimal gender-oblivious models detect low-performing male students with higher accuracy than low-performing female students. We review the existing approaches to addressing the disparate mistreatment problem and propose our own method that outperforms the alternatives on the dataset in question."
https://openalex.org/W3216016203,https://doi.org/10.2147/ndt.s339412,Screening for Depression in Mobile Devices Using Patient Health Questionnaire-9 (PHQ-9) Data: A Diagnostic Meta-Analysis via Machine Learning Methods,2021,2021-11-01,article,18,9.802681,"Sunhae Kim, Kounseok Lee",Neuropsychiatric Disease and Treatment,False,2,machine learning; algorithm,M,0,,"Through various machine learning algorithm techniques, it was possible to confirm that PHQ-9 depression screening in mobiles is an effective diagnostic tool when integrated into a diagnostic meta-analysis."
